RawParagraph,RespAPrediction
"Φροντίζει για την εκκαθάριση των μισθοδοτικών κατα- στάσεων (ταμεία εργαζομένων, δάνεια, εξαγορές κ.λπ.).",RespA
Συντάσσει τις βεβαιώσεις αποδοχών του προσωπικού για την Εφορία και παραδίδει στο τέλος κάθε χρόνου την οριστική δήλωση αποδοχών στην Δ.Ο.Υ.,RespA
Τηρεί αρχείο για όλες τις μισθοδοσίες του προσωπικού παρελθόντων ετών.,RespA
- Γραφείο Λογιστηρίου,Non-RespA
"α) Τηρεί τα λογιστικά και διαχειριστικά βιβλία και τα λοιπά βοηθητικά βιβλία που καθορίζουν οι διατάξεις για την οικονομική διοίκηση και το λογιστικό των Δήμων και Κοινοτήτων, καθώς και τις απορρέουσες εργασίες.",RespA
β) Παρακολουθεί τις πιστώσεις του προϋπολογισμού (έσοδα - έξοδα) και έγκαιρα εισηγείται για την ενίσχυση των πιστώσεων που είναι σε ανεπάρκεια και γενικά δια- τυπώνει προ- βλέψεις για τα αποτελέσματα της εκτέλε- σης του και εισηγείται για τυχόν συγκράτηση δαπανών.,RespA
"γ) Τηρεί ιδιαίτερο φάκελο για κάθε κεφάλαιο του προϋ- πολογισμού εσόδων - εξόδων που περιλαμβάνει και τις σχετικές διατάξεις (νόμους, διατάγματα, αποφάσεις κ.λπ.).",RespA
"δ) Καταρτίζει και υποβάλλει στον Πρόεδρο, το Δ.Σ. και το Ελεγκτικό Συνέδριο τους ετήσιους λογαριασμούς διαχείρισης των εσόδων και εξόδων του Οργανισμού.",RespA
ε) Τηρεί βιβλίο πιστωτών του Οργανισμού.,RespA
στ) Συντάσσει τον Απολογισμό του Οργανισμού και τον υποβάλλει στον-στην υπεύθυνο-η Τμηματάρχη προκει- μένου να εγκριθεί από το Δ.Σ. και το Δημοτικό Συμβούλιο.,RespA
"ζ) Παρακολουθεί τα έσοδα του Οργανισμού που προ- έρχονται από τις επιχορηγήσεις του Δήμου Ρόδου, ή άλλων φορέων του Δημοσίου ή ιδιωτών, τις εισπράξεις από τους Παιδικούς Σταθμούς και το Κέντρο Παροχής Συμβουλευτικών Υπηρεσιών και ενημερώνει τον-την Τμηματάρχη για την πορεία των εσόδων - εξόδων.\",RespA
η) Τηρεί την εφαρμογή του διπλογραφικού λογιστικού συστήματος και του δημόσιου λογιστικού.,RespA
"θ) Παρακολουθεί και συντάσσει όλα τα σχετικά έγγρα- φα τα σχετιζόμενα με την Δ.Ο.Υ., Δημόσιο, ΙΚΑ, Ταμεία κ.λπ.",RespA
-Γραφείο Προμηθειών διαχείρισης υλικών και Αποθή-κης,Non-RespA
"α) Το Γραφείο Προμηθειών έχει γενικό αντικείμενο την τήρηση των σχετικών διαδικασιών για την προμή-θεια των απαιτούμενων υλικών για την λειτουργία τηςυπηρεσίας, την προμήθεια μηχανημάτων, επίπλων και παγίων στοιχείων του Οργανισμού, την προμήθεια των τροφίμων των Παιδικών σταθμών, του συσσιτίου κ.λπ.",RespA
β) Εισηγείται τη εκποίηση ή καταστροφή του άχρη-στου υλικού.,RespA
"γ) Μεριμνά για την παραλαβή, τον έλεγχο, την αποθή-κευση, φύλαξη και συντήρηση των υλικών και εφοδίων με τρόπο ώστε να εξασφαλίζεται η καλή και αποδοτική λειτουργία της υπηρεσίας. Καταρτίζει πρόγραμμα ορ-θολογιστικής διαχείρισης της αποθήκης. Επιμελείται της διαδικασίας εισαγωγής και εξαγωγής υλικών από την αποθήκη και την διακίνησή τους με τα απαραίτητα πα-ραστατικά και με συγκροτημένο μηχανογραφικό σχέδιο.",RespA
"δ) Τηρεί βιβλίο περιουσίας - εξοπλισμού του Οργανι-σμού. Μεριμνά για την εκποίηση άχρηστου ή παλαιού υλικού, αφού πρώτα συγκροτηθεί επιτροπή η οποία θα αποφασίσει για το υλικό αυτό και θα ενεργήσει για την επωφελέστερη αξιοποίηση ή την νομότυπη καταστροφή του.",RespA
Β2. Τμήμα Ταμείου,Non-RespA
Προΐσταται τμηματάρχης που εποπτεύει και συντονίζει τη λειτουργία του τμήματο,RespA
- Ο Ταμίας εισπράττει και παρακολουθεί ο ίδιος τα έσοδα που προβλέπονται στον ετήσιο Προϋπολογισμό.,RespA
"- Εξοφλεί τα χρηματικά εντάλματα μέσα στο όρια του προϋπολογισμού και των συναφών αποφάσεων του Δ.Σ. και της Ε.Ε.
",RespA
"- Ελέγχει, βοηθούμενος από τους αρμόδιους υπαλλή- λους της Υπηρεσίας, με δική του προσωπική ευθύνη τη νομιμότητα και εγκυρότητα των εκτελουμένων δαπανών και προβαίνει στην πληρωμή των δικαιούχων.",RespA
- Είναι δικαιούχος και υπόλογος της πάγιας προκατα- βολής.,RespA
- Τηρεί τα από τον νόμο προβλεπόμενα λογιστικά και ταμειακά βιβλία.,RespA
"- Τηρεί λογαριασμό στο όνομα του Οργανισμού σε Τράπεζα που ορίζει το Δ.Σ. του Οργανισμού, εκδίδει και προσυπογράφει τις απαιτούμενες επιταγές μαζί με τον Πρόεδρο του Οργανισμού για την εξόφληση χρηματικών ενταλμάτων. Για το σκοπό αυτό έχει κωδικούς e-banking τράπεζας για την ταχύτερη διεκπεραίωση των οικονο- μικών υποθέσεων.",RespA
- Μεριμνά για την απόδοση των υπέρ τρίτων κρατή- σεων που αντιστοιχούν στα επί μέρους εντάλματα πλη- ρωμής.,RespA
Β3. Τμήμα Κοινωνικών Υπηρεσιών,Non-RespA
Έχει την ευθύνη εφαρμογής προγραμμάτων κοινωνι- κών παροχών στον Δ.Ο.Π.,RespA
Διοργανώνει εκδηλώσεις και προγράμματα σε συ- νεργασία με τοπικούς ή άλλους Φορείς με σκοπό την ενημέρωση των κατοίκων σε θέματα κοινωνικού προ- βληματισμού.,RespA
"Τηρεί άμεση επαφή και συνεργάζεται συστηματικά με όλες τις κοινωνικές υπηρεσίες που λειτουργούν στην ευρύτερη περιοχή, το κέντρο παροχής συμβουλευτι- κών υπηρεσιών σε παιδιά εφήβους και τις οικογένειές τους με ψυχοκοινωνικά προβλήματα, βρεφονηπιακούς και παιδικούς σταθμούς, δημόσια νοσοκομεία, ιδιωτι-κές κλινικές,ΙΚΑ, ΟΑΕΔ κ.λπ.) για την εξυπηρέτηση της απώτερης αποστολής του.",RespA
Τηρεί και ενημερώνει καταστάσεις και ειδικούς φακέ-λους με τα άτομα ή τις οικογένειες που αντιμετωπίζουν προβλήματα και έχουν ανάγκη ιδιαίτερης κοινωνικής φροντίδας.,RespA
"Εισηγείται στον Πρόεδρο, το Δ.Σ. και την Εκτελεστική Επιτροπή άμεσα ή έμμεσα, τις περιπτώσεις που ο Δ.Ο.Π., πρέπει να ενεργήσει για την εξ’ ιδίων παροχή βοήθειας σε χρήμα, σε φάρμακα, συσσίτιο, για την οποία θα απαι-τηθεί διαδικασία οικονομικής επιβάρυνσής του.",RespA
Ενημερώνει τις αρμόδιες αρχές για τα προγράμματα κοινωνικής πολιτικής του Δ.Ο.Π. και επιδιώκει την ενί-σχυση και συμπαράσταση τους στην υλοποίηση αυτών.,RespA
"Οι υποθέσεις που ανάγονται σε προσωπικά ή οικο-γενειακά ζητήματα αναξιοπαθούντων γενικά ατόμων,θεωρούνται εμπιστευτικές, γι’ αυτό ο υπάλληλος που τις χειρίζεται στο μέτρο της αρμοδιότητάς του, δεσμεύεται και μέσα και έξω από την υπηρεσία του με το απόρρητο αυτών, μη εξαιρουμένων και των προϊσταμένων του.",RespA
Το τμήμα εκπαιδεύει τελειόφοιτους κοινωνικούς λει-τουργούς σε συνεργασία με τη σχολή στα ΑΤΕΙ.,RespA
Τις ως άνω αρμοδιότητες ασκεί υποχρεωτικά ο υπάλ-ληλος που έχει την ιδιότητα του Κοινωνικού Λειτουργού.,RespA
Β4. Τμήμα Υγειονομικών Υπηρεσιών,Non-RespA
"Έχει την ευθύνη της ιατρικής περίθαλψης των δημοτώνκαι ειδικότερα στην άμεση αντιμετώπιση: αναγκών προ-ληπτικής ιατρικής, έγκαιρης διάγνωσης, υγειονομικής διαφώτισης (έιτζ, ναρκωτικά, κάπνισμα, διατροφή κ.λπ.), θέματα οικογενειακού προγραμματισμού, ατόμων με ειδικές ανάγκες, προληπτικής οδοντιατρικής, καρδιακών προβλημάτων, προληπτικής παιδιατρικής, πρωτοβάθμι-ας περίθαλψης κ.λπ.",RespA
Συνεργάζεται με το Γενικό Νοσοκομείο Ρόδου και τους άλλους Φορείς δημόσιας υγείας.,RespA
Ο Προϊστάμενος συντονίζει την λειτουργία των δη-μοτικών ιατρείων και έχει την ευθύνη του ιατρικού και νοσηλευτικού προσωπικού.,RespA
Β5. Τμήμα Προσχολικής Αγωγής,Non-RespA
Έχει την ευθύνη της λειτουργίας του Παιδικού Σταθμού «Μ. Καβαρινού» και του Κοινοτικού Προσχολικού Κέ-ντρου Αγίων Αποστόλων για το παιδί και την οικογένεια.,RespA
"Παρέχεται ενιαία προσχολική αγωγή σύμφωνα με τα πλέον σύγχρονα επιστημονικά δεδομένα, έτσι ώστε τα παιδιά να αναπτυχθούν ολόπλευρα σωματικά, νοητι-
κά, συναισθηματικά και κοινωνικά, συμβάλλοντας στην ομαλή μετάβασή τους από το οικογενειακό στο σχολικό περιβάλλον.",RespA
Βοήθεια και ευαισθητοποίηση των γονέων σε θέματα σύγχρονης παιδαγωγικής και ψυχολογίας.,RespA
"Παρέχεται ημερήσια διατροφή και φροντίδα στα παι-διά που φιλοξενούνται, τηρώντας τους κανόνες υγιεινής και ασφάλειας.",RespA
"Συνεργάζεται με τα υπόλοιπα τμήματα του Ο.Ε.Υ. του Ιδρύματος π.χ. α) Κοινωνικών Υπηρεσιών, β) Υγειονομικών Υπηρεσι-ών για την καλύτερη λειτουργία του τμήματος και του γ) Κέντρου Παροχής Συμβουλευτικών Υπηρεσιών παι-διών, εφήβων και των οικογενειών τους με ψυχοκοινω-νικά προβλήματα.",RespA
"Ευθύνη του υπεύθυνου του τμήματος, είναι και η εί- σπραξη του αντίστοιχου χρηματικού ποσού που προ- βλέπεται στον κανονισμό λειτουργίας.",RespA
"Β6. Τμήμα Κέντρου Παροχής Συμβουλευτικών Υπη-ρεσιών σε παιδιά, εφήβους και τις οικογένειες τους που αντιμετωπίζουν ψυχοκοινωνικά προβλήματα.",RespA
"Παρέχει υπηρεσίες σε παιδιά με ηλικία από 0-17 ετών, με προβλήματα, όπως ψυχικές διαταραχές, νοητικών λειτουργιών, διαταραχές στην ανάπτυξη (δυσλεξία, μα- θησιακές δυσκολίες, προβλήματα ακοής, λόγου), ψυχο- κοινωνικά.",RespA
"Οι δραστηριότητες του υλοποιούνται μέσα από την λειτουργία της διεπιστημονικής ομάδας (Παιδοψυ- χιάτρου - Αναπτυξιολόγου - Ψυχολόγου - Κοινωνικού Λειτουργού, Ειδικού Παιδαγωγού, Λογοθεραπευτή) και είναι:",RespA
- Έγκαιρη διάγνωση ψυχικών διαταραχών,RespA
- Αντιμετώπιση και θεραπεία όλου του φάσματος των ψυχικών διαταραχών,RespA
"- Αντιμετώπιση επειγόντων καταστάσεων, παρέμβαση στο σπίτι, στο σχολείο και αλλού (νοσοκομείο, εισαγγελία ανηλίκων).",RespA
"Διεπιστημονικές συνεργασίες για τα περιστατικά με στόχο την αλληλοενημέρωση, την ολοκληρωμένη δι- άγνωση - αξιολόγηση σύνθετων περιστατικών και την χάραξη κοινών θεραπευτικών στόχων.",RespA
"- Συνεργασία με ιδρύματα, σχολεία, παιδικούς σταθ- μούς,συλλόγους κ.λπ.",RespA
- Αξιολόγηση νηπίων στους παιδικούς σταθμούς και νηπιαγωγεία του Δήμου Ρόδου,RespA
"Με ευθύνη της Γραμματείας του Τμήματος τηρείται αρχείο το οποίο είναι εμπιστευτικό, και τηρείται επίσης το ημερήσιο πρόγραμμα των συνεδριών. Ευθύνη επίσης της Γραμματείας είναι και η είσπραξη του αντίστοιχου χρηματικού ποσού που προβλέπεται στον κανονισμό λειτουργίας.",RespA
Το τμήμα εκπαιδεύει τελειόφοιτους λογοθεραπευτές σε συνεργασία με τη σχολή στα ΑΤΕΙ.,RespA
Άρθρο 3,Non-RespA
"Οι θέσεις του πάσης φύσεως προσωπικού του Ιδρύ- ματος διαρθρώνονται κατά κλάδους, βαθμούς και ειδι- κότητες, ως ακολούθως:",Non-RespA
"- Προσωπικό που η πρόσληψή του θα διενεργείται σύμ- φωνα με τις διατάξεις του άρθρου 11 του ν. 1649/1986 (Α΄ 149), όπως τροποποιήθηκε με το άρθρο 18 του ν. 1868/1989 (Α΄ 230). Μία (1) θέση δικηγόρου.",Non-RespA
"- Προσωπικό που διέπεται από τους ν. 3584/2007, 2190/1994, του π.δ. 164/2004, όπως αυτοί τροποποιή- θηκαν και εκάστοτε ισχύουν, σχετικά με το προσωπικό Οργανισμών Τοπικής Αυτοδιοίκησης.",Non-RespA
1. ΜΟΝΙΜΟ ΠΡΟΣΩΠΙΚΟ Οργανικές θέσεις,Non-RespA
"Κλάδος ΠΕ15 Ιατρών Ειδικοτήτων (Γενικής Ιατρικής, Παθολόγοι, Παιδίατροι, Παιδοψυχί-ατροι, Αναπτυξιολόγοι)",Non-RespA
6 Κλάδος ΠΕ Κοινωνιολόγων,Non-RespA
1 Κλάδος ΠΕ Διοικητικού,Non-RespA
Οικονομικού 1 (Εσωτερικού Ελέγχου),Non-RespA
Κλάδος ΠΕ Νηπιαγωγών 1,Non-RespA
Κλάδος ΠΕ Λογοθεραπευτών 1  Κλάδος ΠΕ Ειδικών Παιδαγωγών 1 Κλάδος ΠΕ Ψυχολόγων 1 Κλάδος ΠΕ ή ΤΕ Κοινωνικής Εργασίας 2 Κλάδος ΤΕ Βρεφονηπιοκόμων 2 Κλάδος ΤΕ Διοικητικού - Λογιστικού 2 Κλάδος ΤΕ Νοσηλευτών 1 Κλάδος ΤΕ Κοινωνικών Λειτουργών 3 Κλάδος ΤΕ Ηλεκτρολόγων - Μηχανικών 1 Κλάδος ΤΕ Πληροφορικής 1,Non-RespA
Κλάδος ΔΕ Οδηγών αυτοκινήτων 2 Κλάδος ΔΕ Μαγείρων 3 Κλάδος ΔΕ Β. Βρεφονηπιοκόμων 1 Κλάδος ΔΕ Βοηθών Νοσηλευτών 2 Κλάδος ΔΕ Διοικητικού 6 Κλάδος ΔΕ Τεχνιτών 1 (Ελαιοχρωματιστών) Κλάδος ΥΕ Κλητήρων 2 Κλάδος ΥΕ Εργατών - Καθαριότητας 6 Κλάδος ΥΕ Εργατών Γενικών καθηκόντων 1 Σύνολο θέσεων: 48,Non-RespA
"Κατ. ΠΕ:14, κατ. TE 10, κατ. ΔΕ:15, κατ. ΥΕ:9 2. ΜΟΝΙΜΕΣ ΠΡΟΣΩΡΙΝΕΣ ΣΥΝΙΣΤΩΜΕΝΕΣ 2 ΘΕΣΕΙΣ 3. ΠΡΟΣΩΡΙΝΕΣ ΣΥΝΙΣΤΩΜΕΝΕΣ ΙΔΙΩΤΙΚΟΥ ΔΙΚΑΙΟΥ ΑΟΡΙΣΤΟΥ ΧΡΟΝΟΥ 2 ΘΕΣΕΙΣ",Non-RespA
"4. ΟΡΓΑΝΙΚΕΣ ΙΔΙΩΤΙΚΟΥ ΔΙΚΑΙΟΥ ΑΟΡΙΣΤΟΥ ΧΡΟΝΟΥ 30 ΘΕΣΕΙΣ5. ΕΠΟΧΙΑΚΟ ΠΡΟΣΩΠΙΚΟ ΟΡΙΣΜΕΝΟΥ ΧΡΟΝΟΥ 25 ΘΕΣΕΙΣ1. Οι παραπάνω Μόνιμες Οργανικές θέσεις κατανέμο-νται στα Τμήματα, ως εξής: Γραφείο Προγραμματισμού, Οργάνωσης και Εσωτε-ρικού Ελέγχου Κλάδος ΠΕ Διοικητικού - Οικονομικού Μία (1) θέση με βαθμούς Δ - Α Κλάδος ΠΕ Κοινωνιολόγων Μία (1) θέση με βαθμούς Δ - Α Κλάδος ΤΕ Πληροφορικής Μία (1) θέση με βαθμούς Δ - Α Κλάδος ΤΕ Ηλεκτρολόγων - Μηχανικών Μία (1) θέση με βαθμούς Δ - Α Σύνολο οργανικών θέσεων: 4 Τμήμα Διοικητικών και Οικονομικών Υπηρεσιών Κλάδος ΤΕ Διοικητικού - Λογιστικού Μία (1) θέση με βαθμούς Δ - Α Κλάδος ΔΕ Διοικητικού Τέσσερις (4) θέσεις με βαθμούς Δ - ΑΚλάδος ΔΕ Οδηγών αυτοκινήτωνΜία (1) θέση με βαθμούς Δ - Α Κλάδος ΔΕ Τεχνιτών (Ελαιοχρωματιστών) Μία (1) θέση με βαθμούς Δ - Α Κλάδος ΥΕ κλητήρων Μία (1) θέση με βαθμούς Ε - Β",Non-RespA
Κλάδος ΥΕ εργατών καθαριότητας Τρεις (3) θέσεις με βαθμούς Ε-Β Σύνολο οργανικών θέσεων: 11,Non-RespA
ΤΜΗΜΑ ΤΑΜΕΙΟΥ Κλάδος ΤΕ Διοικητικού - Λογιστικού Μία (1) θέση με βαθμούς Δ - ΑΚλάδος ΔΕ Διοικητικού Δύο (2) θέσεις με βαθμούς Δ - Α Κλάδος ΥΕ κλητήρωνΜία (1) θέση με βαθμούς Ε - Β Σύνολο οργανικών Θέσεων: 4,Non-RespA
Τμήμα Κοινωνικών Υπηρεσιών Κλάδος ΠΕ ή ΤΕ Κοινωνικής Εργασίας Μία (1) θέση με βαθμούς Δ - Α Κλάδος ΤΕ Κοινωνικών Λειτουργών Τρεις (3) θέσεις με βαθμούς Δ - Α Κλάδος ΔΕ ΜαγείρωνΔύο (2) θέσεις με βαθμούς Δ - Α Κλάδος ΔΕ Οδηγών Αυτοκινήτων Μία (1) θέση με βαθμούς Δ - Α Κλάδος ΥΕ Εργατών γεν. καθηκόντων Μία (1) θέση με βαθμούς Ε - Β Σύνολο οργανικών Θέσεων: 8,Non-RespA
"Τμήμα Υγειονομικών Υπηρεσιών Κλάδος ΠΕ Ιατρών Ειδικοτήτων (Γενικής Ιατρικής, Πα-θολόγοι, Καρδιολόγοι κ.λπ.) Τρεις (3) θέσεις με βαθμούς Δ - Α Κλάδος ΤΕ Νοσηλευτών Μία (1) θέση με βαθμούς Δ - Α Κλάδος ΔΕ Βοηθών Νοσηλευτών Δύο (2) θέσεις με βαθμούς Δ - Α Σύνολο οργανικών Θέσεων: 6",Non-RespA
"Τμήμα Προσχολικής Αγωγής Κλάδος ΠΕ Νηπιαγωγών Μία (1) θέση με βαθμούς Δ - Α Κλάδος ΤΕ Βρεφονηπιοκόμων
Σύο (2) θέσεις με βαθμούς Δ - Α
Κλάδος ΠΕ Παιδιάτρων
Μία (1) θέση με βαθμούς Δ - Α
Κλάδος ΔΕ Βοηθών Βρεφονηπιοκόμων
Μία (1) θέση με βαθμούς Δ - Α
Κλάδος ΔΕ Μαγείρων
Μία (1) θέση με βαθμούς Δ - Α
Κλάδος ΥΕ εργατών καθαριότητας
Τρεις (3) θέσεις με βαθμούς Ε - Β
Σύνολο οργανικών Θέσεων: 9",Non-RespA
"Τμήμα Κέντρου Παροχής Συμβουλευτικών Υπηρεσιών σε παιδιά, εφήβους και τις οικογένειες τους που αντιμε-τωπίζουν ψυχοκοινωνικά προβλήματα Κλάδος ΠΕ Ιατρών Ειδικοτήτων (Παιδοψυχίατρων, Αναπτυξιολόγων) Δύο (2) θέσεις με βαθμούς Δ-Α Κλάδος ΠΕ Ψυχολόγων Μία (1) θέση με βαθμούς Δ-Α Κλάδος ΠΕ Λογοθεραπευτών",Non-RespA
Μία (1) θέση με βαθμούς Δ - Α Κλάδος ΠΕ Ειδικών Παιδαγωγών Μία (1) θέση με βαθμούς Δ - Α Κλάδος ΠΕ ή ΤΕ Κοινωνικής Εργασίας Μία (1) θέση με βαθμούς Δ - Α Σύνολο οργανικών Θέσεων: 6 2. ΜΟΝΙΜΕΣ ΘΕΣΕΙΣ ΠΡΟΣΩΡΙΝΕΣ ΣΥΝΙΣΤΩΜΕΝΕΣ Μία (1) θέση κλάδου ΤΕ2 Κοινωνικών Λειτουργών Μία (1) θέση κλάδου ΠΕ Νηπιαγωγών Σύνολο Θέσεων: 2,Non-RespA
3. ΠΡΟΣΩΡΙΝΕΣ ΣΥΝΙΣΤΩΜΕΝΕΣ ΘΕΣΕΙΣ ΙΔΙΩΤΙΚΟΥ ΔΙΚΑΙΟΥ ΑΟΡΙΣΤΟΥ ΧΡΟΝΟΥ Μία (1) θέση κλάδου ΔΕ Διοικητικού Μία (1) θέση κλάδου ΠΕ Νηπιαγωγών Σύνολο Θέσεων:2,Non-RespA
"4. ΟΡΓΑΝΙΚΕΣ ΘΕΣΕΙΣ ΙΔΙΩΤΙΚΟΥ ΔΙΚΑΙΟΥ ΑΟΡΙΣΤΟΥ
ΧΡΟΝΟΥ Δύο (2) θέσεις κλάδου ΠΕ Ψυχολόγων Μία (1) θέση κλάδου ΠΕ Παιδοψυχολόγων Επτά (7) θέσεις κλάδου ΠΕ Νηπιαγωγών Μία (1) θέση κλάδου TE Κοινωνικών Λειτουργών Δύο (2) θέσεις κλάδου ΔΕ Διοικητικών Γραμματέων Δύο (2) θέσεις κλάδου ΔΕ Μαγείρων Έξι (6) θέσεις κλάδου ΔΕ Β. Βρεφοκόμων - Παιδοκόμων Δύο (2) θέσεις κλάδου ΔΕ Β. Νοσοκόμων Επτά (7) θέσεις κλάδου ΥΕ Καθαριστριών Σύνολο οργανικών Θέσεων: 30",Non-RespA
