,AlphaBulletCapDot,AlphaBulletCapPar,AlphaBulletDot,AlphaBulletPar,ArticleNo,Class,DigitBulletDot,DigitBulletPar,Filename,FirstPatternOffset,FirstWordInCapitalOffset,LongestMatchingPattern,MatchedPatternsCount,MatchingBigrams,MatchingUnigrams,OrgMatchingBigrams,OrgMatchingUnigrams,OrgPrediction,OrgTotalMatchingCharacters,PrevAlphaBulletCapDot,PrevAlphaBulletCapPar,PrevAlphaBulletDot,PrevAlphaBulletPar,PrevDigitBulletDot,PrevDigitBulletPar,RawParagraph,RawParagraphLength,RespAPrediction,StemmedParagraph,StemmedParagraphLength,SumMatchingEntries,SumMatchingEntriesLength,TotalMatchingCharacters,TotalMatchingRatio,TotalPrediction,UnqMatchedPatternsCount,UnqMatchingBigrams,UnqMatchingUnigrams,WordsInCapital
2099,0,0,0,1,13,NoIdea,0,0,20080100086.pdf,0,0,11,4,0,4,0,0,Non-Org,0,0,0,0,1,0,0,ηη) Η συγκέντρωση των απαραίτητων δικαιολογητικών και η προώθησή τους για εκκαθάριση.,85,RespA,ΗΗ ΣΥΓΚΕΝΤΡΩΣ ΑΠΑΡΑΙΤΗΤ ΔΙΚΑΙΟΛΟΓΗΤ ΠΡΟΩΘΗΣ ΕΚΚΑΘΑΡΙΣΗ.,55,52,454,37,0.6727272727,RespA,4,0,4,0
2100,0,0,0,1,13,NoIdea,0,0,20080100086.pdf,0,0,9,4,0,4,0,0,Non-Org,0,0,0,0,1,0,0,"θθ) Η επιμέλεια της κατάρτισης σε συνεργασία με τα 
υπόλοιπα τμήματα των οποιασδήποτε φύσεως απολογιστικών οικονομικών στοιχείων.",129,RespA,ΘΘ ΕΠΙΜΕΛΕΙ ΚΑΤΑΡΤΙΣ ΣΥΝΕΡΓΑΣ ΥΠΟΛΟΙΠ ΤΜΗΜ ΟΠΟΙΑΣΔΗΠΟΤ ΦΥΣ ΑΠΟΛΟΓΙΣΤ ΟΙΚΟΝΟΜ ΣΤΟΙΧΕΙΩΝ.,87,117,938,33,0.3793103448,RespA,4,0,4,0
2101,0,0,0,1,13,NoIdea,0,0,20080100086.pdf,0,7,17,1,1,0,0,0,Non-Org,0,0,0,0,1,0,0,"ιι) Αποζημιώσεις εκτός έδρας και αποζημιώσεις μελών 
Δ.Σ. και Υπηρεσιακού Συμβουλίου (Υ.Σ.).",92,RespA,ΙΙ ΑΠΟΖΗΜΙΩΣ ΕΔΡ ΑΠΟΖΗΜΙΩΣ ΜΕΛ Δ.Σ. ΥΠΗΡΕΣΙΑΚ ΣΥΜΒΟΥΛ Υ.Σ. .,60,6,102,17,0.2833333333,RespA,1,1,0,4
2102,0,0,0,1,13,NoIdea,0,0,20080100086.pdf,0,0,10,5,0,5,0,0,Non-Org,0,0,0,0,1,0,0,"ηη) Η επιμέλεια για την είσπραξη απαιτήσεων από καταλογιστικές πράξεις σε βάρος υπευθύνων υπολόγων 
από οποιαδήποτε αιτία.",122,RespA,ΗΗ ΕΠΙΜΕΛΕΙ ΕΙΣΠΡΑΞ ΑΠΑΙΤΗΣ ΚΑΤΑΛΟΓΙΣΤ ΠΡΑΞ ΒΑΡ ΥΠΕΥΘΥΝ ΥΠΟΛΟΓ ΟΠΟΙΑΔΗΠΟΤ ΑΙΤΙΑ.,80,21,158,39,0.4875,RespA,5,0,5,0
2103,0,0,0,1,13,NoIdea,0,0,20080100086.pdf,0,10,17,30,6,24,0,6,Non-Org,38,0,0,0,1,0,0,"θθ) Η σύνταξη και υποβολή οικονομικών στοιχείων και 
δηλώσεων σε Δημόσιες Οικονομικές Υπηρεσίες (Δ.Ο.Υ.), 
δημόσιες ή άλλες αρχές και οργανισμούς του κράτους, 
καθώς και η θεώρηση ή γνωστοποίηση για χρήση αθεώρητων στοιχείων και βιβλίων
ιι) Η σύνταξη και υποβολή στοιχείων σε ελεγκτικές 
αρχές
ιαια) Η επιμέλεια για την είσπραξη και απόδοση των 
υπέρ του Δημοσίου και τρίτων κρατήσεων
ιβιβ) Η επιμέλεια για την απόδοση υπέρ του Δημοσίου και τρίτων οφειλών
ιγιγ) Η σύνταξη προϋπολογιστικών και απολογιστικών στοιχείων και η διαχείριση και εκκαθάριση χρηματοδοτούμενων προγραμμάτων από κρατικούς και μη 
κρατικούς φορείς
ιδιδ) Η τήρηση και ο έλεγχος ταμείου
ιειε) Η έκδοση επιταγών και άλλων αξιογράφων
ιστιστ) Η επιμέλεια για την είσπραξη και εκκαθάριση πωλήσεων μέσω πιστωτικών καρτών ή άλλων τραπεζικών μέσων
ιζιζ) Η επιμέλεια όλων των εργασιών και διαδικασιών 
ανοίγματος και κλεισίματος των διαχειριστικών χρήσεων
ιηιη) Η επιμέλεια της εφαρμογής του διατραπεζικού 
συστήματος για την πληρωμή των αποδοχών του προσωπικού
ιθιθ) Η υπογραφή των Οικονομικών καταστάσεων και 
Δηλώσεων σύμφωνα με τη νομοθεσία που ισχύει.",1117,RespA,ΘΘ ΣΥΝΤΑΞ ΥΠΟΒΟΛ ΟΙΚΟΝΟΜ ΣΤΟΙΧΕΙ ΔΗΛΩΣ ΔΗΜΟΣ ΟΙΚΟΝΟΜ ΥΠΗΡΕΣ Δ.Ο.Υ. ΔΗΜΟΣ ΑΡΧ ΟΡΓΑΝΙΣΜ ΚΡΑΤ ΘΕΩΡΗΣ ΓΝΩΣΤΟΠΟΙΗΣ ΧΡΗΣ ΑΘΕΩΡΗΤ ΣΤΟΙΧΕΙ ΒΙΒΛΙ ΣΥΝΤΑΞ ΥΠΟΒΟΛ ΣΤΟΙΧΕΙ ΕΛΕΓΚΤ ΑΡΧ ΙΑΙ ΕΠΙΜΕΛΕΙ ΕΙΣΠΡΑΞ ΑΠΟΔΟΣ ΔΗΜΟΣ ΤΡΙΤ ΚΡΑΤΗΣ ΙΒΙΒ ΕΠΙΜΕΛΕΙ ΑΠΟΔΟΣ ΔΗΜΟΣ ΤΡΙΤ ΟΦΕΙΛ ΙΓΙΓ ΣΥΝΤΑΞ ΠΡΟΥΠΟΛΟΓΙΣΤ ΑΠΟΛΟΓΙΣΤ ΣΤΟΙΧΕΙ ΔΙΑΧΕΙΡΙΣ ΕΚΚΑΘΑΡΙΣ ΧΡΗΜΑΤΟΔΟΤΟΥΜΕΝ ΠΡΟΓΡΑΜΜ ΚΡΑΤ ΚΡΑΤ ΦΟΡ ΙΔΙΔ ΤΗΡΗΣ ΕΛΕΓΧ ΤΑΜΕΙ ΙΕΙ ΕΚΔΟΣ ΕΠΙΤΑΓ ΑΞΙΟΓΡΑΦ ΙΣΤΙΣΤ ΕΠΙΜΕΛΕΙ ΕΙΣΠΡΑΞ ΕΚΚΑΘΑΡΙΣ ΠΩΛΗΣ ΜΕΣ ΠΙΣΤΩΤ ΚΑΡΤ ΤΡΑΠΕΖ ΜΕΣ ΙΖΙΖ ΕΠΙΜΕΛΕΙ ΕΡΓΑΣ ΔΙΑΔΙΚΑΣ ΑΝΟΙΓΜ ΚΛΕΙΣΙΜ ΔΙΑΧΕΙΡΙΣΤ ΧΡΗΣ ΙΗΙ ΕΠΙΜΕΛΕΙ ΕΦΑΡΜΟΓ ΔΙΑΤΡΑΠΕΖ ΣΥΣΤΗΜ ΠΛΗΡΩΜ ΑΠΟΔΟΧ ΠΡΟΣΩΠ ΙΘΙΘ ΥΠΟΓΡΑΦ ΟΙΚΟΝΟΜ ΚΑΤΑΣΤΑΣ ΔΗΛΩΣ ΣΥΜΦΩΝ ΝΟΜΟΘΕΣ ΙΣΧΥΕΙ.,649,195,1367,251,0.3867488444,RespA,21,5,16,18
2104,0,0,0,1,13,NoIdea,0,0,20080100086.pdf,0,20,12,8,0,8,0,0,Non-Org,0,0,0,0,1,0,0,"εε) Η επιμέλεια για την αποστολή και παραλαβή εξοπλισμού και των προϊόντων και εμπορευμάτων οργάνωσης εκθέσεων της οικοτεχνικής δραστηριότητας του 
Ι.Κ.Π.Α.",156,RespA,ΕΕ ΕΠΙΜΕΛΕΙ ΑΠΟΣΤΟΛ ΠΑΡΑΛΑΒ ΕΞΟΠΛΙΣΜ ΠΡΟΙΟΝΤ ΕΜΠΟΡΕΥΜ ΟΡΓΑΝΩΣ ΕΚΘΕΣ ΟΙΚΟΤΕΧΝ ΔΡΑΣΤΗΡΙΟΤΗΤ Ι.Κ.Π.Α.,98,114,906,61,0.6224489796,RespA,8,0,8,1
2105,0,0,0,1,13,NoIdea,0,0,20080100086.pdf,0,14,13,4,0,4,0,0,Non-Org,0,0,0,0,1,0,0,"ηη) Ο προγραμματισμός και η παρακολούθηση της 
κίνησης των μεταφορικών μέσων και οχημάτων του 
Ι.Κ.Π.Α.",103,RespA,ΗΗ ΠΡΟΓΡΑΜΜΑΤΙΣΜ ΠΑΡΑΚΟΛΟΥΘΗΣ ΚΙΝΗΣ ΜΕΤΑΦΟΡ ΜΕΣ ΟΧΗΜ Ι.Κ.Π.Α.,61,96,1047,34,0.5573770492,RespA,4,0,4,1
2106,0,0,0,1,13,NoIdea,0,0,20080100086.pdf,0,16,8,2,0,2,0,0,Non-Org,0,0,0,0,1,0,0,"θθ) Η επιμέλεια και ο έλεγχος των υλικών και καυσίμων 
των μεταφορικών μέσων και οχημάτων του Ι.Κ.Π.Α.",102,RespA,ΘΘ ΕΠΙΜΕΛΕΙ ΕΛΕΓΧ ΥΛ ΚΑΥΣΙΜ ΜΕΤΑΦΟΡ ΜΕΣ ΟΧΗΜ Ι.Κ.Π.Α.,53,12,68,12,0.2264150943,RespA,2,0,2,1
2107,0,0,0,1,13,NoIdea,0,0,20080100086.pdf,0,20,10,5,0,5,0,0,Non-Org,0,0,0,0,1,0,0,"ιι) Η επιμέλεια και οι διοικητικές ενέργειες για τη συντήρηση και επισκευή των εγκαταστάσεων, των μέσων 
και του εξοπλισμού του Ι.Κ.Π.Α.",136,RespA,ΙΙ ΕΠΙΜΕΛΕΙ ΔΙΟΙΚΗΤ ΕΝΕΡΓΕΙ ΣΥΝΤΗΡΗΣ ΕΠΙΣΚΕΥ ΕΓΚΑΤΑΣΤΑΣ ΜΕΣ ΕΞΟΠΛΙΣΜ Ι.Κ.Π.Α.,77,87,754,41,0.5324675325,RespA,5,0,5,1
2108,0,0,0,0,13,NoIdea,0,0,20080100086.pdf,0,2,18,4,1,3,0,0,Non-Org,0,0,0,0,0,0,0,"ιβιβ) Οι διοικητικές ενέργειες ελέγχου της χρήσης 
και συντήρησης των περιουσιακών στοιχείων και μισθωμένων ακινήτων και η εισήγηση για ενεργοποίηση 
των διαδικασιών καταλογισμού σε περιπτώσεις ευθύνης των υπολόγων.",215,RespA,ΙΒΙΒ ΔΙΟΙΚΗΤ ΕΝΕΡΓΕΙ ΕΛΕΓΧ ΧΡΗΣ ΣΥΝΤΗΡΗΣ ΠΕΡΙΟΥΣΙΑΚ ΣΤΟΙΧΕΙ ΜΙΣΘΩΜΕΝ ΑΚΙΝΗΤ ΕΙΣΗΓΗΣ ΕΝΕΡΓΟΠΟΙΗΣ ΔΙΑΔΙΚΑΣ ΚΑΤΑΛΟΓΙΣΜ ΠΕΡΙΠΤΩΣ ΕΥΘΥΝ ΥΠΟΛΟΓΩΝ.,140,77,578,38,0.2714285714,RespA,4,1,3,1
2109,0,0,0,0,13,NoIdea,0,0,20080100086.pdf,0,2,18,7,1,6,0,0,Non-Org,0,0,0,0,0,0,0,"ιγιγ) Η επιμέλεια της διενέργειας απογραφών σε συνεργασία με τις άλλες υπηρεσίες του Ι.Κ.Π.Α. των περιουσιακών στοιχείων και των ακινήτων, μέσων, υλικών 
και εφοδίων ιδιοκτησίας τρίτων με τα οποία είναι χρεωμένο ή εποπτεύει.",224,RespA,ΙΓΙΓ ΕΠΙΜΕΛΕΙ ΔΙΕΝΕΡΓΕΙ ΑΠΟΓΡΑΦ ΣΥΝΕΡΓΑΣ ΥΠΗΡΕΣ Ι.Κ.Π.Α. ΠΕΡΙΟΥΣΙΑΚ ΣΤΟΙΧΕΙ ΑΚΙΝΗΤ ΜΕΣ ΥΛ ΕΦΟΔ ΙΔΙΟΚΤΗΣ ΤΡΙΤ ΧΡΕΩΜΕΝ ΕΠΟΠΤΕΥΕΙ.,127,100,805,58,0.4566929134,RespA,7,1,6,2
2110,0,0,0,0,14,NoIdea,0,0,20080100086.pdf,0,5,8,3,0,3,0,0,Non-Org,0,0,0,0,0,0,0,"Στην άμεση ευθύνη της Διεύθυνσης Πληροφορικής 
εμπίπτουν:",57,RespA,ΣΤΗΝ ΑΜΕΣ ΕΥΘΥΝ ΔΙΕΥΘΥΝΣ ΠΛΗΡΟΦΟΡ ΕΜΠΙΠΤ,40,56,408,19,0.475,RespA,3,0,3,2
2111,0,0,0,1,14,NoIdea,0,0,20080100086.pdf,0,0,9,4,0,4,0,0,Non-Org,0,0,0,0,1,0,0,"β) Ο έλεγχος και η μέριμνα για τη βελτιστοποίηση της 
απόδοσης της υφισταμένης υποδομής πληροφορικής.",101,RespA,Β ΕΛΕΓΧ ΜΕΡΙΜΝ ΒΕΛΤΙΣΤΟΠΟΙΗΣ ΑΠΟΔΟΣ ΥΦΙΣΤΑΜΕΝ ΥΠΟΔΟΜ ΠΛΗΡΟΦΟΡΙΚΗΣ.,66,84,522,27,0.4090909091,RespA,4,0,4,0
2112,0,0,0,1,14,NoIdea,0,0,20080100086.pdf,0,8,8,3,0,3,0,0,Non-Org,0,0,0,0,1,0,0,"γ) Ενημέρωση μέσω αναφορών και εισηγήσεων προς 
την Διοίκηση για μείζονα θέματα του ΟΠΣ του Ινστιτούτου.",104,RespA,Γ ΕΝΗΜΕΡΩΣ ΜΕΣ ΑΝΑΦΟΡ ΕΙΣΗΓΗΣ ΔΙΟΙΚΗΣ ΜΕΙΖΟΝ ΘΕΜ ΟΠΣ ΙΝΣΤΙΤΟΥΤΟΥ.,65,74,546,21,0.3230769231,RespA,3,0,3,3
2113,0,0,0,1,14,NoIdea,0,0,20080100086.pdf,0,27,13,9,1,8,0,0,Non-Org,0,0,0,0,1,0,0,"δ) O προγραμματισμός έργων, καθώς και η μελέτη και 
μέριμνα για την εισαγωγή νέων τεχνολογιών και μεθόδων πληροφορικής σε συνεργασία με τις ενδιαφερόμενες−εμπλεκόμενες κατά περίπτωση άλλες Διευθύνσεις και Υπηρεσίες.",215,RespA,Δ O ΠΡΟΓΡΑΜΜΑΤΙΣΜ ΕΡΓ ΜΕΛΕΤ ΜΕΡΙΜΝ ΕΙΣΑΓΩΓ ΝΕ ΤΕΧΝΟΛΟΓ ΜΕΘΟΔ ΠΛΗΡΟΦΟΡ ΣΥΝΕΡΓΑΣ ΕΝΔΙΑΦΕΡΟΜΕΝ ΕΜΠΛΕΚΟΜΕΝ ΠΕΡΙΠΤΩΣ ΔΙΕΥΘΥΝΣ ΥΠΗΡΕΣΙΕΣ.,131,270,2009,75,0.572519084,RespA,9,1,8,2
2114,0,0,0,1,14,NoIdea,0,0,20080100086.pdf,0,0,18,5,3,2,0,1,Non-Org,8,0,0,0,1,0,0,"ε) Η ευθύνη για την απρόσκοπτη λειτουργία, συντήρηση και αναβάθμιση των συστημάτων πληροφορικής 
του οργανισμού.",112,RespA,Ε ΕΥΘΥΝ ΑΠΡΟΣΚΟΠΤ ΛΕΙΤΟΥΡΓ ΣΥΝΤΗΡΗΣ ΑΝΑΒΑΘΜΙΣ ΣΥΣΤΗΜ ΠΛΗΡΟΦΟΡ ΟΡΓΑΝΙΣΜΟΥ.,73,29,335,64,0.8767123288,RespA,5,3,2,0
2115,0,0,0,1,14,NoIdea,0,0,20080100086.pdf,0,0,15,9,2,7,0,1,Non-Org,8,0,0,0,1,0,0,"στ) Η εκπαίδευση και η διαρκής υποστήριξη του ανθρώπινου δυναμικού του οργανισμού, στη χρήση και 
αξιοποίηση συστημάτων πληροφορικής, λογισμικού και 
εξοπλισμού και σύγχρονων τεχνολογιών.",187,RespA,ΣΤ ΕΚΠΑΙΔΕΥΣ ΔΙΑΡΚ ΥΠΟΣΤΗΡΙΞ ΑΝΘΡΩΠΙΝ ΔΥΝΑΜ ΟΡΓΑΝΙΣΜ ΧΡΗΣ ΑΞΙΟΠΟΙΗΣ ΣΥΣΤΗΜ ΠΛΗΡΟΦΟΡ ΛΟΓΙΣΜ ΕΞΟΠΛΙΣΜ ΣΥΓΧΡΟΝ ΤΕΧΝΟΛΟΓΙΩΝ.,120,152,1361,84,0.7,RespA,9,2,7,0
2116,0,0,0,1,14,NoIdea,0,0,20080100086.pdf,0,14,10,5,0,5,0,1,Non-Org,8,0,0,0,1,0,0,"ζ) Η διαρκής ενημέρωση και αναβάθμιση των υπηρεσιών ηλεκτρονικής πληροφόρησης του οργανισμού μέσω 
του Διαδικτύου.",114,RespA,Ζ ΔΙΑΡΚ ΕΝΗΜΕΡΩΣ ΑΝΑΒΑΘΜΙΣ ΥΠΗΡΕΣ ΗΛΕΚΤΡΟΝ ΠΛΗΡΟΦΟΡΗΣ ΟΡΓΑΝΙΣΜ ΜΕΣ ΔΙΑΔΙΚΤΥΟΥ.,78,62,504,40,0.5128205128,RespA,5,0,5,1
2117,0,0,0,1,14,NoIdea,0,0,20080100086.pdf,0,0,15,15,1,14,0,1,Non-Org,5,0,0,0,1,0,0,"ββ) Η παροχή εκπαίδευσης και συνεχούς υποστήριξης 
στους χρήστες των πληροφορικών εφαρμογών, είτε για 
την επίλυση προβλημάτων αξιοποίησης των υφισταμένων υπό εκμετάλλευση εφαρμογών, είτε για τη διατύπωση και σύνταξη νέων απαιτήσεων, αναγκών τροποποίησης, δημιουργίας νέων προγραμμάτων κ.α.",290,RespA,ΒΒ ΠΑΡΟΧ ΕΚΠΑΙΔΕΥΣ ΣΥΝΕΧ ΥΠΟΣΤΗΡΙΞ ΧΡΗΣΤ ΠΛΗΡΟΦΟΡ ΕΦΑΡΜΟΓ ΕΠΙΛΥΣ ΠΡΟΒΛΗΜ ΑΞΙΟΠΟΙΗΣ ΥΦΙΣΤΑΜΕΝ ΕΚΜΕΤΑΛΛΕΥΣ ΕΦΑΡΜΟΓ ΔΙΑΤΥΠΩΣ ΣΥΝΤΑΞ ΝΕ ΑΠΑΙΤΗΣ ΑΝΑΓΚ ΤΡΟΠΟΠΟΙΗΣ ΔΗΜΙΟΥΡΓ ΝΕ ΠΡΟΓΡΑΜΜ Κ.Α.,182,234,1755,123,0.6758241758,RespA,15,1,14,0
2118,0,0,0,1,14,NoIdea,0,0,20080100086.pdf,0,0,6,3,0,3,0,0,Non-Org,0,0,0,0,1,0,0,γγ) Σύνταξη σχετικών μελετών και μελετών σκοπιμότητας.,54,RespA,ΓΓ ΣΥΝΤΑΞ ΣΧΕΤ ΜΕΛΕΤ ΜΕΛΕΤ ΣΚΟΠΙΜΟΤΗΤΑΣ.,40,88,477,16,0.4,RespA,2,0,2,0
2119,0,0,0,1,14,NoIdea,0,0,20080100086.pdf,0,6,17,6,1,5,0,1,Non-Org,8,0,0,0,1,0,0,"δδ) Aναφορές και εισηγήσεις προς την Διοίκηση για 
θέματα ανάπτυξης και υποστήριξης εφαρμογών λογισμικού από τους υπαλλήλους του Τμήματος ή της αγοράς και συντήρησης λογισμικού από τρίτους με σκοπό 
την πλήρη μηχανογραφική λειτουργία των υπηρεσιών 
του Ινστιτούτου.",265,RespA,ΔΔ AΝΑΦΟΡΕΣ ΕΙΣΗΓΗΣ ΔΙΟΙΚΗΣ ΘΕΜ ΑΝΑΠΤΥΞ ΥΠΟΣΤΗΡΙΞ ΕΦΑΡΜΟΓ ΛΟΓΙΣΜ ΥΠΑΛΛΗΛ ΤΜΗΜ ΑΓΟΡ ΣΥΝΤΗΡΗΣ ΛΟΓΙΣΜ ΤΡΙΤ ΣΚΟΠ ΠΛΗΡ ΜΗΧΑΝΟΓΡΑΦ ΛΕΙΤΟΥΡΓ ΥΠΗΡΕΣ ΙΝΣΤΙΤΟΥΤΟΥ.,153,84,612,50,0.3267973856,RespA,6,1,5,3
2120,0,0,0,1,14,NoIdea,0,0,20080100086.pdf,0,11,16,6,2,4,0,1,Non-Org,6,0,0,0,1,0,0,εε) Καθορισμός των αναγκών για εκπαίδευση και εκπαίδευση του προσωπικού του Ινστιτούτου σε θέματα του Τμήματος σε συνεργασία με τις λοιπές υπηρεσίες.,149,RespA,ΕΕ ΚΑΘΟΡΙΣΜ ΑΝΑΓΚ ΕΚΠΑΙΔΕΥΣ ΕΚΠΑΙΔΕΥΣ ΠΡΟΣΩΠ ΙΝΣΤΙΤΟΥΤ ΘΕΜ ΤΜΗΜ ΣΥΝΕΡΓΑΣ ΛΟΙΠ ΥΠΗΡΕΣΙΕΣ.,88,113,834,60,0.6818181818,RespA,6,2,4,2
2121,0,0,0,1,14,NoIdea,0,0,20080100086.pdf,0,9,10,2,0,2,0,0,Non-Org,0,0,0,0,1,0,0,"ηη) Η εκτέλεση άλλων σχετικών με το αντικείμενο του 
Τμήματος καθηκόντων που θα ανατίθενται από υπερκείμενα όργανα.",115,RespA,ΗΗ ΕΚΤΕΛΕΣ ΣΧΕΤ ΑΝΤΙΚΕΙΜΕΝ ΤΜΗΜ ΚΑΘΗΚΟΝΤ ΑΝΑΤΙΘΕΝΤΑ ΥΠΕΡΚΕΙΜΕΝ ΟΡΓΑΝΑ.,70,12,110,18,0.2571428571,RespA,2,0,2,1
2122,0,0,0,1,14,NoIdea,0,0,20080100086.pdf,0,8,10,3,0,3,0,0,Non-Org,0,0,0,0,1,0,0,"θθ) Τήρηση αλληλογραφίας και αρχείων σχετικών με 
το Τμήμα.",59,RespA,ΘΘ ΤΗΡΗΣ ΑΛΛΗΛΟΓΡΑΦ ΑΡΧΕΙ ΣΧΕΤ ΤΜΗΜΑ.,37,107,610,20,0.5405405405,RespA,3,0,3,1
2123,0,0,0,0,15,NoIdea,0,0,20080100086.pdf,0,2,19,9,6,3,0,2,Non-Org,11,0,0,0,0,0,0,"Αρμοδιότητες Αυτοτελούς Τμήματος 
Κέντρου Επαγγελματικής Κατάρτισης (Κ.Ε.Κ.) 
1. Το Αυτοτελές Τμήμα Κ.Ε.Κ. σκοπό έχει την ανάπτυξη και εφαρμογή προγραμμάτων εκπαίδευσης, επιμόρφωσης και κατάρτισης του προσωπικού των φορέων 
του Εθνικού Συστήματος Κοινωνικής Φροντίδας αλλά 
και εθελοντών, μελών ευαίσθητων κοινωνικών ομάδων 
καθώς και ανέργων, τους οποίους η κοινωνική πολιτική επιθυμεί να στηρίξει.",399,RespA,ΑΡΜΟΔΙΟΤΗΤ ΑΥΤΟΤΕΛ ΤΜΗΜ ΚΕΝΤΡ ΕΠΑΓΓΕΛΜΑΤ ΚΑΤΑΡΤΙΣ Κ.Ε.Κ. 1. ΑΥΤΟΤΕΛ ΤΜΗΜ Κ.Ε.Κ. ΣΚΟΠ ΑΝΑΠΤΥΞ ΕΦΑΡΜΟΓ ΠΡΟΓΡΑΜΜ ΕΚΠΑΙΔΕΥΣ ΕΠΙΜΟΡΦΩΣ ΚΑΤΑΡΤΙΣ ΠΡΟΣΩΠ ΦΟΡ ΕΘΝ ΣΥΣΤΗΜ ΚΟΙΝΩΝ ΦΡΟΝΤΙΔ ΕΘΕΛΟΝΤ ΜΕΛ ΕΥΑΙΣΘΗΤ ΚΟΙΝΩΝ ΟΜΑΔ ΑΝΕΡΓ ΚΟΙΝΩΝ ΠΟΛΙΤ ΕΠΙΘΥΜ ΣΤΗΡΙΞΕΙ.,244,40,465,107,0.4385245902,RespA,8,5,3,14
2124,0,0,0,1,15,NoIdea,0,0,20080100086.pdf,0,18,15,9,2,7,0,2,Non-Org,10,0,0,0,1,0,0,"γγ) H παροχή συνεχούς υποστήριξης στους χρήστες 
των πληροφορικών συστημάτων που αντιμετωπίζουν 
προβλήματα με το εσωτερικό δίκτυο, το Internet, τους 
εκτυπωτές, τους σταθμούς εργασίας, την πρόσβαση 
στις εφαρμογές (Λογισμικό) κ.α.",231,RespA,ΓΓ H ΠΑΡΟΧ ΣΥΝΕΧ ΥΠΟΣΤΗΡΙΞ ΧΡΗΣΤ ΠΛΗΡΟΦΟΡ ΣΥΣΤΗΜ ΑΝΤΙΜΕΤΩΠΙΖ ΠΡΟΒΛΗΜ ΕΣΩΤΕΡ ΔΙΚΤΥ INTERNET ΕΚΤΥΠΩΤ ΣΤΑΘΜ ΕΡΓΑΣ ΠΡΟΣΒΑΣ ΕΦΑΡΜΟΓ ΛΟΓΙΣΜ Κ.Α.,138,85,505,71,0.5144927536,RespA,9,2,7,2
2125,0,0,0,1,15,NoIdea,0,0,20080100086.pdf,0,31,8,9,0,9,0,1,Non-Org,5,0,0,0,1,0,0,"δδ) H μέριμνα για τα ημερήσια, εβδομαδιαία, μηνιαία και ετήσια backups, η φύλαξη των μαγνητικών μέσων σε ασφαλή σημεία και γενικότερα ο εντοπισμός 
και η επίλυση γενικής και ειδικής φύσεως προβλημάτων Hardware.",210,RespA,ΔΔ H ΜΕΡΙΜΝ ΗΜΕΡΗΣ ΕΒΔΟΜΑΔΙΑΙ ΜΗΝΙΑΙ ΕΤΗΣ BACKUPS ΦΥΛΑΞ ΜΑΓΝΗΤ ΜΕΣ ΑΣΦΑΛ ΣΗΜΕΙ ΓΕΝΙΚ ΕΝΤΟΠΙΣΜ ΕΠΙΛΥΣ ΓΕΝΙΚ ΕΙΔΙΚ ΦΥΣ ΠΡΟΒΛΗΜ HARDWARE.,134,107,610,53,0.3955223881,RespA,9,0,9,1
2126,0,0,0,1,15,NoIdea,0,0,20080100086.pdf,0,12,16,9,3,6,0,1,Non-Org,6,0,0,0,1,0,0,"εε) Καθορισμός των αναγκών για τεχνική εκπαίδευση και εκπαίδευση του προσωπικού του Ινστιτούτου 
σε θέματα αρμοδιοτήτων του Τμήματος και γενικότερα σε θέματα πληροφορικής σε συνεργασία με τις λοιπές υπηρεσίες.",209,RespA,ΕΕ ΚΑΘΟΡΙΣΜ ΑΝΑΓΚ ΤΕΧΝΙΚ ΕΚΠΑΙΔΕΥΣ ΕΚΠΑΙΔΕΥΣ ΠΡΟΣΩΠ ΙΝΣΤΙΤΟΥΤ ΘΕΜ ΑΡΜΟΔΙΟΤΗΤ ΤΜΗΜ ΓΕΝΙΚ ΘΕΜ ΠΛΗΡΟΦΟΡ ΣΥΝΕΡΓΑΣ ΛΟΙΠ ΥΠΗΡΕΣΙΕΣ.,125,194,1469,88,0.704,RespA,9,3,6,2
2127,0,0,0,1,15,NoIdea,0,0,20080100086.pdf,0,9,10,2,0,2,0,0,Non-Org,0,0,0,0,1,0,0,"ηη) Η εκτέλεση άλλων σχετικών με το αντικείμενο του 
Τμήματος καθηκόντων που θα ανατίθενται από υπερκείμενα όργανα.",115,RespA,ΗΗ ΕΚΤΕΛΕΣ ΣΧΕΤ ΑΝΤΙΚΕΙΜΕΝ ΤΜΗΜ ΚΑΘΗΚΟΝΤ ΑΝΑΤΙΘΕΝΤΑ ΥΠΕΡΚΕΙΜΕΝ ΟΡΓΑΝΑ.,70,12,110,18,0.2571428571,RespA,2,0,2,1
2128,0,0,0,1,15,NoIdea,0,0,20080100086.pdf,0,8,10,3,0,3,0,0,Non-Org,0,0,0,0,1,0,0,"θθ) Τήρηση αλληλογραφίας και αρχείων σχετικών με 
το Τμήμα.",59,RespA,ΘΘ ΤΗΡΗΣ ΑΛΛΗΛΟΓΡΑΦ ΑΡΧΕΙ ΣΧΕΤ ΤΜΗΜΑ.,37,107,610,20,0.5405405405,RespA,3,0,3,1
2129,0,0,0,0,15,NoIdea,0,0,20080100086.pdf,0,2,12,5,0,5,0,0,Non-Org,0,0,0,0,0,0,0,"1356 
ΕΦΗΜΕΡΙΣ ΤΗΣ ΚΥΒΕΡΝΗΣΕΩΣ (ΤΕΥΧΟΣ ΠΡΩΤΟ) 
β) Η ευθύνη για το σχεδιασμό των προγραμμάτων κατάρτισης και των συναφών δραστηριοτήτων του Τμήματος.",148,RespA,1356 ΕΦΗΜΕΡΙΣ ΚΥΒΕΡΝΗΣ ΤΕΥΧ ΠΡΩΤ Β ΕΥΘΥΝ ΣΧΕΔΙΑΣΜ ΠΡΟΓΡΑΜΜ ΚΑΤΑΡΤΙΣ ΣΥΝΑΦ ΔΡΑΣΤΗΡΙΟΤΗΤ ΤΜΗΜΑΤΟΣ.,96,118,991,38,0.3958333333,RespA,5,0,5,7
2130,0,0,0,1,15,NoIdea,0,0,20080100086.pdf,0,9,10,9,0,9,0,0,Non-Org,0,0,0,0,1,0,0,"δ) Η στήριξη και κατεύθυνση των λοιπών στελεχών 
του Τμήματος, καθώς και των εξωτερικών συνεργατών, 
σε ότι αφορά το επιστημονικό περιεχόμενο των δράσεων του Τμήματος.",167,RespA,Δ ΣΤΗΡΙΞ ΚΑΤΕΥΘΥΝΣ ΛΟΙΠ ΣΤΕΛΕΧ ΤΜΗΜ ΕΞΩΤΕΡ ΣΥΝΕΡΓΑΤ ΑΦΟΡ ΕΠΙΣΤΗΜΟΝ ΠΕΡΙΕΧΟΜΕΝ ΔΡΑΣ ΤΜΗΜΑΤΟΣ.,92,108,599,62,0.6739130435,RespA,9,0,9,2
2131,0,0,0,1,15,NoIdea,0,0,20080100086.pdf,0,0,18,4,2,2,0,0,Non-Org,0,0,0,0,1,0,0,"ε) Η κατάρτιση του ετήσιου προγραμματισμού δράσης που αφορά τα προγράμματα κατάρτισης και τις 
συναφείς δραστηριότητες.",119,RespA,Ε ΚΑΤΑΡΤΙΣ ΕΤΗΣ ΠΡΟΓΡΑΜΜΑΤΙΣΜ ΔΡΑΣ ΑΦΟΡ ΠΡΟΓΡΑΜΜ ΚΑΤΑΡΤΙΣ ΣΥΝΑΦ ΔΡΑΣΤΗΡΙΟΤΗΤΕΣ.,79,48,247,40,0.5063291139,RespA,4,2,2,0
2132,0,0,0,1,15,NoIdea,0,0,20080100086.pdf,0,0,12,4,0,4,0,0,Non-Org,0,0,0,0,1,0,0,"στ) Η συνεργασία και η παρακολούθηση του έργου 
του υπεύθυνου προώθησης στην απασχόληση.",88,RespA,ΣΤ ΣΥΝΕΡΓΑΣ ΠΑΡΑΚΟΛΟΥΘΗΣ ΕΡΓ ΥΠΕΥΘΥΝ ΠΡΟΩΘΗΣ ΑΠΑΣΧΟΛΗΣΗ.,56,153,1430,34,0.6071428571,RespA,4,0,4,0
2133,0,0,0,1,15,NoIdea,0,0,20080100086.pdf,0,26,17,8,3,5,0,0,Non-Org,0,0,0,0,1,0,0,"ζ) Η διερεύνηση των αναγκών της αγοράς εργασίας, 
καθώς και των αναγκών κατάρτισης των ανέργων και 
των εργαζομένων στον κοινωνικό – παιδαγωγικόπρονοιακό χώρο, σε συνεργασία με τη Διεύθυνση Έρευνας, 
Σχεδιασμού, Αξιολόγησης και Τεκμηρίωσης.",240,RespA,Ζ ΔΙΕΡΕΥΝΗΣ ΑΝΑΓΚ ΑΓΟΡ ΕΡΓΑΣ ΑΝΑΓΚ ΚΑΤΑΡΤΙΣ ΑΝΕΡΓ ΕΡΓΑΖΟΜΕΝ ΚΟΙΝΩΝ ΠΑΙΔΑΓΩΓΙΚΟΠΡΟΝΟΙΑΚ ΧΩΡ ΣΥΝΕΡΓΑΣ ΔΙΕΥΘΥΝΣ ΕΡΕΥΝ ΣΧΕΔΙΑΣΜ ΑΞΙΟΛΟΓΗΣ ΤΕΚΜΗΡΙΩΣΗΣ.,146,147,1256,78,0.5342465753,RespA,8,3,5,5
2134,0,0,0,1,15,NoIdea,0,0,20080100086.pdf,0,33,16,6,1,5,0,0,Non-Org,0,0,0,0,1,0,0,"η) Η εισήγηση της εκτέλεσης προγραμμάτων επιμόρφωσης εκπαιδευτικών εθελοντών που υλοποιούνται 
από τις εθελοντικές οργανώσεις του άρθρου 12 του 
ν. 2646/1998 και τα οποία είναι σχετικά με τους σκοπούς 
και τους στόχους των Εθνικών Προγραμμάτων.",244,RespA,Η ΕΙΣΗΓΗΣ ΕΚΤΕΛΕΣ ΠΡΟΓΡΑΜΜ ΕΠΙΜΟΡΦΩΣ ΕΚΠΑΙΔΕΥΤ ΕΘΕΛΟΝΤ ΥΛΟΠΟ ΕΘΕΛΟΝΤ ΟΡΓΑΝΩΣ ΑΡΘΡ 12 Ν. 2646 1998 ΣΧΕΤ ΣΚΟΠ ΣΤΟΧ ΕΘΝ ΠΡΟΓΡΑΜΜΑΤΩΝ.,130,121,895,52,0.4,RespA,6,1,5,2
2135,0,0,0,1,15,NoIdea,0,0,20080100086.pdf,0,23,9,7,1,6,0,0,Non-Org,0,0,0,0,1,0,0,"θ) Η αναζήτηση, μέσα από τις σχετικές προκηρύξεις 
των αρμοδίων αρχών, των εκπαιδευτικών ή συναφών 
προγραμμάτων στα οποία θα μπορούσε να συμμετέχει το Τμήμα και η μέριμνα για την υποβολή σχετικών 
προτάσεων.",208,RespA,Θ ΑΝΑΖΗΤΗΣ ΣΧΕΤ ΠΡΟΚΗΡΥΞ ΑΡΜΟΔ ΑΡΧ ΕΚΠΑΙΔΕΥΤ ΣΥΝΑΦ ΠΡΟΓΡΑΜΜ ΜΠΟΡ ΣΥΜΜΕΤΕΧ ΤΜΗΜ ΜΕΡΙΜΝ ΥΠΟΒΟΛ ΣΧΕΤ ΠΡΟΤΑΣΕΩΝ.,108,121,838,51,0.4722222222,RespA,7,1,6,1
