,AlphaBulletCapDot,AlphaBulletCapPar,AlphaBulletDot,AlphaBulletPar,ArticleNo,Class,DigitBulletDot,DigitBulletPar,Filename,FirstPatternOffset,FirstWordInCapitalOffset,LongestMatchingPattern,MatchedPatternsCount,MatchingBigrams,MatchingUnigrams,OrgMatchingBigrams,OrgMatchingUnigrams,OrgPrediction,OrgTotalMatchingCharacters,PrevAlphaBulletCapDot,PrevAlphaBulletCapPar,PrevAlphaBulletDot,PrevAlphaBulletPar,PrevDigitBulletDot,PrevDigitBulletPar,RawParagraph,RawParagraphLength,RespAPrediction,StemmedParagraph,StemmedParagraphLength,SumMatchingEntries,SumMatchingEntriesLength,TotalMatchingCharacters,TotalMatchingRatio,TotalPrediction,UnqMatchedPatternsCount,UnqMatchingBigrams,UnqMatchingUnigrams,WordsInCapital
2136,0,0,0,1,15,NoIdea,0,0,20080100086.pdf,0,0,8,3,0,3,0,0,Non-Org,0,0,0,0,1,0,0,"ι) Η συνεργασία, κατά περίπτωση, με άλλους πιστοποιημένους ή μη φορείς κατάρτισης για την υλοποίηση προγραμμάτων.",113,RespA,Ι ΣΥΝΕΡΓΑΣ ΠΕΡΙΠΤΩΣ ΠΙΣΤΟΠΟΙΗΜΕΝ ΦΟΡ ΚΑΤΑΡΤΙΣ ΥΛΟΠΟΙΗΣ ΠΡΟΓΡΑΜΜΑΤΩΝ.,68,144,1152,24,0.3529411765,RespA,3,0,3,0
2137,0,0,0,1,15,NoIdea,0,0,20080100086.pdf,0,31,17,10,1,9,0,1,Non-Org,5,0,0,0,1,0,0,"ια) Η φροντίδα για την εφαρμογή εκπαιδευτικών μεθοδολογιών, την έκδοση εκπαιδευτικών βοηθημάτων, 
την ένταξη σε εθνικά και διακρατικά δίκτυα και τη διοργάνωση σεμιναρίων, συνεδρίων και ημερίδων σε συνεργασία με τις άλλες Διευθύνσεις του Ι.Κ.Π.Α.",245,RespA,ΙΑ ΦΡΟΝΤΙΔ ΕΦΑΡΜΟΓ ΕΚΠΑΙΔΕΥΤ ΜΕΘΟΔΟΛΟΓ ΕΚΔΟΣ ΕΚΠΑΙΔΕΥΤ ΒΟΗΘΗΜ ΕΝΤΑΞ ΕΘΝ ΔΙΑΚΡΑΤ ΔΙΚΤΥ ΔΙΟΡΓΑΝΩΣ ΣΕΜΙΝΑΡ ΣΥΝΕΔΡ ΗΜΕΡΙΔ ΣΥΝΕΡΓΑΣ ΔΙΕΥΘΥΝΣ Ι.Κ.Π.Α.,144,91,710,81,0.5625,RespA,9,1,8,2
2138,0,0,0,1,15,NoIdea,0,0,20080100086.pdf,0,0,21,7,3,4,0,0,Non-Org,0,0,0,0,1,0,0,"ιβ) Η ευθύνη για την παρακολούθηση της υλοποίησης των προγραμμάτων επαγγελματικής κατάρτισης 
και της τήρησης όλων των απαραίτητων εντύπων και 
στοιχείων.",154,RespA,ΙΒ ΕΥΘΥΝ ΠΑΡΑΚΟΛΟΥΘΗΣ ΥΛΟΠΟΙΗΣ ΠΡΟΓΡΑΜΜ ΕΠΑΓΓΕΛΜΑΤ ΚΑΤΑΡΤΙΣ ΤΗΡΗΣ ΑΠΑΡΑΙΤΗΤ ΕΝΤΥΠ ΣΤΟΙΧΕΙΩΝ.,92,87,617,81,0.8804347826,RespA,7,3,4,0
2139,0,0,0,1,15,NoIdea,0,0,20080100086.pdf,0,12,11,4,1,3,0,0,Non-Org,0,0,0,0,1,0,0,"ιγ) Η ευθύνη για την τήρηση βιβλιοθήκης με βιβλία, 
έντυπο υλικό, βιντεοταινίες, CD−ROM κλπ. σχετικά με 
το έργο του Τμήματος.",126,RespA,ΙΓ ΕΥΘΥΝ ΤΗΡΗΣ ΒΙΒΛΙΟΘΗΚ ΒΙΒΛΙ ΕΝΤΥΠ ΥΛ ΒΙΝΤΕΟΤΑΙΝ CD ROM ΚΛΠ. ΣΧΕΤ ΕΡΓ ΤΜΗΜΑΤΟΣ.,81,69,377,30,0.3703703704,RespA,4,1,3,3
2140,0,0,0,1,15,NoIdea,0,0,20080100086.pdf,0,10,12,4,0,4,0,1,Non-Org,5,0,0,0,1,0,0,ιδ) Η φροντίδα για τη μηχανογραφική παρακολούθηση των εργασιών του Τμήματος και την έκδοση στατιστικών στοιχείων.,113,RespA,ΙΔ ΦΡΟΝΤΙΔ ΜΗΧΑΝΟΓΡΑΦ ΠΑΡΑΚΟΛΟΥΘΗΣ ΕΡΓΑΣ ΤΜΗΜ ΕΚΔΟΣ ΣΤΑΤΙΣΤ ΣΤΟΙΧΕΙΩΝ.,70,73,810,36,0.5142857143,RespA,4,0,4,1
2141,0,0,0,1,15,NoIdea,0,0,20080100086.pdf,0,0,11,4,1,3,0,1,Non-Org,5,0,0,0,1,0,0,ιε) Η συνεργασία με επιχειρήσεις του δημόσιου ή ιδιωτικού τομέα για την πρακτική άσκηση των καταρτιζομένων.,107,RespA,ΙΕ ΣΥΝΕΡΓΑΣ ΕΠΙΧΕΙΡΗΣ ΔΗΜΟΣ ΙΔΙΩΤ ΤΟΜ ΠΡΑΚΤ ΑΣΚΗΣ ΚΑΤΑΡΤΙΖΟΜΕΝΩΝ.,65,96,759,33,0.5076923077,RespA,4,1,3,0
2142,0,0,0,1,15,NoIdea,0,0,20080100086.pdf,0,14,12,6,0,6,0,0,Non-Org,0,0,0,0,1,0,0,"ιη) Η κατάρτιση, σε συνεργασία με τους επιστημονικούς υπεύθυνους και τα λοιπά στελέχη του Τμήματος, 
του προϋπολογισμού των προγραμμάτων.",137,RespA,ΙΗ ΚΑΤΑΡΤΙΣ ΣΥΝΕΡΓΑΣ ΕΠΙΣΤΗΜΟΝ ΥΠΕΥΘΥΝ ΣΤΕΛΕΧ ΤΜΗΜ ΠΡΟΥΠΟΛΟΓΙΣΜ ΠΡΟΓΡΑΜΜΑΤΩΝ.,77,151,1318,50,0.6493506494,RespA,6,0,6,1
2143,0,0,0,1,15,NoIdea,0,0,20080100086.pdf,0,0,6,1,0,1,0,0,Non-Org,0,0,0,0,1,0,0,ιθ) Η σύνταξη των αποπληρωμών όλων των προγραμμάτων.,52,RespA,ΙΘ ΣΥΝΤΑΞ ΑΠΟΠΛΗΡΩΜ ΠΡΟΓΡΑΜΜΑΤΩΝ.,33,37,222,6,0.1818181818,RespA,1,0,1,0
2144,0,0,0,1,15,NoIdea,0,0,20080100086.pdf,0,10,17,4,1,3,0,0,Non-Org,0,0,0,0,1,0,0,"κ) Η σύνταξη, σε συνεργασία με τις λοιπές υπηρεσίες του Τμήματος, του ετήσιου προϋπολογισμού του 
Τμήματος.",107,RespA,Κ ΣΥΝΤΑΞ ΣΥΝΕΡΓΑΣ ΛΟΙΠ ΥΠΗΡΕΣ ΤΜΗΜ ΕΤΗΣ ΠΡΟΥΠΟΛΟΓΙΣΜ ΤΜΗΜΑΤΟΣ.,62,137,924,35,0.564516129,RespA,4,1,3,2
2145,0,0,0,1,15,NoIdea,0,0,20080100086.pdf,0,0,12,2,0,2,0,0,Non-Org,0,0,0,0,1,0,0,κα) Η παρακολούθηση της απορρόφησης του προϋπολογισμού των προγραμμάτων.,72,RespA,ΚΑ ΠΑΡΑΚΟΛΟΥΘΗΣ ΑΠΟΡΡΟΦΗΣ ΠΡΟΥΠΟΛΟΓΙΣΜ ΠΡΟΓΡΑΜΜΑΤΩΝ.,52,85,1020,24,0.4615384615,RespA,2,0,2,0
2146,0,0,0,1,15,NoIdea,0,0,20080100086.pdf,0,11,16,3,2,1,0,0,Non-Org,0,0,0,0,1,0,0,"κβ) Η σύνταξη και υποβολή πλήρους οικονομικού φακέλου των προγραμμάτων στη Διεύθυνση Οικονομικού 
και άλλους αρμόδιους φορείς.",126,RespA,ΚΒ ΣΥΝΤΑΞ ΥΠΟΒΟΛ ΠΛΗΡ ΟΙΚΟΝΟΜ ΦΑΚΕΛ ΠΡΟΓΡΑΜΜ ΔΙΕΥΘΥΝΣ ΟΙΚΟΝΟΜ ΑΡΜΟΔ ΦΟΡΕΙΣ.,75,13,135,34,0.4533333333,RespA,3,2,1,2
2147,0,0,0,1,15,NoIdea,0,0,20080100086.pdf,0,20,15,8,1,7,0,1,Non-Org,8,0,0,0,1,0,0,"κγ) Η ευθύνη για την προμήθεια, συντήρηση και διαφύλαξη του υλικοτεχνικού εξοπλισμού, που είναι απαραίτητος για την εύρυθμη λειτουργία του Τμήματος.",148,RespA,ΚΓ ΕΥΘΥΝ ΠΡΟΜΗΘΕΙ ΣΥΝΤΗΡΗΣ ΔΙΑΦΥΛΑΞ ΥΛΙΚΟΤΕΧΝ ΕΞΟΠΛΙΣΜ ΑΠΑΡΑΙΤΗΤ ΕΥΡΥΘΜ ΛΕΙΤΟΥΡΓ ΤΜΗΜΑΤΟΣ.,90,91,722,70,0.7777777778,RespA,8,1,7,1
2148,0,0,0,1,15,NoIdea,0,0,20080100086.pdf,0,10,16,3,1,2,0,0,Non-Org,0,0,0,0,1,0,0,κδ) Η μέριμνα για τη συντήρηση της κτιριακής υποδομής του Τμήματος.,67,RespA,ΚΔ ΜΕΡΙΜΝ ΣΥΝΤΗΡΗΣ ΚΤΙΡΙΑΚ ΥΠΟΔΟΜ ΤΜΗΜΑΤΟΣ.,43,75,490,28,0.6511627907,RespA,3,1,2,1
2149,0,0,0,1,15,NoIdea,0,0,20080100086.pdf,0,5,12,7,1,6,0,0,Non-Org,0,0,0,0,1,0,0,"κε) Η αποστολή στα αρμόδια Υπουργεία και Φορείς 
των απαραίτητων δελτίων παρακολούθησης προγραμμάτων και των διαφόρων άλλων πληροφοριακών στοιχείων.",148,RespA,ΚΕ ΑΠΟΣΤΟΛ ΑΡΜΟΔ ΥΠΟΥΡΓΕΙ ΦΟΡ ΑΠΑΡΑΙΤΗΤ ΔΕΛΤ ΠΑΡΑΚΟΛΟΥΘΗΣ ΠΡΟΓΡΑΜΜ ΔΙΑΦΟΡ ΠΛΗΡΟΦΟΡΙΑΚ ΣΤΟΙΧΕΙΩΝ.,96,94,1009,61,0.6354166667,RespA,7,1,6,2
2150,0,0,0,1,15,NoIdea,0,0,20080100086.pdf,0,7,18,7,1,6,0,0,Non-Org,0,0,0,0,1,0,0,"β) Η κατάρτιση και η υποβολή στο Τμήμα, του ετήσιου προγραμματισμού δράσης, που αφορά τα προγράμματα κατάρτισης και τις συναφείς δραστηριότητες του 
παραρτήματος.",162,RespA,Β ΚΑΤΑΡΤΙΣ ΥΠΟΒΟΛ ΤΜΗΜ ΕΤΗΣ ΠΡΟΓΡΑΜΜΑΤΙΣΜ ΔΡΑΣ ΑΦΟΡ ΠΡΟΓΡΑΜΜ ΚΑΤΑΡΤΙΣ ΣΥΝΑΦ ΔΡΑΣΤΗΡΙΟΤΗΤ ΠΑΡΑΡΤΗΜΑΤΟΣ.,102,127,945,61,0.5980392157,RespA,6,1,5,1
2151,0,0,0,1,15,NoIdea,0,0,20080100086.pdf,0,0,10,3,1,2,0,0,Non-Org,0,0,0,0,1,0,0,"γ) Η διερεύνηση των αναγκών της τοπικής αγοράς 
εργασίας, καθώς και των τοπικών αναγκών κατάρτισης των ανέργων και των εργαζομένων στον προνοιακό χώρο.",151,RespA,Γ ΔΙΕΡΕΥΝΗΣ ΑΝΑΓΚ ΤΟΠ ΑΓΟΡ ΕΡΓΑΣ ΤΟΠ ΑΝΑΓΚ ΚΑΤΑΡΤΙΣ ΑΝΕΡΓ ΕΡΓΑΖΟΜΕΝ ΠΡΟΝΟΙΑΚ ΧΩΡΟ.,82,47,384,27,0.3292682927,RespA,3,1,2,0
2152,0,0,0,1,15,NoIdea,0,0,20080100086.pdf,0,23,11,7,2,5,0,0,Non-Org,0,0,0,0,1,0,0,"δ) Η αναζήτηση μέσα από τις σχετικές προκηρύξεις 
των αρμόδιων αρχών, των εκπαιδευτικών ή συναφών 
προγραμμάτων, στα οποία θα μπορούσε να συμμετέχει το Παράρτημα και η υποβολή σχετικών προτάσεων στο Τμήμα.",205,RespA,Δ ΑΝΑΖΗΤΗΣ ΣΧΕΤ ΠΡΟΚΗΡΥΞ ΑΡΜΟΔ ΑΡΧ ΕΚΠΑΙΔΕΥΤ ΣΥΝΑΦ ΠΡΟΓΡΑΜΜ ΜΠΟΡ ΣΥΜΜΕΤΕΧ ΠΑΡΑΡΤΗΜ ΥΠΟΒΟΛ ΣΧΕΤ ΠΡΟΤΑΣ ΤΜΗΜΑ.,108,69,541,56,0.5185185185,RespA,7,2,5,2
2153,0,0,0,1,15,NoIdea,0,0,20080100086.pdf,0,18,17,5,2,3,0,0,Non-Org,0,0,0,0,1,0,0,"ε) Η συνεργασία με άλλους πιστοποιημένους φορείς 
κατάρτισης για την υλοποίηση προγραμμάτων και η 
υποβολή σχετικών προτάσεων στο Τμήμα.",136,RespA,Ε ΣΥΝΕΡΓΑΣ ΠΙΣΤΟΠΟΙΗΜΕΝ ΦΟΡ ΚΑΤΑΡΤΙΣ ΥΛΟΠΟΙΗΣ ΠΡΟΓΡΑΜΜ ΥΠΟΒΟΛ ΣΧΕΤ ΠΡΟΤΑΣ ΤΜΗΜΑ.,80,129,1031,50,0.625,RespA,5,2,3,1
2154,0,0,0,1,15,NoIdea,0,0,20080100086.pdf,0,15,21,7,3,4,0,0,Non-Org,0,0,0,0,1,0,0,"στ) Η ευθύνη για την παρακολούθηση της υλοποίησης των προγραμμάτων επαγγελματικής κατάρτισης 
που εφαρμόζει το Παράρτημα και της τήρησης όλων 
των απαραίτητων εντύπων και στοιχείων.",181,RespA,ΣΤ ΕΥΘΥΝ ΠΑΡΑΚΟΛΟΥΘΗΣ ΥΛΟΠΟΙΗΣ ΠΡΟΓΡΑΜΜ ΕΠΑΓΓΕΛΜΑΤ ΚΑΤΑΡΤΙΣ ΕΦΑΡΜΟΖ ΠΑΡΑΡΤΗΜ ΤΗΡΗΣ ΑΠΑΡΑΙΤΗΤ ΕΝΤΥΠ ΣΤΟΙΧΕΙΩΝ.,109,87,617,81,0.7431192661,RespA,7,3,4,1
2155,0,0,0,1,15,NoIdea,0,0,20080100086.pdf,0,12,11,4,1,3,0,0,Non-Org,0,0,0,0,1,0,0,"ζ) Η ευθύνη για την τήρηση βιβλιοθήκης με βιβλία, 
έντυπο υλικό, βιντεοταινίες, CD – ROM κλπ. σχετικά με 
το έργο του Παραρτήματος.",131,RespA,Ζ ΕΥΘΥΝ ΤΗΡΗΣ ΒΙΒΛΙΟΘΗΚ ΒΙΒΛΙ ΕΝΤΥΠ ΥΛ ΒΙΝΤΕΟΤΑΙΝ CD ROM ΚΛΠ. ΣΧΕΤ ΕΡΓ ΠΑΡΑΡΤΗΜΑΤΟΣ.,84,69,377,30,0.3571428571,RespA,4,1,3,3
2156,0,0,0,1,15,NoIdea,0,0,20080100086.pdf,0,17,11,4,1,3,0,1,Non-Org,5,0,0,0,1,0,0,η) Η συνεργασία με επιχειρήσεις του δημόσιου και ιδιωτικού τομέα για την πρακτική άσκηση των καταρτιζομένων του Παραρτήματος.,125,RespA,Η ΣΥΝΕΡΓΑΣ ΕΠΙΧΕΙΡΗΣ ΔΗΜΟΣ ΙΔΙΩΤ ΤΟΜ ΠΡΑΚΤ ΑΣΚΗΣ ΚΑΤΑΡΤΙΖΟΜΕΝ ΠΑΡΑΡΤΗΜΑΤΟΣ.,75,96,759,33,0.44,RespA,4,1,3,1
2157,0,0,0,1,15,NoIdea,0,0,20080100086.pdf,0,8,11,3,1,2,0,0,Non-Org,0,0,0,0,1,0,0,θ) Η σύνταξη του ετήσιου απολογισμού έργου του Παραρτήματος και η υποβολή του στο Τμήμα.,88,RespA,Θ ΣΥΝΤΑΞ ΕΤΗΣ ΑΠΟΛΟΓΙΣΜ ΕΡΓ ΠΑΡΑΡΤΗΜ ΥΠΟΒΟΛ ΤΜΗΜΑ.,50,27,205,26,0.52,RespA,3,1,2,2
2158,0,0,0,1,15,NoIdea,0,0,20080100086.pdf,0,14,15,4,1,3,0,0,Non-Org,0,0,0,0,1,0,0,"ι) Η τήρηση των απαραίτητων στατιστικών και άλλων 
στοιχείων και η αποστολή τους στο Τμήμα.",91,RespA,Ι ΤΗΡΗΣ ΑΠΑΡΑΙΤΗΤ ΣΤΑΤΙΣΤ ΣΤΟΙΧΕΙ ΑΠΟΣΤΟΛ ΤΜΗΜΑ.,48,68,424,36,0.75,RespA,4,1,3,1
2159,0,0,0,1,15,NoIdea,0,0,20080100086.pdf,0,0,12,1,0,1,0,0,Non-Org,0,0,0,0,1,0,0,"ια) Η διαχειριστική παρακολούθηση των προγραμμάτων, σύμφωνα με όσα ορίζει το σχετικό σύστημα διαχείρισης.",105,RespA,ΙΑ ΔΙΑΧΕΙΡΙΣΤ ΠΑΡΑΚΟΛΟΥΘΗΣ ΠΡΟΓΡΑΜΜ ΣΥΜΦΩΝ ΟΡΙΖ ΣΧΕΤ ΣΥΣΤΗΜ ΔΙΑΧΕΙΡΙΣΗΣ.,72,58,696,12,0.1666666667,RespA,1,0,1,0
2160,0,0,0,1,15,NoIdea,0,0,20080100086.pdf,0,8,12,2,0,2,0,0,Non-Org,0,0,0,0,1,0,0,ιβ) Η διοικητική παρακολούθηση όλων των δραστηριοτήτων του Παραρτήματος.,72,RespA,ΙΒ ΔΙΟΙΚΗΤ ΠΑΡΑΚΟΛΟΥΘΗΣ ΔΡΑΣΤΗΡΙΟΤΗΤ ΠΑΡΑΡΤΗΜΑΤΟΣ.,50,84,1008,24,0.48,RespA,2,0,2,1
2161,0,0,0,1,15,NoIdea,0,0,20080100086.pdf,0,12,11,3,0,3,0,0,Non-Org,0,0,0,0,1,0,0,"ιγ) Η σύνταξη των δικαιολογητικών των αποπληρωμών των προγραμμάτων που υλοποιεί το Παράρτημα 
και η υποβολή τους στο Τμήμα.",123,RespA,ΙΓ ΣΥΝΤΑΞ ΔΙΚΑΙΟΛΟΓΗΤ ΑΠΟΠΛΗΡΩΜ ΠΡΟΓΡΑΜΜ ΥΛΟΠΟΙ ΠΑΡΑΡΤΗΜ ΥΠΟΒΟΛ ΤΜΗΜΑ.,70,60,405,23,0.3285714286,RespA,3,0,3,2
2162,0,0,0,1,15,NoIdea,0,0,20080100086.pdf,0,7,17,3,2,1,0,0,Non-Org,0,0,0,0,1,0,0,ιδ) Η σύνταξη του ετήσιου προϋπολογισμού του Παραρτήματος και η υποβολή του στο Τμήμα.,86,RespA,ΙΔ ΣΥΝΤΑΞ ΕΤΗΣ ΠΡΟΥΠΟΛΟΓΙΣΜ ΠΑΡΑΡΤΗΜ ΥΠΟΒΟΛ ΤΜΗΜΑ.,50,18,140,34,0.68,RespA,3,2,1,2
2163,0,0,0,1,15,NoIdea,0,0,20080100086.pdf,0,12,12,2,0,2,0,0,Non-Org,0,0,0,0,1,0,0,ιε) Η παρακολούθηση της απορρόφησης του προϋπολογισμού των προγραμμάτων που εφαρμόζει το Παράρτημα.,99,RespA,ΙΕ ΠΑΡΑΚΟΛΟΥΘΗΣ ΑΠΟΡΡΟΦΗΣ ΠΡΟΥΠΟΛΟΓΙΣΜ ΠΡΟΓΡΑΜΜ ΕΦΑΡΜΟΖ ΠΑΡΑΡΤΗΜΑ.,66,85,1020,24,0.3636363636,RespA,2,0,2,1
2164,0,0,0,0,16,NoIdea,0,0,20080100086.pdf,0,2,11,1,1,0,0,0,Non-Org,0,0,0,0,0,0,0,"Νομική Υπηρεσία
Η Νομική Υπηρεσία υπάγεται απευθείας στον Πρόεδρο του Ι.Κ.Π.Α και είναι αρμόδια για:",100,RespA,ΝΟΜ ΥΠΗΡΕΣ ΝΟΜ ΥΠΗΡΕΣ ΥΠΑΓ ΑΠΕΥΘΕΙ ΠΡΟΕΔΡ Ι.Κ.Π.Α ΑΡΜΟΔ,55,3,33,11,0.2,RespA,1,1,0,6
2165,0,0,0,1,16,NoIdea,0,0,20080100086.pdf,0,12,16,3,1,2,0,1,Non-Org,5,0,0,0,1,0,0,"β) την παροχή γνωμοδοτήσεων επί θεμάτων που παραπέμπονται σε αυτή από το Δ.Σ., τον Πρόεδρο και τις 
Διευθύνσεις του Ι.Κ.Π.Α. γ) τη νομική κάλυψη υποθέσεων που αφορούν το Ι.Κ.Π.Α., και παραπέμπονται σε αυτή 
από το Δ.Σ. ή τον Πρόεδρο αυτού.",239,RespA,Β ΠΑΡΟΧ ΓΝΩΜΟΔΟΤΗΣ ΘΕΜ ΠΑΡΑΠΕΜΠ Δ.Σ. ΠΡΟΕΔΡ ΔΙΕΥΘΥΝΣ Ι.Κ.Π.Α. Γ ΝΟΜ ΚΑΛΥΨ ΥΠΟΘΕΣ ΑΦΟΡ Ι.Κ.Π.Α. ΠΑΡΑΠΕΜΠ Δ.Σ. ΠΡΟΕΔΡ ΑΥΤΟΥ.,122,13,92,27,0.2213114754,Irrelevant,3,1,2,7
2166,0,0,0,0,17,NoIdea,0,0,20080100086.pdf,0,2,0,0,0,0,0,1,Non-Org,6,0,0,0,0,0,0,"Θέσεις Προσωπικού
Οι ως άνω θέσεις έχουν συσταθεί με την υπ’ αριθμ.",67,Non-RespA,ΘΕΣ ΠΡΟΣΩΠ ΘΕΣ ΣΥΣΤΑΘ ΑΡΙΘΜ.,28,0,0,0,0,Irrelevant,0,0,0,2
2167,0,0,0,0,17,NoIdea,0,0,20080100086.pdf,0,4,13,4,2,2,0,2,Non-Org,10,0,0,0,0,0,0,"Π1β/71848/4.10.2005 (ΦΕΚ 1408 τ.Β’) κοινή απόφαση των 
Υπουργών Εσωτερικών, Δημόσιας Διοίκησης και Αποκέντρωσης, Οικονομίας και Οικονομικών και Υγείας και 
Κοινωνικής Αλληλεγγύης και με τις υπ’ αριθμ. 9 και 
10/3.9.2003 αποφάσεις του Προέδρου του Εθνικού Συμβουλίου Κοινωνικής Φροντίδας (ΦΕΚ 218 τ. Ν.Π.Δ.Δ.) 
γ) Προσωπικό με σχέση έμμισθης εντολής.",349,Non-RespA,Π1Β 71848 4.10.2005 ΦΕΚ 1408 Τ.Β ΚΟΙΝ ΑΠΟΦΑΣ ΥΠΟΥΡΓ ΕΣΩΤΕΡ ΔΗΜΟΣ ΔΙΟΙΚΗΣ ΑΠΟΚΕΝΤΡΩΣ ΟΙΚΟΝΟΜ ΟΙΚΟΝΟΜ ΥΓΕΙ ΚΟΙΝΩΝ ΑΛΛΗΛΕΓΓΥ ΑΡΙΘΜ. 9 10 3.9.2003 ΑΠΟΦΑΣ ΠΡΟΕΔΡ ΕΘΝ ΣΥΜΒΟΥΛ ΚΟΙΝΩΝ ΦΡΟΝΤΙΔ ΦΕΚ 218 Τ. Ν.Π.Δ.Δ. Γ ΠΡΟΣΩΠ ΣΧΕΣ ΕΜΜΙΣΘ ΕΝΤΟΛΗΣ.,233,17,109,35,0.1502145923,Irrelevant,4,2,2,19
2168,0,0,0,0,17,NoIdea,0,0,20080100086.pdf,0,3,7,1,0,1,0,0,Non-Org,0,0,0,0,0,0,0,"Μια θέση Δικηγόρου παρ’ Αρείω Πάγω, με πάγια αντιμισθία που συνιστάται κατά τις διατάξεις της παρ. 5 
του άρθρου 38 του ν. 3370/2005.",133,Non-RespA,ΜΙΑ ΘΕΣ ΔΙΚΗΓΟΡ ΠΑΡ ΑΡΕΙ ΠΑΓ ΠΑΓ ΑΝΤΙΜΙΣΘ ΣΥΝΙΣΤ ΔΙΑΤΑΞ ΠΑΡ. 5 ΑΡΘΡ 38 Ν. 3370 2005.,84,3,21,7,0.08333333333,Irrelevant,1,0,1,3
2169,0,0,0,0,18,NoIdea,0,0,20080100086.pdf,0,5,12,1,1,0,0,2,Non-Org,12,0,0,0,0,0,0,"Οι θέσεις προσωπικού του Ι.Κ.Π.Α. διακρίνονται ως 
Διάκριση θέσεων μονίμου προσωπικού
εξής:",91,Non-RespA,ΟΙ ΘΕΣ ΠΡΟΣΩΠ Ι.Κ.Π.Α. ΔΙΑΚΡΙΝ ΔΙΑΚΡΙΣ ΘΕΣ ΜΟΝΙΜ ΠΡΟΣΩΠ,55,2,24,12,0.2181818182,Org,1,1,0,2
2170,0,0,0,1,18,NoIdea,0,0,20080100086.pdf,0,14,12,2,1,1,0,1,Non-Org,6,0,0,0,1,0,0,"αα) Εκατόν είκοσι (120) θέσεις μονίμου προσωπικού που 
έχουν συσταθεί με την υπ’ αριθμ. Π4/ΓΠ 82739/29.8.2003 
(ΦΕΚ 219/τ. Ν. Π.Δ.Δ.) απόφαση του Υπουργού Υγείας 
και Κοινωνικής Αλληλεγγύης, κατ’ εξουσιοδότηση του 
άρθρου 7 παρ.8 του ν. 3106/2003.",247,Non-RespA,ΑΑ ΕΚΑΤΟΝ ΕΙΚΟΣ 120 ΘΕΣ ΜΟΝΙΜ ΠΡΟΣΩΠ ΣΥΣΤΑΘ ΑΡΙΘΜ. Π4 ΓΠ 82739 29.8.2003 ΦΕΚ 219 Τ. Ν. Π.Δ.Δ. ΑΠΟΦΑΣ ΥΠΟΥΡΓ ΥΓΕΙ ΚΟΙΝΩΝ ΑΛΛΗΛΕΓΓΥ ΕΞΟΥΣΙΟΔΟΤΗΣ ΑΡΘΡ 7 ΠΑΡ.8 Ν. 3106 2003.,169,12,64,16,0.09467455621,Irrelevant,2,1,1,8
2171,0,0,0,1,18,NoIdea,0,0,20080100086.pdf,0,0,12,1,1,0,0,1,Non-Org,6,0,0,0,1,0,0,"ββ) Είκοσι εννέα (29) θέσεις μόνιμου προσωπικού, που 
συνιστώνται με το παρόν κατ΄ εξουσιοδότηση των διατάξεων της παρ.5 του άρθρου 38 του ν. 3370/2005.",152,Non-RespA,ΒΒ ΕΙΚΟΣ ΕΝΝ 29 ΘΕΣ ΜΟΝΙΜ ΠΡΟΣΩΠ ΣΥΝΙΣΤΩΝΤΑ ΠΑΡΟΝ ΕΞΟΥΣΙΟΔΟΤΗΣ ΔΙΑΤΑΞ ΠΑΡ.5 ΑΡΘΡ 38 Ν. 3370 2005.,97,2,24,12,0.1237113402,Irrelevant,1,1,0,0
2172,0,0,0,1,18,NoIdea,0,0,20080100086.pdf,0,9,12,11,3,8,0,2,Non-Org,10,0,0,0,1,0,0,"β) Θέσεις με σχέση εργασίας ιδιωτικού δικαίου αορίστου χρόνου 
Διοικητικών−Γραμματέων 
Τεχνικός 
(Ειδικότητα «Υπεύθυνη κλιμακίου Οικοτεχνικής ΔραΔΕ 2 θέσεις
ΔΕ 2 θέσεις
στηριότητας») 
Εργατών 
Τεχνικός 
(Ειδικότητα «Υπεύθυνη Σχολής Ταπητουργίας») 
Καθαρίστρια 
ΥΕ 3 θέσεις 
ΥΕ 5 θέσεις 
ΥΕ 1 θέση 
Οι θέσεις του μονίμου προσωπικού του Ι.Κ.Π.Α. διακρίνονται κατά κατηγορίες, κλάδους και ειδικότητες, 
ως εξής:",408,Non-RespA,Β ΘΕΣ ΣΧΕΣ ΕΡΓΑΣ ΙΔΙΩΤ ΔΙΚΑΙ ΑΟΡΙΣΤ ΧΡΟΝ ΔΙΟΙΚΗΤ ΓΡΑΜΜΑΤ ΤΕΧΝΙΚ ΕΙΔΙΚΟΤΗΤ ΥΠΕΥΘΥΝ ΚΛΙΜΑΚ ΟΙΚΟΤΕΧΝ ΔΡΑΔ 2 ΘΕΣ ΔΕ 2 ΘΕΣ ΣΤΗΡΙΟΤΗΤ ΕΡΓΑΤ ΤΕΧΝΙΚ ΕΙΔΙΚΟΤΗΤ ΥΠΕΥΘΥΝ ΣΧΟΛ ΤΑΠΗΤΟΥΡΓ ΚΑΘΑΡΙΣΤΡ ΥΕ 3 ΘΕΣ ΥΕ 5 ΘΕΣ ΥΕ 1 ΘΕΣ ΘΕΣ ΜΟΝΙΜ ΠΡΟΣΩΠ Ι.Κ.Π.Α. ΔΙΑΚΡΙΝ ΚΑΤΗΓΟΡ ΚΛΑΔ ΕΙΔΙΚΟΤΗΤ,267,64,393,80,0.2996254682,Irrelevant,9,3,6,20
