,AlphaBulletCapDot,AlphaBulletCapPar,AlphaBulletDot,AlphaBulletPar,ArticleNo,Class,DigitBulletDot,DigitBulletPar,Filename,FirstPatternOffset,FirstWordInCapitalOffset,LongestMatchingPattern,MatchedPatternsCount,MatchingBigrams,MatchingUnigrams,OrgMatchingBigrams,OrgMatchingUnigrams,OrgPrediction,OrgTotalMatchingCharacters,PrevAlphaBulletCapDot,PrevAlphaBulletCapPar,PrevAlphaBulletDot,PrevAlphaBulletPar,PrevDigitBulletDot,PrevDigitBulletPar,RawParagraph,RawParagraphLength,RespAPrediction,StemmedParagraph,StemmedParagraphLength,SumMatchingEntries,SumMatchingEntriesLength,TotalMatchingCharacters,TotalMatchingRatio,TotalPrediction,UnqMatchedPatternsCount,UnqMatchingBigrams,UnqMatchingUnigrams,WordsInCapital
1938,0,0,0,0,1,NoIdea,0,0,20080100086.pdf,0,2,14,6,2,4,0,1,Non-Org,6,0,0,0,0,0,0,"Νομική Μορφή Σφραγίδα Έδρα
1. Το Ινστιτούτο Κοινωνικής Προστασίας και Αλληλεγγύης (Ι.Κ.Π.Α.) που ιδρύθηκε με τις διατάξεις του άρθρου 
7 του ν. 3106/2003 και μετονομάστηκε με το του ν.3370/2005 αποτελεί Νομικό Πρόσωπο Δημοσίου 
Δικαίου (Ν.Π.Δ.Δ.), το οποίο τελεί υπό την εποπτεία και 
τον έλεγχο του Υπουργείου Υγείας και Κοινωνικής Αλληλεγγύης.",345,Non-RespA,ΝΟΜ ΜΟΡΦ ΣΦΡΑΓΙΔ ΕΔΡ 1. ΙΝΣΤΙΤΟΥΤ ΚΟΙΝΩΝ ΠΡΟΣΤΑΣ ΑΛΛΗΛΕΓΓΥ Ι.Κ.Π.Α. ΙΔΡΥΘ ΔΙΑΤΑΞ ΑΡΘΡ 7 Ν. 3106 2003 ΜΕΤΟΝΟΜΑΣΤ Ν.3370 2005 ΑΠΟΤΕΛ ΝΟΜ ΠΡΟΣΩΠ ΔΗΜΟΣ ΔΙΚΑΙ Ν.Π.Δ.Δ. ΤΕΛ ΕΠΟΠΤΕΙ ΕΛΕΓΧ ΥΠΟΥΡΓΕΙ ΥΓΕΙ ΚΟΙΝΩΝ ΑΛΛΗΛΕΓΓΥΗΣ.,214,27,171,50,0.2336448598,Org,6,2,4,18
1939,0,0,0,0,1,NoIdea,1,0,20080100086.pdf,0,2,14,4,1,3,0,2,Non-Org,10,0,0,0,0,1,0,"3. Το Ι.Κ.Π.Α. έχει στρογγυλή σφραγίδα, στην οποία 
αναγράφονται σε επάλληλους και ομόκεντρους κύκλους 
οι λέξεις: «ΕΛΛΗΝΙΚΗ ΔΗΜΟΚΡΑΤΙΑ – Υπουργείο Υγείας και Κοινωνικής Αλληλεγγύης – Ινστιτούτο Κοινωνικής Προστασίας και Αλληλεγγύης – Ν.Π.Δ.Δ.» και στο 
κέντρο φέρει το ΕΘΝΟΣΗΜΟ.",279,Non-RespA,3. Ι.Κ.Π.Α. ΣΤΡΟΓΓΥΛ ΣΦΡΑΓΙΔ ΑΝΑΓΡΑΦ ΕΠΑΛΛΗΛ ΟΜΟΚΕΝΤΡ ΚΥΚΛ ΛΕΞ ΕΛΛΗΝ ΔΗΜΟΚΡΑΤ ΥΠΟΥΡΓΕΙ ΥΓΕΙ ΚΟΙΝΩΝ ΑΛΛΗΛΕΓΓΥ ΙΝΣΤΙΤΟΥΤ ΚΟΙΝΩΝ ΠΡΟΣΤΑΣ ΑΛΛΗΛΕΓΓΥ Ν.Π.Δ.Δ. ΚΕΝΤΡ ΦΕΡ ΕΘΝΟΣΗΜΟ.,172,16,102,35,0.2034883721,Org,4,1,3,13
1940,0,0,0,0,2,NoIdea,0,0,20080100086.pdf,0,2,9,3,1,2,0,1,Non-Org,5,0,0,0,0,0,0,"Σκοπός 
Σκοπός του Ι.Κ.Π.Α. είναι η βοήθεια του Υπουργείου 
Υγείας και Κοινωνικής Αλληλεγγύης στη χάραξη πολιτικών στον τομέα της Πρόνοιας. Ειδικότερα το Ι.Κ.Π.Α.:",163,Non-RespA,ΣΚΟΠ ΣΚΟΠ Ι.Κ.Π.Α. ΒΟΗΘΕΙ ΥΠΟΥΡΓΕΙ ΥΓΕΙ ΚΟΙΝΩΝ ΑΛΛΗΛΕΓΓΥ ΧΑΡΑΞ ΠΟΛΙΤ ΤΟΜ ΠΡΟΝΟΙΑΣ. ΕΙΔΙΚ Ι.Κ.Π.Α.,97,17,94,19,0.1958762887,Org,3,1,2,9
1941,0,0,0,1,2,NoIdea,0,0,20080100086.pdf,0,12,13,6,0,6,0,0,Non-Org,0,0,0,0,1,0,0,"β) Γνωμοδοτεί για κάθε θέμα πολιτικής που παραπέμπεται σε αυτό από το Υπουργείο Υγείας και Κοινωνικής Αλληλεγγύης και εισηγείται μέτρα για την πραγματοποίηση των προγραμματικών στόχων στον τομέα 
της κοινωνικής φροντίδας.",221,RespA,Β ΓΝΩΜΟΔΟΤ ΘΕΜ ΠΟΛΙΤ ΠΑΡΑΠΕΜΠ ΥΠΟΥΡΓΕΙ ΥΓΕΙ ΚΟΙΝΩΝ ΑΛΛΗΛΕΓΓΥ ΕΙΣΗΓΕΙΤΑ ΜΕΤΡ ΠΡΑΓΜΑΤΟΠΟΙΗΣ ΠΡΟΓΡΑΜΜΑΤ ΣΤΟΧ ΤΟΜ ΚΟΙΝΩΝ ΦΡΟΝΤΙΔΑΣ.,127,79,456,42,0.3307086614,RespA,6,0,6,4
1942,0,0,0,1,2,NoIdea,0,0,20080100086.pdf,0,35,11,7,1,6,0,0,Non-Org,0,0,0,0,1,0,0,"ε) Εισηγείται στα αρμόδια όργανα, αναφορικά με προγράμματα επιμόρφωσης εκπαιδευτών εθελοντών, που 
πραγματοποιούνται από τις εθελοντικές οργανώσεις 
του άρθρου 12 του ν.2646/1998 και τα οποία είναι σχετικά με τους σκοπούς και τους στόχους των Εθνικών 
Προγραμμάτων.",265,RespA,Ε ΕΙΣΗΓΕΙΤΑ ΑΡΜΟΔ ΟΡΓΑΝ ΑΝΑΦΟΡ ΠΡΟΓΡΑΜΜ ΕΠΙΜΟΡΦΩΣ ΕΚΠΑΙΔΕΥΤ ΕΘΕΛΟΝΤ ΠΡΑΓΜΑΤΟΠΟ ΕΘΕΛΟΝΤ ΟΡΓΑΝΩΣ ΑΡΘΡ 12 Ν.2646 1998 ΣΧΕΤ ΣΚΟΠ ΣΤΟΧ ΕΘΝ ΠΡΟΓΡΑΜΜΑΤΩΝ.,147,117,873,55,0.3741496599,RespA,7,1,6,2
1943,0,0,0,1,2,NoIdea,0,0,20080100086.pdf,0,9,11,5,1,4,0,0,Non-Org,0,0,0,0,1,0,0,"στ) Γνωμοδοτεί στα αρμόδια όργανα για το περιεχόμενο των Εθνικών Προγραμμάτων σύμφωνα με τις 
διατάξεις του άρθρου 2 του ν.2646/1998 και για την 
ανάπτυξη της έρευνας στον τομέα της κοινωνικής φροντίδας σύμφωνα με τις διατάξεις του άρθρου 16 του 
ίδιου νόμου.",259,RespA,ΣΤ ΓΝΩΜΟΔΟΤ ΑΡΜΟΔ ΟΡΓΑΝ ΠΕΡΙΕΧΟΜΕΝ ΕΘΝ ΠΡΟΓΡΑΜΜ ΣΥΜΦΩΝ ΔΙΑΤΑΞ ΑΡΘΡ 2 Ν.2646 1998 ΑΝΑΠΤΥΞ ΕΡΕΥΝ ΤΟΜ ΚΟΙΝΩΝ ΦΡΟΝΤΙΔ ΣΥΜΦΩΝ ΔΙΑΤΑΞ ΑΡΘΡ 16 ΙΔΙ ΝΟΜΟΥ.,146,33,234,41,0.2808219178,RespA,5,1,4,2
1944,0,0,0,1,2,NoIdea,0,0,20080100086.pdf,0,15,18,10,1,9,0,0,Non-Org,0,0,0,0,1,0,0,"ζ) Μελετά, εκπονεί και εφαρμόζει εκπαιδευτικά προγράμματα στο χώρο της πρόνοιας και της οικοτεχνίας
η) Αναπτύσσει την επιστημονική έρευνα στο χώρο της 
πρόνοιας και εκτελεί ερευνητικά έργα στο πλαίσιο των 
προτεραιοτήτων της πολιτικής που καθορίζει το Υπουργείο Υγείας και Κοινωνικής Αλληλεγγύης.",296,RespA,Ζ ΜΕΛΕΤ ΕΚΠΟΝ ΕΦΑΡΜΟΖ ΕΚΠΑΙΔΕΥΤ ΠΡΟΓΡΑΜΜ ΧΩΡ ΠΡΟΝΟΙ ΟΙΚΟΤΕΧΝ ΑΝΑΠΤΥΣΣ ΕΠΙΣΤΗΜΟΝ ΕΡΕΥΝ ΧΩΡ ΠΡΟΝΟΙ ΕΚΤΕΛ ΕΡΕΥΝΗΤ ΕΡΓ ΠΛΑΙΣΙ ΠΡΟΤΕΡΑΙΟΤΗΤ ΠΟΛΙΤ ΚΑΘΟΡΙΖ ΥΠΟΥΡΓΕΙ ΥΓΕΙ ΚΟΙΝΩΝ ΑΛΛΗΛΕΓΓΥΗΣ.,182,131,811,76,0.4175824176,RespA,10,1,9,5
1945,0,0,0,1,2,NoIdea,0,0,20080100086.pdf,0,3,8,3,0,3,0,0,Non-Org,0,0,0,0,1,0,0,"θ) Τηρεί το Εθνικό Μητρώο Υιοθεσιών και το Εθνικό Μητρώο Αναδόχων Ανηλίκων και διαφυλάσσει τον 
απόρρητο χαρακτήρα τους.",120,RespA,Θ ΤΗΡ ΕΘΝ ΜΗΤΡΩ ΥΙΟΘΕΣ ΕΘΝ ΜΗΤΡΩ ΑΝΑΔΟΧ ΑΝΗΛ ΔΙΑΦΥΛΑΣΣ ΑΠΟΡΡΗΤ ΧΑΡΑΚΤΗΡ ΤΟΥΣ.,77,20,115,18,0.2337662338,RespA,2,0,2,7
1946,0,0,0,1,2,NoIdea,0,0,20080100086.pdf,0,7,14,5,1,4,0,2,Non-Org,16,0,0,0,1,0,0,"ι) Ασκεί τις αρμοδιότητες που ανήκαν στον Εθνικό 
Οργανισμό Κοινωνικής Φροντίδας (Ε.Ο.Κ.Φ.) σχετικά με 
την ταπητουργία, κιλιμοποιϊα, εργαστήρια και γενικά τις 
υπηρεσίες οικοτεχνίας του Εθνικού Οργανισμού Πρόνοιας (Ε.Ο.Π.), μαζί με τα παραρτήματά τους σε όλη τη 
χώρα, που παρέμειναν στην αρμοδιότητα του Ε.Ο.Κ.Φ., 
κατ’ εφαρμογή των διατάξεων της παρ. 1.γ του άρθρου 
7 του ν. 2646/1998.",389,RespA,Ι ΑΣΚ ΑΡΜΟΔΙΟΤΗΤ ΑΝ ΕΘΝ ΟΡΓΑΝΙΣΜ ΚΟΙΝΩΝ ΦΡΟΝΤΙΔ Ε.Ο.Κ.Φ. ΣΧΕΤ ΤΑΠΗΤΟΥΡΓ ΚΙΛΙΜΟΠΟΙΙ ΕΡΓΑΣΤΗΡ ΓΕΝΙΚ ΥΠΗΡΕΣ ΟΙΚΟΤΕΧΝ ΕΘΝ ΟΡΓΑΝΙΣΜ ΠΡΟΝΟΙ Ε.Ο.Π. ΠΑΡΑΡΤΗΜ ΧΩΡ ΠΑΡΕΜΕΙΝ ΑΡΜΟΔΙΟΤΗΤ Ε.Ο.Κ.Φ. ΕΦΑΡΜΟΓ ΔΙΑΤΑΞ ΠΑΡ. 1.Γ ΑΡΘΡ 7 Ν. 2646 1998.,227,19,173,45,0.1982378855,RespA,4,1,3,10
1947,0,0,0,1,2,NoIdea,0,0,20080100086.pdf,0,10,9,6,0,6,0,0,Non-Org,0,0,0,0,1,0,0,"ια) Αναλαμβάνει μελέτες αξιολόγησης, μετά από συνεργασία και με το Υπουργείο Υγείας και Κοινωνικής 
Αλληλεγγύης πολιτικών, εθνικών προγραμμάτων και καινοτόμων προγραμμάτων.",172,RespA,ΙΑ ΑΝΑΛΑΜΒΑΝ ΜΕΛΕΤ ΑΞΙΟΛΟΓΗΣ ΣΥΝΕΡΓΑΣ ΥΠΟΥΡΓΕΙ ΥΓΕΙ ΚΟΙΝΩΝ ΑΛΛΗΛΕΓΓΥ ΠΟΛΙΤ ΕΘΝ ΠΡΟΓΡΑΜΜ ΚΑΙΝΟΤΟΜ ΠΡΟΓΡΑΜΜΑΤΩΝ.,110,180,1291,43,0.3909090909,RespA,6,0,6,4
1948,0,0,0,1,2,NoIdea,0,0,20080100086.pdf,0,0,9,7,0,7,0,0,Non-Org,0,0,0,0,1,0,0,"ιβ) Διαχειρίζεται το 5% του συνολικού ετήσιου καθαρού προϊόντος του κρατικού λαχείου κοινωνικής αντίληψης για την ανάπτυξη της επιστημονικής έρευνας στον 
τομέα της κοινωνικής φροντίδας που προβλέπεται στο 
άρθρο 16 του ν. 2646/1998.",233,RespA,ΙΒ ΔΙΑΧΕΙΡΙΖ 5 ΣΥΝΟΛ ΕΤΗΣ ΚΑΘΑΡ ΠΡΟΙΟΝΤ ΚΡΑΤ ΛΑΧΕΙ ΚΟΙΝΩΝ ΑΝΤΙΛΗΨ ΑΝΑΠΤΥΞ ΕΠΙΣΤΗΜΟΝ ΕΡΕΥΝ ΤΟΜ ΚΟΙΝΩΝ ΦΡΟΝΤΙΔ ΠΡΟΒΛΕΠ ΑΡΘΡ 16 Ν. 2646 1998.,138,60,371,48,0.347826087,RespA,7,0,7,0
1949,0,0,0,1,2,NoIdea,0,0,20080100086.pdf,0,3,12,5,3,2,0,0,Non-Org,0,0,0,0,1,0,0,"ιγ) Τηρεί το Εθνικό Μητρώο Ατόμων με Αναπηρίες που 
έχουν ανάγκη των υπηρεσιών κοινωνικής φροντίδας και 
διαφυλάσσει τον απόρρητο χαρακτήρα του.",144,RespA,ΙΓ ΤΗΡ ΕΘΝ ΜΗΤΡΩ ΑΤΟΜ ΑΝΑΠΗΡ ΑΝΑΓΚ ΥΠΗΡΕΣ ΚΟΙΝΩΝ ΦΡΟΝΤΙΔ ΔΙΑΦΥΛΑΣΣ ΑΠΟΡΡΗΤ ΧΑΡΑΚΤΗΡ ΤΟΥ.,88,17,159,48,0.5454545455,RespA,5,3,2,4
1950,0,0,0,1,2,NoIdea,0,0,20080100086.pdf,0,6,4,1,0,1,0,1,Non-Org,8,0,0,0,1,0,0,"ιδ) Λειτουργεί, συντηρεί και αναπτύσσει τον Εθνικό 
Χάρτη Πρόνοιας.",67,RespA,ΙΔ ΛΕΙΤΟΥΡΓ ΣΥΝΤΗΡ ΑΝΑΠΤΥΣΣ ΕΘΝ ΧΑΡΤ ΠΡΟΝΟΙΑΣ.,46,5,20,4,0.08695652174,RespA,1,0,1,3
1951,0,0,0,1,2,NoIdea,0,0,20080100086.pdf,0,0,9,3,0,3,0,0,Non-Org,0,0,0,0,1,0,0,"ιε) Υποστηρίζει την ανάπτυξη, εφαρμογή και διάδοση 
καινοτόμων προγραμμάτων και καλών πρακτικών.",96,RespA,ΙΕ ΥΠΟΣΤΗΡΙΖ ΑΝΑΠΤΥΞ ΕΦΑΡΜΟΓ ΔΙΑΔΟΣ ΚΑΙΝΟΤΟΜ ΠΡΟΓΡΑΜΜ ΚΑΛ ΠΡΑΚΤΙΚΩΝ.,68,15,120,23,0.3382352941,RespA,3,0,3,0
1952,0,0,0,1,2,NoIdea,0,0,20080100086.pdf,0,0,13,4,1,3,0,2,Non-Org,11,0,0,0,1,0,0,"ιη) Γνωμοδοτεί σχετικά με τη χορήγηση έγκρισης 
άδειας για την πραγματοποίηση ερανικού συστήματος μακράς διάρκειας σύμφωνα με το άρθρο 12 του 
ν.3106/2003.",155,RespA,ΙΗ ΓΝΩΜΟΔΟΤ ΣΧΕΤ ΧΟΡΗΓΗΣ ΕΓΚΡΙΣ ΑΔΕΙ ΠΡΑΓΜΑΤΟΠΟΙΗΣ ΕΡΑΝ ΣΥΣΤΗΜ ΜΑΚΡ ΔΙΑΡΚΕΙ ΣΥΜΦΩΝ ΑΡΘΡ 12 Ν.3106 2003.,103,31,243,39,0.3786407767,RespA,4,1,3,0
1953,0,0,0,0,3,NoIdea,0,0,20080100086.pdf,0,2,13,2,2,0,0,0,Non-Org,0,0,0,0,0,0,0,"Όργανα Διοίκησης
Όργανα Διοίκησης του Ι.Κ.Π.Α. είναι:",53,Non-RespA,ΟΡΓΑΝ ΔΙΟΙΚΗΣ ΟΡΓΑΝ ΔΙΟΙΚΗΣ Ι.Κ.Π.Α.,36,3,39,26,0.7222222222,RespA,1,1,0,4
1954,0,0,0,0,4,NoIdea,0,0,20080100086.pdf,0,2,15,3,2,1,0,1,Non-Org,8,0,0,0,0,0,0,"Διοικητικό Συμβούλιο 
Σύνθεση – Λειτουργία Αρμοδιότητες 
1. Το Ι.Κ.Π.Α. διοικείται από επταμελές (7) Διοικητικό Συμβούλιο (Δ.Σ.), με ισάριθμα αναπληρωματικά μέλη 
(παρ. 4 άρθρου 38 ν. 3370/2005) 
Το Δ. Σ. αποτελείται από:",221,Non-RespA,ΔΙΟΙΚΗΤ ΣΥΜΒΟΥΛ ΣΥΝΘΕΣ ΛΕΙΤΟΥΡΓ ΑΡΜΟΔΙΟΤΗΤ 1. Ι.Κ.Π.Α. ΔΙΟΙΚΕΙΤΑ ΕΠΤΑΜΕΛ 7 ΔΙΟΙΚΗΤ ΣΥΜΒΟΥΛ Δ.Σ. ΙΣΑΡΙΘΜ ΑΝΑΠΛΗΡΩΜΑΤ ΜΕΛ ΠΑΡ. 4 ΑΡΘΡ 38 Ν. 3370 2005 Δ. Σ. ΑΠΟΤΕΛΕΙΤΑ,164,14,147,36,0.2195121951,RespA,2,1,1,10
1955,0,0,0,1,4,NoIdea,0,0,20080100086.pdf,0,2,18,3,1,2,0,1,Non-Org,5,0,0,0,1,0,0,"δ) Έναν Ειδικό Πληροφορικής, εξειδικευμένο σε πληροφοριακά συστήματα Κοινωνικής Αλληλεγγύης.",92,Non-RespA,Δ ΕΙΔΙΚ ΠΛΗΡΟΦΟΡ ΕΞΕΙΔΙΚΕΥΜΕΝ ΠΛΗΡΟΦΟΡΙΑΚ ΣΥΣΤΗΜ ΚΟΙΝΩΝ ΑΛΛΗΛΕΓΓΥΗΣ.,68,52,514,38,0.5588235294,RespA,3,1,2,4
1956,0,0,0,1,4,NoIdea,0,0,20080100086.pdf,0,4,4,1,0,1,0,1,Non-Org,5,0,0,0,1,0,0,"ε) Δύο εκπροσώπους του Υπουργείου Υγείας και Κοινωνικής Αλληλεγγύης, εκ των οποίων ο ένας πρέπει να 
είναι ειδικός σε θέματα πιστοποιήσεων.",139,Non-RespA,Ε ΔΥΟ ΕΚΠΡΟΣΩΠ ΥΠΟΥΡΓΕΙ ΥΓΕΙ ΚΟΙΝΩΝ ΑΛΛΗΛΕΓΓΥ ΕΚ ΕΙΔΙΚ ΘΕΜ ΠΙΣΤΟΠΟΙΗΣΕΩΝ.,73,10,40,4,0.05479452055,RespA,1,0,1,4
1957,0,0,0,1,4,NoIdea,0,0,20080100086.pdf,0,6,9,1,0,1,0,0,Non-Org,0,0,0,0,1,0,0,"στ) Έναν εκπρόσωπο των εργαζομένων του Ινστιτούτου, ο οποίος εκλέγεται από το σύνολο των εργαζομένων στο Ινστιτούτο.",116,Non-RespA,ΣΤ ΕΚΠΡΟΣΩΠ ΕΡΓΑΖΟΜΕΝ ΙΝΣΤΙΤΟΥΤ ΕΚΛΕΓ ΣΥΝΟΛ ΕΡΓΑΖΟΜΕΝ ΙΝΣΤΙΤΟΥΤΟ.,65,2,18,9,0.1384615385,RespA,1,0,1,2
1958,0,0,0,0,4,NoIdea,1,0,20080100086.pdf,0,2,8,2,0,2,0,0,Org,0,0,0,0,0,1,0,"3. Το Δ.Σ. του Ι.Κ.Π.Α. εξακολουθεί να ασκεί τα καθήκοντά του και μετά τη λήξη της θητείας του, μέχρι το 
διορισμό του νέου Δ.Σ. και πάντως όχι πέραν των τριών μηνών.",166,Non-RespA,3. Δ.Σ. Ι.Κ.Π.Α. ΕΞΑΚΟΛΟΥΘ ΑΣΚ ΚΑΘΗΚΟΝΤ ΛΗΞ ΘΗΤΕΙ ΔΙΟΡΙΣΜ ΝΕ Δ.Σ. ΠΕΡ ΤΡ ΜΗΝΩΝ.,79,13,96,15,0.1898734177,Org,2,0,2,3
1959,0,0,0,0,4,NoIdea,1,0,20080100086.pdf,0,4,5,3,0,3,0,0,Org,0,0,0,0,0,1,0,"4. Με απόφαση του Υπουργού Υγείας και Κοινωνικής 
Αλληλεγγύης καθορίζεται ο τρόπος και η διαδικασία 
εκλογής του εκπροσώπου των εργαζομένων.",140,Non-RespA,4. ΑΠΟΦΑΣ ΥΠΟΥΡΓ ΥΓΕΙ ΚΟΙΝΩΝ ΑΛΛΗΛΕΓΓΥ ΚΑΘΟΡΙΖ ΤΡΟΠ ΔΙΑΔΙΚΑΣ ΕΚΛΟΓ ΕΚΠΡΟΣΩΠ ΕΡΓΑΖΟΜΕΝΩΝ.,88,17,70,13,0.1477272727,Org,3,0,3,4
1960,0,0,0,0,4,NoIdea,1,0,20080100086.pdf,0,4,18,5,2,3,0,0,Org,0,0,0,0,0,1,0,"5. Στις συνεδριάσεις του Δ.Σ. του Ι.Κ.Π.Α. μπορούν να 
συμμετέχουν, χωρίς δικαίωμα ψήφου, ύστερα από πρόσκληση του Προέδρου του, οι Πρόεδροι και οι Αναπληρωτές Γενικοί Διευθυντές των Υγειονομικών Περιφερειών (Υ.ΠΕ.), καθώς και στελέχη της Γενικής Διεύθυνσης 
Πρόνοιας του Υπουργείου Υγείας και Κοινωνικής Αλληλεγγύης και κάθε άλλου φορέα που είναι αρμόδιος για 
το συζητούμενο θέμα.",382,Non-RespA,5. ΣΥΝΕΔΡΙΑΣ Δ.Σ. Ι.Κ.Π.Α. ΣΥΜΜΕΤΕΧ ΔΙΚΑΙΩΜ ΨΗΦ ΠΡΟΣΚΛΗΣ ΠΡΟΕΔΡ ΠΡΟΕΔΡ ΑΝΑΠΛΗΡΩΤ ΓΕΝΙΚ ΔΙΕΥΘΥΝΤ ΥΓΕΙΟΝΟΜ ΠΕΡΙΦΕΡΕΙ Υ.ΠΕ. ΣΤΕΛΕΧ ΓΕΝΙΚ ΔΙΕΥΘΥΝΣ ΠΡΟΝΟΙ ΥΠΟΥΡΓΕΙ ΥΓΕΙ ΚΟΙΝΩΝ ΑΛΛΗΛΕΓΓΥ ΦΟΡ ΑΡΜΟΔ ΣΥΖΗΤΟΥΜΕΝ ΘΕΜΑ.,207,33,371,51,0.2463768116,Org,5,2,3,17
1961,0,0,0,0,4,NoIdea,1,0,20080100086.pdf,0,2,5,2,0,2,0,1,Non-Org,4,0,0,0,0,1,0,"6. Στον Πρόεδρο του Δ.Σ. του Ι.Κ.Π.Α. καταβάλλονται 
αμοιβή και αποζημίωση για έξοδα παράστασης, το ύψος 
των οποίων καθορίζεται με κοινή απόφαση των Υπουργών Οικονομίας και Οικονομικών και Υγείας και Κοινωνικής Αλληλεγγύης. Με την ίδια απόφαση καθορίζεται 
αποζημίωση για τα μέλη, και το γραμματέα του Διοικητικού Συμβουλίου.",326,Non-RespA,6. ΠΡΟΕΔΡ Δ.Σ. Ι.Κ.Π.Α. ΚΑΤΑΒΑΛΛ ΑΜΟΙΒ ΑΠΟΖΗΜΙΩΣ ΕΞΟΔ ΠΑΡΑΣΤΑΣ ΥΨ ΚΑΘΟΡΙΖ ΚΟΙΝ ΑΠΟΦΑΣ ΥΠΟΥΡΓ ΟΙΚΟΝΟΜ ΟΙΚΟΝΟΜ ΥΓΕΙ ΚΟΙΝΩΝ ΑΛΛΗΛΕΓΓΥΗΣ. ΙΔΙ ΑΠΟΦΑΣ ΚΑΘΟΡΙΖ ΑΠΟΖΗΜΙΩΣ ΜΕΛ ΓΡΑΜΜΑΤ ΔΙΟΙΚΗΤ ΣΥΜΒΟΥΛΙΟΥ.,194,16,70,9,0.04639175258,Org,2,0,2,12
1962,0,0,0,0,4,NoIdea,1,0,20080100086.pdf,0,2,0,0,0,0,0,0,Org,0,0,0,0,0,1,0,"7. Χρέη Γραμματέα του Δ. Σ. ασκεί υπάλληλος του 
Ι.Κ.Π.Α., ο οποίος ορίζεται, μαζί με τον αναπληρωτή του, 
με απόφαση του Προέδρου του Δ.Σ.",139,Non-RespA,7. ΧΡΕ ΓΡΑΜΜΑΤ Δ. Σ. ΑΣΚ ΥΠΑΛΛΗΛ Ι.Κ.Π.Α. ΟΡΙΖ ΑΝΑΠΛΗΡΩΤ ΑΠΟΦΑΣ ΠΡΟΕΔΡ Δ.Σ.,75,0,0,0,0,Org,0,0,0,4
1963,0,0,0,0,4,NoIdea,1,0,20080100086.pdf,0,2,9,4,0,4,0,0,Org,0,0,0,0,0,1,0,"8. Το Δ.Σ. συνεδριάζει κατόπιν προσκλήσεως του Προέδρου του, τακτικά δύο (2) φορές το μήνα και εκτάκτως, 
εάν το ζητήσει ο Πρόεδρος ή η πλειοψηφία των μελών 
του. Σε περίπτωση έκτακτης συνεδρίασης, ο πρόεδρος 
καλεί υποχρεωτικά τα μέλη του Δ.Σ. εντός πέντε ωρών 
από την υποβολή του σχετικού αιτήματος και καθορίζει 
την ώρα και τον τόπο της συνεδρίασης. Η πρόσκληση, 
γνωστοποιείται από το γραμματέα στα μέλη του Δ. Σ.",419,Non-RespA,8. Δ.Σ. ΣΥΝΕΔΡΙΑΖ ΠΡΟΣΚΛΗΣ ΠΡΟΕΔΡ ΤΑΚΤ ΔΥΟ 2 ΦΟΡ ΜΗΝ ΕΚΤΑΚΤΩΣ ΖΗΤ ΠΡΟΕΔΡ Η ΠΛΕΙΟΨΗΦ ΜΕΛ ΤΟΥ. ΠΕΡΙΠΤΩΣ ΕΚΤΑΚΤ ΣΥΝΕΔΡΙΑΣ ΠΡΟΕΔΡ ΚΑΛ ΥΠΟΧΡΕΩΤ ΜΕΛ Δ.Σ. ΠΕΝΤ ΩΡ ΥΠΟΒΟΛ ΣΧΕΤ ΑΙΤΗΜ ΚΑΘΟΡΙΖ ΩΡ ΤΟΠ ΣΥΝΕΔΡΙΑΣΗΣ. ΠΡΟΣΚΛΗΣ ΓΝΩΣΤΟΠΟΙΕΙΤΑ ΓΡΑΜΜΑΤ ΜΕΛ Δ. Σ.,242,38,203,25,0.1033057851,Org,4,0,4,6
1964,0,0,0,0,4,NoIdea,1,0,20080100086.pdf,0,2,9,2,0,2,0,0,Org,0,0,0,0,0,1,0,"10. Το Δ.Σ. βρίσκεται σε απαρτία όταν παρίστανται 
τουλάχιστον τέσσερα (4) από τα μέλη του, μεταξύ των 
οποίων απαραίτητα ο Πρόεδρος ή ο Αντιπρόεδρος αυτού. Οι αποφάσεις λαμβάνονται με απόλυτη πλειοψηφία των παρόντων μελών και σε περίπτωση ισοψηφίας 
υπερισχύει η ψήφος του Προέδρου.",283,Non-RespA,10. Δ.Σ. ΒΡΙΣΚ ΑΠΑΡΤ ΠΑΡΙΣΤΑΝΤΑ ΤΕΣΣΕΡ 4 ΜΕΛ ΑΠΑΡΑΙΤΗΤ ΠΡΟΕΔΡ ΑΝΤΙΠΡΟΕΔΡ ΑΥΤΟΥ. ΑΠΟΦΑΣ ΛΑΜΒΑΝ ΑΠΟΛΥΤ ΠΛΕΙΟΨΗΦ ΠΑΡΟΝΤ ΜΕΛ ΠΕΡΙΠΤΩΣ ΙΣΟΨΗΦ ΥΠΕΡΙΣΧΥ ΨΗΦ ΠΡΟΕΔΡΟΥ.,159,10,78,15,0.09433962264,Org,2,0,2,5
1965,0,0,0,0,4,NoIdea,1,0,20080100086.pdf,0,5,9,2,0,2,0,0,Org,0,0,0,0,0,1,0,"11. Χρέη εισηγητών εκτελούν οι Προϊστάμενοι των Διευθύνσεων του Ι.Κ.Π.Α., οι οποίοι παρίστανται στις συνεδριάσεις του Δ.Σ. χωρίς δικαίωμα ψήφου.",144,Non-RespA,11. ΧΡΕ ΕΙΣΗΓΗΤ ΕΚΤΕΛ ΠΡΟΙΣΤΑΜΕΝ ΔΙΕΥΘΥΝΣ Ι.Κ.Π.Α. ΠΑΡΙΣΤΑΝΤΑ ΣΥΝΕΔΡΙΑΣ Δ.Σ. ΔΙΚΑΙΩΜ ΨΗΦΟΥ.,91,5,37,14,0.1538461538,Org,2,0,2,4
1966,0,0,0,0,4,NoIdea,1,0,20080100086.pdf,0,4,11,3,1,2,0,0,Org,0,0,0,0,0,1,0,"12. Στις συνεδριάσεις του Δ.Σ. του Ι.Κ.Π.Α. συμμετέχει, 
χωρίς δικαίωμα ψήφου, ένας εκ των Νομικών Συμβούλων−Δικηγόρων του Ι.Κ.Π.Α.",131,Non-RespA,12. ΣΥΝΕΔΡΙΑΣ Δ.Σ. Ι.Κ.Π.Α. ΣΥΜΜΕΤΕΧ ΔΙΚΑΙΩΜ ΨΗΦ ΕΚ ΝΟΜ ΣΥΜΒΟΥΛ ΔΙΚΗΓΟΡ Ι.Κ.Π.Α.,80,8,70,27,0.3375,Org,3,1,2,6
1967,0,0,0,0,4,NoIdea,1,0,20080100086.pdf,0,10,9,3,0,3,0,0,Org,0,0,0,0,0,1,0,"13. Κατά τις συνεδριάσεις, τηρούνται πρακτικά, που 
υπογράφονται από τον Πρόεδρο, τα μέλη και τον γραμματέα, με μνεία τυχόν μειοψηφιών και της αιτιολογίας 
αυτών.",162,Non-RespA,13. ΣΥΝΕΔΡΙΑΣ ΤΗΡ ΠΡΑΚΤ ΥΠΟΓΡΑΦ ΠΡΟΕΔΡ ΜΕΛ ΓΡΑΜΜΑΤ ΜΝΕΙ ΜΕΙΟΨΗΦ ΑΙΤΙΟΛΟΓ ΑΥΤΩΝ.,79,27,175,21,0.2658227848,Org,3,0,3,1
1968,0,0,0,0,4,NoIdea,1,0,20080100086.pdf,0,8,9,1,0,1,0,1,Non-Org,8,0,0,0,0,1,0,14. Οι συνεδριάσεις και γενικά η λειτουργία του Δ.Σ.,52,Non-RespA,14. ΣΥΝΕΔΡΙΑΣ ΓΕΝΙΚ ΛΕΙΤΟΥΡΓ Δ.Σ.,33,3,27,9,0.2727272727,Org,1,0,1,1
1969,0,0,0,1,4,NoIdea,0,0,20080100086.pdf,0,12,17,4,1,3,0,0,Non-Org,0,0,0,0,1,0,0,β) Προωθεί την εκπόνηση και παρακολουθεί την εφαρμογή του επιχειρησιακού σχεδίου του Ι.Κ.Π.Α.,93,RespA,Β ΠΡΟΩΘ ΕΚΠΟΝΗΣ ΠΑΡΑΚΟΛΟΥΘ ΕΦΑΡΜΟΓ ΕΠΙΧΕΙΡΗΣΙΑΚ ΣΧΕΔ Ι.Κ.Π.Α.,61,30,253,39,0.6393442623,RespA,4,1,3,1
1970,0,0,0,1,4,NoIdea,0,0,20080100086.pdf,0,11,8,2,1,1,0,0,Non-Org,0,0,0,0,1,0,0,"γ) Αποφασίζει για όλα τα θέματα που αφορούν στη 
διοίκηση του Ι.Κ.Π.Α.",70,RespA,Γ ΑΠΟΦΑΣΙΖ ΘΕΜ ΑΦΟΡ ΔΙΟΙΚΗΣ Ι.Κ.Π.Α.,36,31,248,16,0.4444444444,RespA,2,1,1,1
1971,0,0,0,1,4,NoIdea,0,0,20080100086.pdf,0,5,19,9,6,3,0,0,Non-Org,0,0,0,0,1,0,0,"δ) Εγκρίνει τον προϋπολογισμό του Ι.Κ.Π.Α., καθώς και 
τον ισολογισμό και απολογισμό της οικονομικής χρήσης 
κάθε έτους και τον υποβάλλει στο Υπουργείο Υγείας 
και Κοινωνικής Αλληλεγγύης. Εγκρίνει επίσης κάθε δαπάνη υλοποίησης του προϋπολογισμού.",246,RespA,Δ ΕΓΚΡΙΝ ΠΡΟΥΠΟΛΟΓΙΣΜ Ι.Κ.Π.Α. ΙΣΟΛΟΓΙΣΜ ΑΠΟΛΟΓΙΣΜ ΟΙΚΟΝΟΜ ΧΡΗΣ ΕΤ ΥΠΟΒΑΛΛ ΥΠΟΥΡΓΕΙ ΥΓΕΙ ΚΟΙΝΩΝ ΑΛΛΗΛΕΓΓΥΗΣ. ΕΓΚΡΙΝ ΔΑΠΑΝ ΥΛΟΠΟΙΗΣ ΠΡΟΥΠΟΛΟΓΙΣΜΟΥ.,146,72,560,101,0.6917808219,RespA,9,6,3,6
1972,0,0,0,1,4,NoIdea,0,0,20080100086.pdf,0,0,13,7,2,5,0,1,Non-Org,5,0,0,0,1,0,0,"ε) Αποφασίζει για την αξιοποίηση της ακίνητης και 
κινητής περιουσίας του, καθώς και για την απόκτηση 
περιουσίας, πόρων, αποδοχής κληρονομιών, κληροδοσιών, δωρεών και πάσης φύσεως εισφορών και παροχών προς αυτό.",212,RespA,Ε ΑΠΟΦΑΣΙΖ ΑΞΙΟΠΟΙΗΣ ΑΚΙΝΗΤ ΚΙΝΗΤ ΠΕΡΙΟΥΣ ΑΠΟΚΤΗΣ ΠΕΡΙΟΥΣ ΠΟΡ ΑΠΟΔΟΧ ΚΛΗΡΟΝΟΜ ΚΛΗΡΟΔΟΣ ΔΩΡ ΠΑΣ ΦΥΣ ΕΙΣΦΟΡ ΠΑΡΟΧ ΑΥΤΟ.,117,87,576,56,0.4786324786,RespA,7,2,5,0
1973,0,0,0,1,4,NoIdea,0,0,20080100086.pdf,0,38,18,8,1,7,0,0,Non-Org,0,0,0,0,1,0,0,"στ) Αποφασίζει για τη διάθεση πόρων, για την απόκτηση συγκεκριμένων περιουσιακών στοιχείων, για την 
απόκτηση ακινήτων, για την ανέγερση, επέκταση και 
ανακατασκευή κτιρίων και γενικά για την εκτέλεση παντός έργου που σκοπό έχει την εξυπηρέτηση των σκοπών του Ι.Κ.Π.Α.",268,RespA,ΣΤ ΑΠΟΦΑΣΙΖ ΔΙΑΘΕΣ ΠΟΡ ΑΠΟΚΤΗΣ ΣΥΓΚΕΚΡΙΜΕΝ ΠΕΡΙΟΥΣΙΑΚ ΣΤΟΙΧΕΙ ΑΠΟΚΤΗΣ ΑΚΙΝΗΤ ΑΝΕΓΕΡΣ ΕΠΕΚΤΑΣ ΑΝΑΚΑΤΑΣΚΕΥ ΚΤΙΡ ΓΕΝΙΚ ΕΚΤΕΛΕΣ ΠΑΝΤ ΕΡΓ ΣΚΟΠ ΕΞΥΠΗΡΕΤΗΣ ΣΚΟΠ Ι.Κ.Π.Α.,162,26,215,71,0.4382716049,RespA,8,1,7,1
