RawParagraph,RespAPrediction
"19. Τοποθετούν προσωρινά τους νεοδιοριζόμενους στην περιοχή αρμοδιότητάς τους, ύστερα από πρόταση του κατά περίπτωση οικείου Περιφερειακού Υπηρεσι- ακού Συμβουλίου Πρωτοβάθμιας ή Δευτεροβάθμιας Εκπαίδευσης (Π.Υ.Σ.Π.Ε. ή Π.Υ.Σ.Δ.Ε.) ή του Περιφερει- ακού Υπηρεσιακού Συμβουλίου Ειδικού Εκπαιδευτικού Προσωπικού (Π.Υ.Σ.Ε.Ε.Π.).",RespA
"20. Τοποθετούν τους εκπαιδευτικούς και τα μέλη ΕΕΠ - ΕΒΠ που βρίσκονται στη διάθεση ή μετατίθενται στην περιοχή αρμοδιότητάς τους, ύστερα από πρόταση του κατά περίπτωση οικείου Περιφερειακού Υπηρεσιακού Συμβουλίου Πρωτοβάθμιας ή Δευτεροβάθμιας Εκπαί- δευσης (Π.Υ.Σ.Π.Ε. ή Π.Υ.Σ.Δ.Ε.) ή του Περιφερειακού Υπηρεσιακού Συμβουλίου Ειδικού Εκπαιδευτικού Προ- σωπικού (Π.Υ.Σ.Ε.Ε.Π.).",RespA
"21. Τοποθετούν τους εκπαιδευτικούς και τα μέλη ΕΕΠ -
ΕΒΠ που αποσπώνται στην περιοχή αρμοδιότητάς τους,
σε κενές θέσεις, ύστερα από γνώμη του κατά περίπτωση
οικείου Περιφερειακού Υπηρεσιακού Συμβουλίου Πρω-
τοβάθμιας ή Δευτεροβάθμιας Εκπαίδευσης (Π.Υ.Σ.Π.Ε. ή
Π.Υ.Σ.Δ.Ε.) ή του Περιφερειακού Υπηρεσιακού Συμβου-
λίου Ειδικού Εκπαιδευτικού Προσωπικού (Π.Υ.Σ.Ε.Ε.Π.).",RespA
"22. Φυλάσσουν και ενημερώνουν τους ατομικούς υπηρεσιακούς φακέλους των εκπαιδευτικών, των μελών ΕΕΠ-ΕΒΠ και των διοικητικών υπαλλήλων της περιοχής ευθύνης τους.",RespA
"23. Καθορίζουν την περιφέρεια εγγραφής των μαθη- τών στις σχολικές μονάδες, ύστερα από εισήγηση των αρμοδίων οργάνων.",RespA
24. Ορίζουν τον υπεύθυνο λειτουργίας στις Δ.Υ.Ε.Π.,RespA
25. Εγκρίνουν τη λειτουργία των Τάξεων Υποδοχής και των Φροντιστηριακών Τμημάτων και αναθέτουν σε εκπαιδευτικούς τη διδασκαλία σε αυτά.,RespA
"26. Προκηρύσσουν τις θέσεις των Υπευθύνων Σχολι- κών Δραστηριοτήτων, Περιβαλλοντικής Εκπαίδευσης, Αγωγής Υγείας ή Πολιτιστικών Θεμάτων, των θέσεων Υπευθύνων Φυσικής Αγωγής και Σχολικού Αθλητισμού και των λοιπών θέσεων, οι οποίοι επιλέγονται από το Τοπικό Συμβούλιο Επιλογής.",RespA
"27. Επικυρώνουν τα αναλυτικά πρακτικά που τηρού- νται καθ’ όλη τη διάρκεια των εργασιών από τον γραμ- ματέα του συμβουλίου, μετά το τέλος της διαδικασίας επιλογής Υπευθύνων της παρ. 26.",RespA
"28. Τοποθετούν σε κενές και κενούμενες θέσεις τους (i) Υπευθύνους Πληροφορικής και Νέων Τεχνολογιών, (ii) Υπευθύνους Φυσικής Αγωγής και Σχολικού Αθλητισμού, (iii) Υπευθύνους Σχολικών Δραστηριοτήτων, (iv) Υπευ- θύνους Αγωγής Υγείας, (v) Υπευθύνους Πολιτιστικών Θεμάτων, (vii) Υπευθύνους Περιβαλλοντικής Εκπαίδευ- σης, (viii) Υπευθύνους Κέντρων Εργαστηρίων Φυσικών Επιστημών, (ix) Υπευθύνους Σχολικού Επαγγελματικού Προσανατολισμού.",RespA
Άρθρο 6,Non-RespA
Αρμοδιότητες των Διευθυντών Εκπαίδευσης σχετικές με τα λοιπά θέματα υπηρεσιακής κατάστασης των εκπαιδευτικών και μελών ΕΕΠ - ΕΒΠ,Non-RespA
"1. Οι Διευθυντές Εκπαίδευσης χορηγούν στους διοικητικούς υπαλλήλους της αρμοδιότητας τους άδειες κανονικές, αναρρωτικές, κύησης και λοχείας, γονικές, μητρότητας και ειδικές με αποδοχές ή χωρίς αποδοχές, εξετάσεων, άδειες για επιμορφωτικούς και επιστημονικούς λόγους, καθώς και τις άδειες όσων άλλων προβλεπόμενων από την κείμενη νομοθεσία διευκολύνσεων.",RespA
"2. Χορηγούν στους εκπαιδευτικούς και τα μέλη ΕΕΠ- ΕΒΠ της αρμοδιότητάς τους άδειες αναρρωτικές μακρο- χρόνιες, κύησης και λοχείας, γονικές, μητρότητας, άδειες για επιμορφωτικούς και επιστημονικούς λόγους, άδειες άνευ αποδοχών για τις οποίες δεν απαιτείται γνώμη υπηρεσιακού συμβουλίου, καθώς και τις άδειες όσων άλλων προβλεπόμενων από την κείμενη νομοθεσία δι- ευκολύνσεων.",RespA
"3. Χορηγούν τις συνδικαλιστικές άδειες στους εκπαι-
δευτικούς και τα μέλη ΕΕΠ-ΕΒΠ για να ασκούν τα καθή-
κοντά τους ως μέλη Διοικητικών Συμβουλίων, Εκτελε-
στικών - Ελεγκτικών Επιτροπών και ως αντιπροσώπων
σε συνδικαλιστικές οργανώσεις.",RespA
4. Χορηγούν άδεια άσκησης ιδιωτικού έργου με αμοι- βή κατόπιν γνώμης του αρμόδιου υπηρεσιακού συμ- βουλίου στους εκπαιδευτικούς και στα μέλη ΕΕΠ-ΕΒΠ.\,RespA
"5. Αποσπούν τους εκπαιδευτικούς, οι οποίοι είναι μέλη των διοικητικών συμβουλίων των συνδικαλιστικών ορ- γανώσεων σε σχολεία της έδρας.",RespA
"6. Χορηγούν στους εκπαιδευτικούς, τις άδειες για να ασκήσουν τα καθήκοντά τους ως αιρετά μέλη της αυτο- διοίκησης στους εκπαιδευτικούς και τα μέλη ΕΕΠ - ΕΒΠ.",RespA
"7. Ρυθμίζουν όλα τα θέματα, τα οποία έχουν σχέση με την εκλογή των αιρετών μελών των ΠΥΣΠΕ και ΠΥΣΔΕ. 8. Εκδίδουν τις διαπιστωτικές πράξεις απόλυσης λόγω ορίου ηλικίας των εκπαιδευτικών των δημοσίων, των ιδιωτικών και ισοτίμων ξένων σχολείων.",RespA
"8. Εκδίδουν τις διαπιστωτικές πράξεις απόλυσης λόγω ορίου ηλικίας των εκπαιδευτικών των δημοσίων, των ιδιωτικών και ισοτίμων ξένων σχολείων.",RespA
9. Εκδίδουν τις διαπιστωτικές πράξεις απόλυσης των μόνιμων εκπαιδευτικών λόγω μη ανάληψης υπηρεσίας εντός μηνός μετά τη λήξη μακροχρόνιας άδειας άνευ αποδοχών.,RespA
"10. Αποδέχονται τις παραιτήσεις και εκδίδουν τις δι- απιστωτικές πράξεις απόλυσης των μόνιμων εκπαιδευ- τικών, των μελών ΕΕΠ-ΕΒΠ καθώς και εκείνων, οι οποίοι υπηρετούν με σύμβαση αορίστου χρόνου.",RespA
"11. Εκδίδουν τις διαπιστωτικές πράξεις για την επάνο- δο στην υπηρεσία των μόνιμων εκπαιδευτικών, οι οποίοι δεν εκλέχθηκαν βουλευτές ή των οποίων έληξε η βου- λευτική τους θητεία.",RespA
"12. Διαβιβάζουν τα απαιτούμενα δικαιολογητικά για τη σύνταξη των εκπαιδευτικών, των μελών ΕΕΠ-ΕΒΠ και των διοικητικών υπαλλήλων της αρμοδιότητάς τους στην υπηρεσία συντάξεων του Γενικού Λογιστηρίου του Κράτους.",RespA
13. Επιλαμβάνονται κάθε θέματος που αναφέρεται στην υπηρεσιακή κατάσταση του εκπαιδευτικού προ- σωπικού των σχολείων της περιοχής ευθύνης τους και εκδίδουν τις απαραίτητες πράξεις ή εισηγούνται στα Οικεία Υπηρεσιακά Συμβούλια.,RespA
"14. Είναι εκκαθαριστές των αποδοχών όχι μόνο του προσωπικού που υπηρετεί στα Γραφεία της Διεύθυνσης, αλλά και του προσωπικού που υπηρετεί στις σχολικές μονάδες αρμοδιότητάς τους. Επίσης, είναι εκκαθαριστές των αποδοχών των Συμβούλων Εκπαίδευσης της περιο- χής αρμοδιότητάς τους.",RespA
Άρθρο 7,Non-RespA
Αρμοδιότητες των Διευθυντών Εκπαίδευσης σε σχέση με τους Διευθυντές/Προϊσταμένους - Υποδιευθυντές σχολικών μονάδων και ξένων σχολείων με ελληνικό πρόγραμμα σπουδών,Non-RespA
"1. Οι Διευθυντές Εκπαίδευσης της Πρωτοβάθμιας και της Δευτεροβάθμιας Εκπαίδευσης είναι διοικητικοί και πειθαρχικοί προϊστάμενοι των Προϊσταμένων Εκπαιδευ- τικών Θεμάτων, των Διευθυντών και Υποδιευθυντών των σχολικών μονάδων και των Εργαστηριακών Κέντρων (Ε.Κ.), των Προϊσταμένων ολιγοθεσίων σχολικών μο-νάδων και των υπευθύνων Τομέων Εργαστηριακών Κέντρων (Ε.Κ.) καθώς και των δημόσιων και ιδιωτικών εκπαιδευτικών της περιοχής ευθύνης τους.",RespA
"2. Ειδικότερα, οι Διευθυντές Εκπαίδευσης:",Non-RespA
"α. Εποπτεύουν το έργο των Διευθυντών όλων των σχο- λικών μονάδων (δημοσίων και ιδιωτικών) και ελέγχουν, αν η διοίκηση και η λειτουργία των σχολείων εναρμονί- ζονται με τις διατάξεις της ισχύουσας νομοθεσίας.",RespA
β. Επισκέπτονται κατά την κρίση τους τις σχολικές μο- νάδες της εκπαιδευτικής τους περιφέρειας και παρέχουν στους Διευθυντές των σχολείων τις απαραίτητες οδηγίες.,RespA
"γ. Συγκαλούν συσκέψεις των Διευθυντών των σχολι- κών μονάδων κατά περιοχή και οργανώνουν επιμορφω- τικά σεμινάρια για θέματα αρμοδιότητάς τους, δίνουν τις απαραίτητες οδηγίες και αίρουν σχετικές αμφιβολίες και αμφισβητήσεις.",RespA
"δ. Συνεργάζονται με τους Συμβούλους Εκπαίδευσης για τη διευθέτηση διαφορών ανάμεσα στους Διευθυντές και το διδακτικό προσωπικό στις σχολικές μονάδες της περιοχής αρμοδιότητάς τους, προκειμένου να αποκατα- στήσουν το ήρεμο παιδαγωγικό κλίμα στο σχολείο και να εξασφαλίσουν πνεύμα συνεργασίας.",RespA
"ε. Εξετάζουν τις καταγγελίες που γίνονται σε βάρος των Διευθυντών, των εκπαιδευτικών και των μελών ΕΕΠ-ΕΒΠ, ελέγχουν την αξιοπιστία τους και στις περιπτώσεις που κρίνουν ότι υφίσταται πρόβλημα, ασκούν τις πειθαρχικές τους αρμοδιότητες.",RespA
"στ. Αξιολογούν τους Διευθυντές/Προϊσταμένους των σχολικών μονάδων και Ε.Κ., σύμφωνα με τις ισχύουσες διατάξεις, πλην των Διευθυντών των Πρότυπων Σχολεί- ων και των Πειραματικών Σχολείων.",RespA
ζ. Συμμετέχουν στην Ειδική επιτροπή Αξιολόγησης και εξετάζουν τις ενστάσεις των αξιολογούμενων.,RespA
Άρθρο 8,Non-RespA
"Αρμοδιότητες των Διευθυντών Εκπαίδευσης σε σχέση με τους Συμβούλους Εκπαίδευσης, Επόπτες Ποιότητας",Non-RespA
"1. Οι Διευθυντές Εκπαίδευσης είναι διοικητικοί και πειθαρχικοί προϊστάμενοι των Εποπτών Ποιότητας της Εκπαίδευσης, των Συμβούλων Εκπαίδευσης και συνερ-γάζονται με τους Συμβούλους Εκπαίδευσης για κάθε θέμα που σχετίζεται με τη βελτίωση της παρεχόμενης εκπαίδευσης, προκειμένου να υπάρξει παιδαγωγική επι- στημονική και διοικητική στήριξη στη λειτουργία του σχολείου.",RespA
"2. Ειδικότερα, οι Διευθυντές Εκπαίδευσης: α. Εντός του μηνός Σεπτεμβρίου πραγματοποιείται κοινή σύσκεψη του Διευθυντή Εκπαίδευσης και των Συμβούλων Εκπαίδευσης για τον προγραμματισμό των εκπαιδευτικών δραστηριοτήτων του διδακτικού έτους.",RespA
α. Εντός του μηνός Σεπτεμβρίου πραγματοποιείται κοινή σύσκεψη του Διευθυντή Εκπαίδευσης και των Συμβούλων Εκπαίδευσης για τον προγραμματισμό των εκπαιδευτικών δραστηριοτήτων του διδακτικού έτους.,RespA
"β. Οι Διευθυντές Εκπαίδευσης στο πλαίσιο της αρμοδι- ότητάς τους, εάν επισημαίνουν προβλήματα εκπαιδευ- τικού χαρακτήρα, ενημερώνουν τον Επόπτη Ποιότητας της Εκπαίδευσης και τον αρμόδιο Σύμβουλο Εκπαίδευ- σης και εισηγούνται τις λύσεις που θεωρούν αναγκαίες.",RespA
3. O Διευθυντής Εκπαίδευσης αποφασίζει τη συγκρό-τηση του σώματος των Συμβούλων Εκπαίδευσης.,RespA
4. Ο Διευθυντής Εκπαίδευσης τοποθετεί στη γραμμα-τεία του Επόπτη Ποιότητας της Εκπαίδευσης διοικητι-κούς υπαλλήλους ή αποσπασμένους εκπαιδευτικούς.,RespA
Άρθρο 9,Non-RespA
Αρμοδιότητες των Διευθυντών Εκπαίδευσης σε σχέση με τα εκκλησιαστικά σχολεία του ν. 4823/2021 (Α’ 136),Non-RespA
"Οι αρμοδιότητες των Διευθυντών Εκπαίδευσης όσον αφορά στα εκκλησιαστικά σχολεία που υπάγονται στη Γενική Γραμματεία Θρησκευμάτων του ΥΠΑΙΘ είναι αυτές που ορίζονται στις διατάξεις της παρούσας, με την επι-φύλαξη ειδικώς ισχυουσών διατάξεων, οι οποίες συμπλη-ρωματικά ή κατά παρέκκλιση διατάξεων της παρούσας ορίζουν διαφορετικά.",RespA
Άρθρο 10,Non-RespA
Μεταβατικές διατάξεις,Non-RespA
Μέχρι την επιλογή και ανάληψη καθηκόντων των Συμ- Τεύχος B’ 6273/28.12.2021 βούλων Εκπαίδευσης εφαρμόζονται οι ισχύουσες μέχρι την έκδοση του παρόντος αρμοδιότητες Διευθυντών Εκπαίδευσης σε σχέση με τους Συντονιστές Εκπαιδευ-τικού Έργου.,Non-RespA
Άρθρο 11,Non-RespA
Καταργούμενες διατάξεις,Non-RespA
"Από την έκδοση της παρούσας καταργούνται τα άρ-θρα 14 έως και 25 της υπό στοιχεία Φ.353.1/324/105657/Δ1/8.10.2002 (Β’ 1340) υπουργικής απόφασης, που ανα-φέρονται στα ειδικότερα καθήκοντα και αρμοδιότητες των Διευθυντών και των Γραφείων Εκπαίδευσης με την επιφύλαξη του άρθρου 9.",Non-RespA
Η απόφαση αυτή να δημοσιευθεί στην Εφημερίδα της Κυβερνήσεως.,Non-RespA
"Μαρούσι, 28 Δεκεμβρίου 2021",Non-RespA
Η Υπουργός ΝΙΚΗ ΚΕΡΑΜΕΩΣ,Non-RespA
Η Υφυπουργός ΖΩΗ ΜΑΚΡΗ,Non-RespA