,AlphaBulletCapDot,AlphaBulletCapPar,AlphaBulletDot,AlphaBulletPar,ArticleNo,Class,DigitBulletDot,DigitBulletPar,Filename,FirstPatternOffset,FirstWordInCapitalOffset,LongestMatchingPattern,MatchedPatternsCount,MatchingBigrams,MatchingUnigrams,OrgMatchingBigrams,OrgMatchingUnigrams,OrgPrediction,OrgTotalMatchingCharacters,PrevAlphaBulletCapDot,PrevAlphaBulletCapPar,PrevAlphaBulletDot,PrevAlphaBulletPar,PrevDigitBulletDot,PrevDigitBulletPar,RawParagraph,RawParagraphLength,RespAPrediction,StemmedParagraph,StemmedParagraphLength,SumMatchingEntries,SumMatchingEntriesLength,TotalMatchingCharacters,TotalMatchingRatio,TotalPrediction,UnqMatchedPatternsCount,UnqMatchingBigrams,UnqMatchingUnigrams,WordsInCapital
1221,0,0,0,1,180,NoIdea,0,0,20080100036.pdf,0,19,5,1,0,1,0,0,Non-Org,0,0,0,0,1,0,0,"β) όταν η ζημία προκλήθηκε από πολλούς μεταφορείς, 
κάθε ένας από αυτούς ευθύνεται για τη ζημία που αυτός 
προκάλεσε. Εάν η διάκριση είναι αδύνατη, η αποζημίωση 
κατανέμεται μεταξύ τους σύμφωνα με τις διατάξεις της 
περίπτωσης γ) της παρ. 1 του παρόντος άρθρου,",261,Non-RespA,Β ΖΗΜ ΠΡΟΚΛ ΠΟΛΛ ΜΕΤΑΦΟΡ ΕΥΘΥΝ ΖΗΜ ΠΡΟΚΑΛΕΣΕ. ΔΙΑΚΡΙΣ ΑΔΥΝΑΤ ΑΠΟΖΗΜΙΩΣ ΚΑΤΑΝΕΜ ΣΥΜΦΩΝ ΔΙΑΤΑΞ ΠΕΡΙΠΤΩΣ Γ ΠΑΡ. 1 ΠΑΡΟΝΤ ΑΡΘΡ,122,10,50,5,0.04098360656,Irrelevant,1,0,1,1
1222,0,0,0,1,180,NoIdea,0,0,20080100036.pdf,0,37,7,2,0,2,0,0,Non-Org,0,0,0,0,1,0,0,"γ) εάν δεν μπορεί να αποδειχτεί ποιος από τους μεταφορείς προκάλεσε τη ζημία, η αποζημίωση κατανέμεται 
μεταξύ όλων των μεταφορέων που έχουν συμμετάσχει 
στη μεταφορά, με εξαίρεση εκείνους που αποδεικνύουν 
ότι η ζημία δεν προκλήθηκε από αυτούς. Η κατανομή 
πραγματοποιείται κατ’αναλογία του τμήματος του κομίστρου που αντιστοιχεί σε κάθε έναν από τους μεταφορείς.",364,Non-RespA,Γ ΔΕΝ ΑΠΟΔΕΙΧΤ ΜΕΤΑΦΟΡ ΠΡΟΚΑΛΕΣ ΖΗΜ ΑΠΟΖΗΜΙΩΣ ΚΑΤΑΝΕΜ ΜΕΤΑΦΟΡ ΣΥΜΜΕΤΑΣΧ ΜΕΤΑΦΟΡ ΕΞΑΙΡΕΣ ΑΠΟΔΕΙΚΝΥ ΖΗΜ ΔΕΝ ΠΡΟΚΛ ΑΥΤΟΥΣ. ΚΑΤΑΝΟΜ ΠΡΑΓΜΑΤΟΠΟΙΕΙΤΑ ΑΝΑΛΟΓ ΤΜΗΜ ΚΟΜΙΣΤΡ ΑΝΤΙΣΤΟΙΧ ΜΕΤΑΦΟΡΕΙΣ.,185,12,77,13,0.07027027027,Irrelevant,2,0,2,1
1223,0,0,0,0,181,NoIdea,0,0,20080100036.pdf,0,3,6,5,0,5,0,0,Non-Org,0,0,0,0,0,0,0,"Διαδικασία αναγωγής
1. Το βάσιμο της καταβολής, που πραγματοποιήθηκε 
από τον μεταφορέα που άσκησε μία αναγωγή δυνάμει 
των διατάξεων του άρθρου 50 των παρόντων Ενιαίων 
Νομικών Κανόνων, δεν δύναται να αμφισβητηθεί από τον 
μεταφορέα κατά του οποίου ασκήθηκε η αναγωγή, όταν 
η αποζημίωση καθορίστηκε με δικαστική απόφαση και 
αυτός ο τελευταίος μεταφορέας δεόντως κλητευθείς 
είχε το δικαίωμα να παρέμβει στη διαδικασία. Ο δικαστής, που έχει επιληφθεί της κύριας αγωγής, καθορίζει 
τις προθεσμίες για την επίδοση της κλήσης και για την 
παρέμβαση.",548,Non-RespA,ΔΙΑΔΙΚΑΣ ΑΝΑΓΩΓ 1. ΒΑΣΙΜ ΚΑΤΑΒΟΛ ΠΡΑΓΜΑΤΟΠΟΙ ΜΕΤΑΦΟΡ ΑΣΚ ΑΝΑΓΩΓ ΔΥΝΑΜ ΔΙΑΤΑΞ ΑΡΘΡ 50 ΠΑΡΟΝΤ ΕΝΙΑΙ ΝΟΜ ΚΑΝΟΝ ΔΕΝ ΔΥΝ ΑΜΦΙΣΒΗΤ ΜΕΤΑΦΟΡ ΑΣΚ ΑΝΑΓΩΓ ΑΠΟΖΗΜΙΩΣ ΚΑΘΟΡΙΣΤ ΔΙΚΑΣΤ ΑΠΟΦΑΣ ΤΕΛΕΥΤΑΙ ΜΕΤΑΦΟΡ ΔΕΟΝΤΩΣ ΚΛΗΤΕΥΘ ΔΙΚΑΙΩΜ ΠΑΡΕΜΒ ΔΙΑΔΙΚΑΣΙΑ. ΔΙΚΑΣΤ ΕΠΙΛΗΦΘ ΚΥΡΙ ΑΓΩΓ ΚΑΘΟΡΙΖ ΠΡΟΘΕΣΜ ΕΠΙΔΟΣ ΚΛΗΣ ΠΑΡΕΜΒΑΣΗ.,300,19,92,26,0.08666666667,Org,4,0,4,5
1224,0,0,0,0,181,NoIdea,1,0,20080100036.pdf,0,0,6,1,0,1,0,0,Org,0,0,0,0,0,1,0,"3. Ο δικαστής οφείλει να αποφανθεί με μία και την 
αυτή απόφαση επί όλων των αναγωγών των οποίων 
έχει επιληφθεί.",113,Non-RespA,3. ΔΙΚΑΣΤ ΟΦΕΙΛ ΑΠΟΦΑΝΘ ΑΠΟΦΑΣ ΑΝΑΓΩΓ ΕΠΙΛΗΦΘΕΙ.,48,2,12,6,0.125,Org,1,0,1,0
1225,0,0,0,0,181,NoIdea,1,0,20080100036.pdf,0,15,9,2,0,2,0,0,Org,0,0,0,0,0,1,0,"4. Ο μεταφορέας που επιθυμεί να ασκήσει το δικαίωμα 
αναγωγής δύναται να προσφύγει στις δικαστικές Αρχές 
του Κράτους στην επικράτεια του οποίου ένας από τους 
μεταφορείς που συμμετείχαν στη μεταφορά έχει την 
κύρια έδρα του ή το υποκατάστημα ή την επιχείρηση 
που συνήψε το συμβόλαιο μεταφοράς.",295,Non-RespA,4. ΜΕΤΑΦΟΡ ΕΠΙΘΥΜ ΑΣΚ ΔΙΚΑΙΩΜ ΑΝΑΓΩΓ ΔΥΝ ΠΡΟΣΦΥΓ ΔΙΚΑΣΤ ΑΡΧ ΚΡΑΤ ΕΠΙΚΡΑΤΕΙ ΜΕΤΑΦΟΡ ΣΥΜΜΕΤΕΙΧ ΜΕΤΑΦΟΡ ΚΥΡΙ ΕΔΡ ΥΠΟΚΑΤΑΣΤΗΜ ΕΠΙΧΕΙΡΗΣ ΣΥΝΗΨ ΣΥΜΒΟΛΑΙ ΜΕΤΑΦΟΡΑΣ.,157,17,147,15,0.09554140127,Org,2,0,2,2
1226,0,0,0,0,181,NoIdea,1,0,20080100036.pdf,0,0,8,3,0,3,0,0,Org,0,0,0,0,0,1,0,"5. Οταν η αγωγή πρέπει να κατατεθεί κατά πολλών 
μεταφορέων, ο μεταφορέας που ασκεί το δικαίωμα 
αναγωγής δύναται να επιλέξει μεταξύ των αρμοδίων 
δικαστηρίων σύμφωνα με τις διατάξεις της παρ. 4 του 
παρόντος άρθρου, εκείνο ενώπιον του οποίου θα καταθέσει την προσφυγή του.",273,Non-RespA,5. ΑΓΩΓ ΚΑΤΑΤΕΘ ΠΟΛΛ ΜΕΤΑΦΟΡ ΜΕΤΑΦΟΡ ΑΣΚ ΔΙΚΑΙΩΜ ΑΝΑΓΩΓ ΔΥΝ ΕΠΙΛΕΞ ΑΡΜΟΔ ΔΙΚΑΣΤΗΡ ΣΥΜΦΩΝ ΔΙΑΤΑΞ ΠΑΡ. 4 ΠΑΡΟΝΤ ΑΡΘΡ ΕΝΩΠ ΚΑΤΑΘΕΣ ΠΡΟΣΦΥΓ ΤΟΥ.,140,10,57,19,0.1357142857,Org,3,0,3,0
1227,0,0,0,0,181,NoIdea,1,0,20080100036.pdf,0,13,8,2,0,2,0,0,Org,0,0,0,0,0,1,0,"6. Οι αξιώσεις από δικαιώματα αναγωγής δεν δύνανται 
να ασκηθούν ενώπιον της δικαστικής Αρχής η οποία έχει 
επιληφθεί της αίτησης αποζημίωσης του δικαιούχου 
βάσει του συμβολαίου μεταφοράς.",189,Non-RespA,6. ΑΞΙΩΣ ΔΙΚΑΙΩΜ ΑΝΑΓΩΓ ΔΕΝ ΔΥΝΑΝΤΑ ΑΣΚ ΕΝΩΠ ΔΙΚΑΣΤ ΑΡΧ ΕΠΙΛΗΦΘ ΑΙΤΗΣ ΑΠΟΖΗΜΙΩΣ ΔΙΚΑΙΟΥΧ ΒΑΣ ΣΥΜΒΟΛΑΙ ΜΕΤΑΦΟΡΑΣ.,112,7,52,14,0.125,Org,2,0,2,1
1228,0,0,0,0,182,NoIdea,0,0,20080100036.pdf,0,6,7,2,0,2,0,0,Non-Org,0,0,0,0,0,0,0,"Συμφωνίες στο θέμα των αναγωγών
Οι μεταφορείς είναι ελεύθερα να συμφωνήσουν μεταξύ τους διατάξεις οι οποίες παρεκκλίνουν από τις 
διατάξεις των άρθρων 49 και 50 των παρόντων Ενιαίων 
Νομικών Κανόνων.",199,Non-RespA,ΣΥΜΦΩΝ ΘΕΜ ΑΝΑΓΩΓ ΜΕΤΑΦΟΡ ΕΛΕΥΘΕΡ ΣΥΜΦΩΝ ΔΙΑΤΑΞ ΠΑΡΕΚΚΛΙΝ ΔΙΑΤΑΞ ΑΡΘΡ 49 50 ΠΑΡΟΝΤ ΕΝΙΑΙ ΝΟΜ ΚΑΝΟΝΩΝ.,101,6,34,12,0.1188118812,Org,2,0,2,4
1229,0,0,0,0,183,NoIdea,0,0,20080100036.pdf,0,3,0,0,0,0,0,0,Non-Org,0,0,0,0,0,0,0,"Πεδίο εφαρμογής
1. Ο παρών Κανονισμός εφαρμόζεται:",50,Non-RespA,ΠΕΔ ΕΦΑΡΜΟΓ 1. ΠΑΡ ΚΑΝΟΝΙΣΜ ΕΦΑΡΜΟΖ,35,0,0,0,0,Org,0,0,0,2
1230,0,0,0,1,183,NoIdea,0,0,20080100036.pdf,0,11,14,5,1,4,0,0,Non-Org,0,0,0,0,1,0,0,"β) στις, συμπληρωματικά της σιδηροδρομικής μεταφοράς, μεταφορές στις οποίες εφαρμόζονται οι Ενιαίοι Νομικοί Κανόνες CIM, με την επιφύλαξη των διεθνών διατάξεων που διέπουν τις μεταφορές με άλλο 
τρόπο μεταφοράς, καθώς και στις δραστηριότητες 
που^προβλέπονται από τις διατάξεις του Παραρτήματος του παρόντος Κανονισμού.",319,Non-RespA,Β ΣΥΜΠΛΗΡΩΜΑΤ ΣΙΔΗΡΟΔΡΟΜ ΜΕΤΑΦΟΡ ΜΕΤΑΦΟΡ ΕΦΑΡΜΟΖ ΕΝΙΑΙ ΝΟΜ ΚΑΝΟΝ CIM ΕΠΙΦΥΛΑΞ ΔΙΕΘΝ ΔΙΑΤΑΞ ΔΙΕΠ ΜΕΤΑΦΟΡ ΤΡΟΠ ΜΕΤΑΦΟΡ ΔΡΑΣΤΗΡΙΟΤΗΤ ΠΡΟΒΛΕΠ ΔΙΑΤΑΞ ΠΑΡΑΡΤΗΜ ΠΑΡΟΝΤ ΚΑΝΟΝΙΣΜΟΥ.,172,40,404,43,0.25,Irrelevant,5,1,4,6
1231,0,0,0,0,184,NoIdea,0,0,20080100036.pdf,0,2,14,3,1,2,0,0,Non-Org,0,0,0,0,0,0,0,"Εξαιρέσεις
Ο παρών Κανονισμός δεν εφαρμόζεται, καθ’ ολοκληρία 
ή εν μέρει, στις μεταφορές επικινδύνων εμπορευμάτων 
των οποίων η εξαίρεση προβλέπεται από τις διατάξεις 
του Παραρτήματος. Εξαιρέσεις μπορούν να προβλέπονται μόνον όταν η ποσότητα, η φύση των εξαιρουμένων 
μεταφορών ή η συσκευασία εγγυώνται την ασφάλεια 
της μεταφοράς.",333,Non-RespA,ΕΞΑΙΡΕΣ ΠΑΡ ΚΑΝΟΝΙΣΜ ΔΕΝ ΕΦΑΡΜΟΖ ΚΑΘ ΟΛΟΚΛΗΡ ΜΕΡ ΜΕΤΑΦΟΡ ΕΠΙΚΙΝΔΥΝ ΕΜΠΟΡΕΥΜ ΕΞΑΙΡΕΣ ΠΡΟΒΛΕΠ ΔΙΑΤΑΞ ΠΑΡΑΡΤΗΜΑΤΟΣ. ΕΞΑΙΡΕΣ ΠΡΟΒΛΕΠ ΜΟΝΟΝ ΠΟΣΟΤΗΤ ΦΥΣ ΕΞΑΙΡΟΥΜΕΝ ΜΕΤΑΦΟΡ Η ΣΥΣΚΕΥΑΣ ΕΓΓΥΩΝΤΑ ΑΣΦΑΛΕΙ ΜΕΤΑΦΟΡΑΣ.,204,24,184,29,0.1421568627,Org,3,1,2,4
1232,0,0,0,0,185,NoIdea,0,0,20080100036.pdf,0,2,9,3,0,3,0,0,Non-Org,0,0,0,0,0,0,0,"Περιορισμοί
Κάθε Κράτος μέλος διατηρεί το δικαίωμα να ρυθμίζει κανονιστικά ή να απαγορεύει τη διεθνή μεταφορά 
επικινδύνων εμπορευμάτων στην ετπκράτειά του για 
λόγους άλλους από εκείνους της ασφάλειας κατά τη 
διάρκεια της μεταφοράς.",234,Non-RespA,ΠΕΡΙΟΡΙΣΜ ΚΡΑΤ ΜΕΛ ΔΙΑΤΗΡ ΔΙΚΑΙΩΜ ΡΥΘΜΙΖ ΚΑΝΟΝΙΣΤ ΑΠΑΓΟΡΕΥ ΔΙΕΘΝ ΜΕΤΑΦΟΡ ΕΠΙΚΙΝΔΥΝ ΕΜΠΟΡΕΥΜ ΕΤΠΚΡΑΤΕΙ ΛΟΓ ΑΣΦΑΛΕΙ ΔΙΑΡΚΕΙ ΜΕΤΑΦΟΡΑΣ.,132,32,238,24,0.1818181818,Org,3,0,3,2
1233,0,0,0,0,186,NoIdea,0,0,20080100036.pdf,0,3,0,0,0,0,0,0,Non-Org,0,0,0,0,0,0,0,"Άλλες διατάξεις
Οι μεταφορές σης οποίες εφαρμόζεται ο παρών Κανονισμός εξακολουθούν να υπάγονται σης εθνικές ή 
διεθνείς διατάξεις πού εφαρμόζονται γενικά στη σιδηροδρομική μεταφορά εμπορευμάτων.",195,Non-RespA,ΑΛΛ ΔΙΑΤΑΞ ΜΕΤΑΦΟΡ Σ ΕΦΑΡΜΟΖ ΠΑΡ ΚΑΝΟΝΙΣΜ ΕΞΑΚΟΛΟΥΘ ΥΠΑΓ Σ ΕΘΝ ΔΙΕΘΝ ΔΙΑΤΑΞ ΕΦΑΡΜΟΖ ΓΕΝΙΚ ΣΙΔΗΡΟΔΡΟΜ ΜΕΤΑΦΟΡ ΕΜΠΟΡΕΥΜΑΤΩΝ.,122,0,0,0,0,Org,0,0,0,2
1234,0,0,0,0,187,NoIdea,0,0,20080100036.pdf,0,0,0,0,0,0,0,0,Non-Org,0,0,0,0,0,0,0,Τόπος αποδεκτών αμαξοστοιχιών.,30,Non-RespA,ΤΟΠ ΑΠΟΔΕΚΤ ΑΜΑΞΟΣΤΟΙΧΙΩΝ.,26,0,0,0,0,Org,0,0,0,0
1235,0,0,0,0,187,NoIdea,0,0,20080100036.pdf,0,10,5,2,0,2,0,0,Non-Org,0,0,0,0,0,0,0,"Μεταφορά ως χειραποσκευές, ως αποσκευές
ή επί αυτοκινούμενων οχημάτων
1. Τα επικίνδυνα εμπορεύματα δύνανται να μεταφέρονται μόνον με εμπορικές αμαξοστοιχίες, με εξαίρεση:",170,Non-RespA,ΜΕΤΑΦΟΡ ΧΕΙΡΑΠΟΣΚΕΥ ΑΠΟΣΚΕΥ ΑΥΤΟΚΙΝΟΥΜΕΝ ΟΧΗΜ 1. ΕΠΙΚΙΝΔΥΝ ΕΜΠΟΡΕΥΜ ΔΥΝΑΝΤΑ ΜΕΤΑΦΕΡ ΜΟΝΟΝ ΕΜΠΟΡ ΑΜΑΞΟΣΤΟΙΧ ΕΞΑΙΡΕΣ,114,29,138,9,0.07894736842,Org,2,0,2,1
1236,0,0,0,1,187,NoIdea,0,0,20080100036.pdf,0,12,8,3,1,2,0,1,Non-Org,5,0,0,0,1,0,0,"β) τα επικίνδυνα εμπορεύματα που μεταφέρονται, 
σύμφωνα με τους ειδικούς όρους του Παραρτήματος, 
ως χειραποσκευές, αποσκευές ή εντός ή επί αυτοκινούμενων οχημάτων σύμφωνα με τις διατάξεις του άρθρου 
12 των Ενιαίων Νομικών Κανόνων CIV.",236,RespA,Β ΕΠΙΚΙΝΔΥΝ ΕΜΠΟΡΕΥΜ ΜΕΤΑΦΕΡ ΣΥΜΦΩΝ ΕΙΔΙΚ ΟΡ ΠΑΡΑΡΤΗΜ ΧΕΙΡΑΠΟΣΚΕΥ ΑΠΟΣΚΕΥ Η ΑΥΤΟΚΙΝΟΥΜΕΝ ΟΧΗΜ ΣΥΜΦΩΝ ΔΙΑΤΑΞ ΑΡΘΡ 12 ΕΝΙΑΙ ΝΟΜ ΚΑΝΟΝ CIV.,136,13,64,17,0.125,RespA,3,1,2,5
1237,0,0,0,0,188,NoIdea,0,0,20080100036.pdf,0,2,17,1,1,0,0,0,Non-Org,0,0,0,0,0,0,0,"Παράρτημα
Το Παράρτημα αποτελεί αναπόσπαστο μέρος του 
παρόντος Κανονισμού.",75,RespA,ΠΑΡΑΡΤΗΜ ΠΑΡΑΡΤΗΜ ΑΠΟΤΕΛ ΑΝΑΠΟΣΠΑΣΤ ΜΕΡ ΠΑΡΟΝΤ ΚΑΝΟΝΙΣΜΟΥ.,58,2,34,17,0.2931034483,RespA,1,1,0,3
1238,0,0,0,0,188,NoIdea,0,0,20080100036.pdf,0,2,10,3,0,3,0,1,Non-Org,7,0,0,0,0,0,0,"Το Παράρτημα θα λάβει το περιεχόμενο που θα αποφασίσει η Επιτροπή εμπειρογνωμόνων για τη μεταφορά 
επικινδύνων εμπορευμάτων κατά την έναρξη ισχύος του 
Πρωτοκόλλου της 3ης Ιουνίου 1999 το οποίο τροποποιεί 
τη Σύμβαση σχετικά με τις διεθνείς σιδηροδρομικές 
μεταφορές (COTIF) της 9ης Μαΐου 1980, σύμφωνα με 
506 
ΕΦΗΜΕΡΙΣ ΤΗΣ ΚΥΒΕΡΝΗΣΕΩΣ (ΤΕΥΧΟΣ ΠΡΩΤΟ) 
τις διατάξεις της παρ. 4 του άρθρου 19 αυτής της Σύμβασης.",411,RespA,ΤΟ ΠΑΡΑΡΤΗΜ ΛΑΒ ΠΕΡΙΕΧΟΜΕΝ ΑΠΟΦΑΣΙΣ ΕΠΙΤΡΟΠ ΕΜΠΕΙΡΟΓΝΩΜΟΝ ΜΕΤΑΦΟΡ ΕΠΙΚΙΝΔΥΝ ΕΜΠΟΡΕΥΜ ΕΝΑΡΞ ΙΣΧΥ ΠΡΩΤΟΚΟΛΛ 3ΗΣ ΙΟΥΝ 1999 ΤΡΟΠΟΠΟΙ ΣΥΜΒΑΣ ΣΧΕΤ ΔΙΕΘΝ ΣΙΔΗΡΟΔΡΟΜ ΜΕΤΑΦΟΡ COTIF 9ΗΣ ΜΑΪ́ΟΥ 1980 ΣΥΜΦΩΝ 506 ΕΦΗΜΕΡΙΣ ΚΥΒΕΡΝΗΣ ΤΕΥΧ ΠΡΩΤ ΔΙΑΤΑΞ ΠΑΡ. 4 ΑΡΘΡ 19 ΣΥΜΒΑΣΗΣ.,259,40,312,25,0.09652509653,RespA,3,0,3,13
1239,0,0,0,0,189,NoIdea,0,0,20080100036.pdf,0,3,13,6,0,6,0,0,Non-Org,0,0,0,0,0,0,0,"Πεδίο εφαρμογής
Οι παρόντες Ενιαίοι Νομικοί Κανόνες εφαρμόζονται 
σε διμερή ή πολυμερή συμβόλαια που αφορούν στη 
χρήση σιδηροδρομικών οχημάτων ως μέσων μεταφοράς 
για την πραγματοποίηση μεταφορών σύμφωνα με τους 
Ενιαίους Νομικούς Κανόνες CIV και σύμφωνα με τους 
Ενιαίους Νομικούς Κανόνες CIM.",295,RespA,ΠΕΔ ΕΦΑΡΜΟΓ ΠΑΡΟΝΤ ΕΝΙΑΙ ΝΟΜ ΚΑΝΟΝ ΕΦΑΡΜΟΖ ΔΙΜΕΡ ΠΟΛΥΜΕΡ ΣΥΜΒΟΛΑΙ ΑΦΟΡ ΧΡΗΣ ΣΙΔΗΡΟΔΡΟΜ ΟΧΗΜ ΜΕΣ ΜΕΤΑΦΟΡ ΠΡΑΓΜΑΤΟΠΟΙΗΣ ΜΕΤΑΦΟΡ ΣΥΜΦΩΝ ΕΝΙΑΙ ΝΟΜ ΚΑΝΟΝ CIV ΣΥΜΦΩΝ ΕΝΙΑΙ ΝΟΜ ΚΑΝΟΝ CIM.,180,22,143,37,0.2055555556,RespA,4,0,4,12
1240,0,0,0,0,190,NoIdea,0,0,20080100036.pdf,0,2,5,2,0,2,0,0,Non-Org,0,0,0,0,0,0,0,"Ορισμοί
Για τους σκοπούς των παρόντων Ενιαίων Νομικών 
Κανόνων, ο όρος:",71,RespA,ΟΡΙΣΜ ΣΚΟΠ ΠΑΡΟΝΤ ΕΝΙΑΙ ΝΟΜ ΚΑΝΟΝ ΟΡ,36,7,35,10,0.2777777778,RespA,2,0,2,4
1241,0,0,0,1,190,NoIdea,0,0,20080100036.pdf,0,0,8,4,0,4,0,0,Non-Org,0,0,0,0,1,0,0,"β) «όχημα» σημαίνει κάθε όχημα, κατάλληλο να κυκλοφορεί επί των ιδίων τροχών σε σιδηροδρομικές γραμμές, μη εξοπλισμένο με μέσο έλξης,",133,RespA,Β ΟΧΗΜ ΣΗΜΑΙΝ ΟΧΗΜ ΚΑΤΑΛΛΗΛ ΚΥΚΛΟΦΟΡ ΙΔΙ ΤΡΟΧ ΣΙΔΗΡΟΔΡΟΜ ΓΡΑΜΜ ΕΞΟΠΛΙΣΜΕΝ ΜΕΣ ΕΛΞ,81,12,68,24,0.2962962963,RespA,3,0,3,0
1242,0,0,0,1,190,NoIdea,0,0,20080100036.pdf,0,0,6,4,0,4,0,0,Non-Org,0,0,0,0,1,0,0,"γ) «κάτοχος» σημαίνει αυτόν ο οποίος εκμεταλλεύεται 
οικονομικώς, κατά τρόπο διαρκή, ένα σιδηροδρομικό 
όχημα ως μέσο μεταφοράς, του οποίου είτε είναι κύριος 
είτε έχει το δικαίωμα διάθεσής του,",194,RespA,Γ ΚΑΤΟΧ ΣΗΜΑΙΝ ΕΚΜΕΤΑΛΛΕΥ ΟΙΚΟΝΟΜ ΤΡΟΠ ΔΙΑΡΚ ΣΙΔΗΡΟΔΡΟΜ ΟΧΗΜ ΜΕΣ ΜΕΤΑΦΟΡ ΚΥΡΙ ΔΙΚΑΙΩΜ ΔΙΑΘΕΣ,92,21,98,19,0.2065217391,RespA,4,0,4,0
1243,0,0,0,1,190,NoIdea,0,0,20080100036.pdf,0,0,5,3,0,3,0,1,Non-Org,5,0,0,0,1,0,0,"δ) «σταθμός έδρας» σημαίνει τον τόπο ο οποίος αναγράφεται επί του οχήματος και στον οποίο το όχημα 
αυτό δύναται ή πρέπει να επαναποσταλεί σύμφωνα με 
τους όρους του συμβολαίου χρήσης.",184,RespA,Δ ΣΤΑΘΜ ΕΔΡ ΣΗΜΑΙΝ ΤΟΠ ΑΝΑΓΡΑΦ ΟΧΗΜ ΟΧΗΜ ΔΥΝ ΕΠΑΝΑΠΟΣΤΑΛ ΣΥΜΦΩΝ ΟΡ ΣΥΜΒΟΛΑΙ ΧΡΗΣΗΣ.,83,9,38,13,0.156626506,RespA,2,0,2,0
1244,0,0,0,1,191,NoIdea,0,0,20080100036.pdf,0,0,9,3,0,3,0,0,Non-Org,0,0,0,0,1,0,0,"β) αν συντρέχει περίπτωση, η ένδειξη της σιδηροδρομικής επιχείρησης στο στόλο οχημάτων της οποίας 
είναι ενταγμένο το όχημα,",124,Non-RespA,Β ΣΥΝΤΡΕΧ ΠΕΡΙΠΤΩΣ ΕΝΔΕΙΞ ΣΙΔΗΡΟΔΡΟΜ ΕΠΙΧΕΙΡΗΣ ΣΤΟΛ ΟΧΗΜ ΕΝΤΑΓΜΕΝ ΟΧΗΜ,70,22,163,17,0.2428571429,Irrelevant,2,0,2,0
1245,0,0,0,1,191,NoIdea,0,0,20080100036.pdf,0,0,5,1,0,1,0,1,Non-Org,5,0,0,0,1,0,0,"γ) αν συντρέχει περίπτωση, την ένδειξη του σταθμού 
έδρας,",58,Non-RespA,Γ ΣΥΝΤΡΕΧ ΠΕΡΙΠΤΩΣ ΕΝΔΕΙΞ ΣΤΑΘΜ ΕΔΡ,35,2,10,5,0.1428571429,Irrelevant,1,0,1,0
1246,0,0,0,1,191,NoIdea,0,0,20080100036.pdf,0,0,13,1,1,0,0,0,Non-Org,0,0,0,0,1,0,0,"δ) άλλα σήματα και εγγραφές που συμφωνήθηκαν 
στο συμβόλαιο χρήσης.",67,Non-RespA,Δ ΣΗΜ ΕΓΓΡΑΦ ΣΥΜΦΩΝ ΣΥΜΒΟΛΑΙ ΧΡΗΣΗΣ.,36,2,26,13,0.3611111111,Irrelevant,1,1,0,0
1247,0,0,0,0,192,NoIdea,0,0,20080100036.pdf,0,9,9,10,0,10,0,0,Non-Org,0,0,0,0,0,0,0,"Ευθύνη σε περίπτωση απώλειας 
ή βλάβης ενός οχήματος
1. Η σιδηροδρομική επιχείρηση στην οποία παραδόθηκε το όχημα κατά χρήση ως μέσο μεταφοράς ευθύνεται για τη ζημία που απορρέει από την απώλεια ή 
τη βλάβη του οχήματος αυτού ή των παρελκομένων 
του, εκτός εάν αποδείξει ότι η ζημία δεν απορρέει από 
σφάλμα της.",312,Non-RespA,ΕΥΘΥΝ ΠΕΡΙΠΤΩΣ ΑΠΩΛΕΙ ΒΛΑΒ ΟΧΗΜ 1. ΣΙΔΗΡΟΔΡΟΜ ΕΠΙΧΕΙΡΗΣ ΠΑΡΑΔΟΘΗΚ ΟΧΗΜ ΧΡΗΣ ΜΕΣ ΜΕΤΑΦΟΡ ΕΥΘΥΝ ΖΗΜ ΑΠΟΡΡΕ ΑΠΩΛΕΙ ΒΛΑΒ ΟΧΗΜ ΠΑΡΕΛΚΟΜΕΝ ΑΠΟΔΕΙΞ ΖΗΜ ΔΕΝ ΑΠΟΡΡΕ ΣΦΑΛΜ ΤΗΣ.,166,37,237,51,0.3072289157,Org,5,0,5,1
1248,0,0,0,0,192,NoIdea,1,0,20080100036.pdf,0,34,11,4,0,4,0,0,Org,0,0,0,0,0,1,0,"3. Σε περίπτωση απώλειας του οχήματος ή των παρελκομένων του, η αποζημίωση περιορίζεται, αποκλειομένων οποιωνδήποτε άλλων αποζημιώσεων, στη συνήθη 
αξία του οχήματος ή των παρελκομένων του στον τόπο 
και κατά τη στιγμή της απώλειας. Εάν είναι αδύνατον να 
διαπιστωθεί η ημέρα ή ο τόπος της απώλειας, η αποζημίωση περιορίζεται στη συνήθη αξία κατά την ημέρα και 
στον τόπο όπου παραδόθηκε το όχημα κατά χρήση.",408,Non-RespA,3. ΠΕΡΙΠΤΩΣ ΑΠΩΛΕΙ ΟΧΗΜ ΠΑΡΕΛΚΟΜΕΝ ΑΠΟΖΗΜΙΩΣ ΠΕΡΙΟΡΙΖ ΑΠΟΚΛΕΙΟΜΕΝ ΟΠΟΙΩΝΔΗΠΟΤ ΑΠΟΖΗΜΙΩΣ ΣΥΝΗΘ ΑΞΙ ΟΧΗΜ ΠΑΡΕΛΚΟΜΕΝ ΤΟΠ ΣΤΙΓΜ ΑΠΩΛΕΙΑΣ. ΑΔΥΝΑΤΟΝ ΔΙΑΠΙΣΤΩΘ ΗΜΕΡ ΤΟΠ ΑΠΩΛΕΙ ΑΠΟΖΗΜΙΩΣ ΠΕΡΙΟΡΙΖ ΣΥΝΗΘ ΑΞΙ ΗΜΕΡ ΤΟΠ ΠΑΡΑΔΟΘΗΚ ΟΧΗΜ ΧΡΗΣΗ.,228,9,50,23,0.100877193,Org,2,0,2,1
1249,0,0,0,0,192,NoIdea,1,0,20080100036.pdf,0,20,11,3,0,3,0,0,Org,0,0,0,0,0,1,0,"4. Σε περίπτωση βλάβης του οχήματος ή των παρελκομένων του, η αποζημίωση περιορίζεται, αποκλειομένων οποιωνδήποτε άλλων αποζημιώσεων, στα έξοδα 
αποκατάστασης. Η αποζημίωση δεν υπερβαίνει το ποσό 
που οφείλεται σε περίπτωση απώλειας.",233,Non-RespA,4. ΠΕΡΙΠΤΩΣ ΒΛΑΒ ΟΧΗΜ ΠΑΡΕΛΚΟΜΕΝ ΑΠΟΖΗΜΙΩΣ ΠΕΡΙΟΡΙΖ ΑΠΟΚΛΕΙΟΜΕΝ ΟΠΟΙΩΝΔΗΠΟΤ ΑΠΟΖΗΜΙΩΣ ΕΞΟΔ ΑΠΟΚΑΤΑΣΤΑΣΗΣ. ΑΠΟΖΗΜΙΩΣ ΔΕΝ ΥΠΕΡΒΑΙΝ ΠΟΣ ΟΦΕΙΛ ΠΕΡΙΠΤΩΣ ΑΠΩΛΕΙΑΣ.,157,12,62,19,0.1210191083,Org,3,0,3,1
1250,0,0,0,0,192,NoIdea,1,0,20080100036.pdf,0,0,0,0,0,0,0,0,Org,0,0,0,0,0,1,0,"5. Τα συμβαλλόμενα μέρη δύνανται να συμφωνήσουν 
διατάξεις οι οποίες να παρεκκλίνουν από τις διατάξεις 
των παρ. 1 έως 4 του παρόντος άρθρου.",141,Non-RespA,5. ΣΥΜΒΑΛΛΟΜΕΝ ΜΕΡ ΔΥΝΑΝΤΑ ΣΥΜΦΩΝ ΔΙΑΤΑΞ ΠΑΡΕΚΚΛΙΝ ΔΙΑΤΑΞ ΠΑΡ. 1 4 ΠΑΡΟΝΤ ΑΡΘΡΟΥ.,81,0,0,0,0,Org,0,0,0,0
1251,0,0,0,0,193,NoIdea,0,0,20080100036.pdf,0,8,14,6,1,5,0,0,Non-Org,0,0,0,0,0,0,0,"Απώλεια του δικαιώματος επίκλησης 
των ορίων ευθύνης
Τα όρια ευθύνης που προβλέπονται από τις διατάξεις 
των παρ. 3 και 4 του άρθρου 4 των παρόντων Ενιαίων 
Νομικών Κανόνων δεν εφαρμόζονται εάν αποδεικνύεται 
ότι η ζημία προκύπτει από μία πράξη ή μία παράλειψη 
που διέπραξε η σιδηροδρομική επιχείρηση, είτε με την 
πρόθεση να προκαλέσει μία τέτοια ζημία, είτε με βαριά 
αμέλεια και έχοντας συνείδηση ότι μία τέτοια ζημία 
πιθανώς θα προκύψει.",443,Non-RespA,ΑΠΩΛΕΙ ΔΙΚΑΙΩΜ ΕΠΙΚΛΗΣ ΟΡΙ ΕΥΘΥΝ ΟΡΙ ΕΥΘΥΝ ΠΡΟΒΛΕΠ ΔΙΑΤΑΞ ΠΑΡ. 3 4 ΑΡΘΡ 4 ΠΑΡΟΝΤ ΕΝΙΑΙ ΝΟΜ ΚΑΝΟΝ ΔΕΝ ΕΦΑΡΜΟΖ ΑΠΟΔΕΙΚΝΥ ΖΗΜ ΠΡΟΚΥΠΤ ΠΡΑΞ ΠΑΡΑΛΕΙΨ ΔΙΕΠΡΑΞ ΣΙΔΗΡΟΔΡΟΜ ΕΠΙΧΕΙΡΗΣ ΠΡΟΘΕΣ ΠΡΟΚΑΛΕΣ ΖΗΜ ΒΑΡ ΑΜΕΛΕΙ ΕΧ ΣΥΝΕΙΔΗΣ ΖΗΜ ΠΙΘΑΝΩΣ ΠΡΟΚΥΨΕΙ.,238,34,254,45,0.1890756303,Org,5,1,4,4
