,AlphaBulletCapDot,AlphaBulletCapPar,AlphaBulletDot,AlphaBulletPar,ArticleNo,Class,DigitBulletDot,DigitBulletPar,Filename,FirstPatternOffset,FirstWordInCapitalOffset,LongestMatchingPattern,MatchedPatternsCount,MatchingBigrams,MatchingUnigrams,OrgMatchingBigrams,OrgMatchingUnigrams,OrgPrediction,OrgTotalMatchingCharacters,PrevAlphaBulletCapDot,PrevAlphaBulletCapPar,PrevAlphaBulletDot,PrevAlphaBulletPar,PrevDigitBulletDot,PrevDigitBulletPar,RawParagraph,RawParagraphLength,RespAPrediction,StemmedParagraph,StemmedParagraphLength,SumMatchingEntries,SumMatchingEntriesLength,TotalMatchingCharacters,TotalMatchingRatio,TotalPrediction,UnqMatchedPatternsCount,UnqMatchingBigrams,UnqMatchingUnigrams,WordsInCapital
831,0,0,0,0,40,NoIdea,1,0,20080100036.pdf,0,2,14,7,1,6,0,0,Org,0,0,0,0,0,1,0,"3. Η Γενική Συνέλευση, όταν επιληφθεί μίας πρότασης 
τροποποίησης, δύναται να αποφασίσει, με njv πλειοψηφία που προβλέπεται στις διατάξεις της παρ. 6 του 
άρθρου 14 της κυρίως Σύμβασης, ότι μία τέτοια πρόταση 
έχει χαρακτήρα στενής συνάφειας με μία ή περισσότερες διατάξεις των Παραρτημάτων της Σύμβασης. Σ’ 
αυτή την περίπτωση καθώς και στις περιπτώσεις που 
αναφέρονται στο δεύτερο εδάφιο των παρ. 4 έως 6 
του παρόντος άρθρου, η Γενική Συνέλευση είναι επίσης 
εξουσιοδοτημένη να αποφασίσει για την τροποποίηση 
αυτής ή αυτών των διατάξεων των Παραρτημάτων.",559,Non-RespA,3. ΓΕΝΙΚ ΣΥΝΕΛΕΥΣ ΕΠΙΛΗΦΘ ΠΡΟΤΑΣ ΤΡΟΠΟΠΟΙΗΣ ΔΥΝ ΑΠΟΦΑΣΙΣ NJV ΠΛΕΙΟΨΗΦ ΠΡΟΒΛΕΠ ΔΙΑΤΑΞ ΠΑΡ. 6 ΑΡΘΡ 14 ΣΥΜΒΑΣ ΠΡΟΤΑΣ ΧΑΡΑΚΤΗΡ ΣΤΕΝ ΣΥΝΑΦΕΙ ΠΕΡΙΣΣ ΔΙΑΤΑΞ ΠΑΡΑΡΤΗΜ ΣΥΜΒΑΣΗΣ. Σ ΠΕΡΙΠΤΩΣ ΠΕΡΙΠΤΩΣ ΑΝΑΦΕΡ ΔΕΥΤ ΕΔΑΦ ΠΑΡ. 4 6 ΠΑΡΟΝΤ ΑΡΘΡ ΓΕΝΙΚ ΣΥΝΕΛΕΥΣ ΕΞΟΥΣΙΟΔΟΤΗΜΕΝ ΑΠΟΦΑΣΙΣ ΤΡΟΠΟΠΟΙΗΣ ΔΙΑΤΑΞ ΠΑΡΑΡΤΗΜΑΤΩΝ.,297,59,412,60,0.202020202,Org,5,1,4,9
832,0,0,0,0,40,NoIdea,1,0,20080100036.pdf,0,7,10,5,0,5,0,1,Non-Org,7,0,0,0,0,1,0,"4. Με την επιφύλαξη των αποφάσεων της Γενικής 
Συνέλευσης που λαμβάνονται σύμφωνα με τις διατάξεις 
του πρώτου εδαφίου της παρ. 3 του παρόντος άρθρου, 
η Αναθεωρηπκή Επιτροπή αποφασίζει για τις προτάσεις 
που στοχεύουν στην τροποποίηση:",236,Non-RespA,4. ΕΠΙΦΥΛΑΞ ΑΠΟΦΑΣ ΓΕΝΙΚ ΣΥΝΕΛΕΥΣ ΛΑΜΒΑΝ ΣΥΜΦΩΝ ΔΙΑΤΑΞ ΠΡΩΤ ΕΔΑΦ ΠΑΡ. 3 ΠΑΡΟΝΤ ΑΡΘΡ ΑΝΑΘΕΩΡΗΠΚ ΕΠΙΤΡΟΠ ΑΠΟΦΑΣΙΖ ΠΡΟΤΑΣ ΣΤΟΧΕΥ ΤΡΟΠΟΠΟΙΗΣ,136,45,316,38,0.2794117647,Org,5,0,5,4
833,0,0,0,1,40,NoIdea,0,0,20080100036.pdf,0,2,5,2,0,2,0,0,Non-Org,0,0,0,0,1,0,0,"γ) των Ενιαίων Νομικών Κανόνων CΙM, με εξαίρεση 
τα άρθρα πρώτο, 5, τις παρ. 1 και 2 του άρθρου 6, τα 
άρθρα 8, 12, την παρ. 2 του άρθρου 13, το άρθρο 4, τις 
παρ. 2 και 3 του άρθρου 15, τις παραγράφους 6 και 7 
του άρθρου 19, καθώς και τα άρθρα 23 έως 27, 30 έως 
33, 36 έως 41 και 44 έως 48 αυτών των Ενιαίων Νομικών 
Κανόνων,",328,RespA,Γ ΕΝΙΑΙ ΝΟΜ ΚΑΝΟΝ CΙM ΕΞΑΙΡΕΣ ΑΡΘΡ ΠΡΩΤ 5 ΠΑΡ. 1 2 ΑΡΘΡ 6 ΑΡΘΡ 8 12 ΠΑΡ. 2 ΑΡΘΡ 13 ΑΡΘΡ 4 ΠΑΡ. 2 3 ΑΡΘΡ 15 ΠΑΡΑΓΡΑΦ 6 7 ΑΡΘΡ 19 ΑΡΘΡ 23 27 30 33 36 41 44 48 ΕΝΙΑΙ ΝΟΜ ΚΑΝΟΝ,172,4,20,10,0.05813953488,RespA,1,0,1,7
834,0,0,0,1,40,NoIdea,0,0,20080100036.pdf,0,2,5,2,0,2,0,0,Non-Org,0,0,0,0,1,0,0,"δ) των Ενιαίων Νομικών Κανόνων CUV, με εξαίρεση 
τα άρθρα πρώτο, 4, 5 και 7 έως 12 αυτών των Ενιαίων 
Νομικών Κανόνων,",118,RespA,Δ ΕΝΙΑΙ ΝΟΜ ΚΑΝΟΝ CUV ΕΞΑΙΡΕΣ ΑΡΘΡ ΠΡΩΤ 4 5 7 12 ΕΝΙΑΙ ΝΟΜ ΚΑΝΟΝ,64,4,20,10,0.15625,RespA,1,0,1,7
835,0,0,0,1,40,NoIdea,0,0,20080100036.pdf,0,2,5,2,0,2,0,0,Non-Org,0,0,0,0,1,0,0,"ε) των Ενιαίων Νομικών Κανόνων CUI, με εξαίρεση 
τα άρθρα πρώτο, 2, 4, 8 έως 15,17 έως 19, 21, 23 έως 25 
αυτών των Ενιαίων Νομικών Κανόνων,",140,RespA,Ε ΕΝΙΑΙ ΝΟΜ ΚΑΝΟΝ CUI ΕΞΑΙΡΕΣ ΑΡΘΡ ΠΡΩΤ 2 4 8 15 17 19 21 23 25 ΕΝΙΑΙ ΝΟΜ ΚΑΝΟΝ,79,4,20,10,0.1265822785,RespA,1,0,1,7
836,0,0,0,1,40,NoIdea,0,0,20080100036.pdf,0,2,5,2,0,2,0,0,Non-Org,0,0,0,0,1,0,0,"στ) των Ενιαίων Νομικών Κανόνων APTU, με εξαίρεση 
τα άρθρα πρώτο, 3 και 9 έως 11, καθώς και των Παραρτημάτων αυτών των Ενιαίων Νομικών Κανόνων,",144,RespA,ΣΤ ΕΝΙΑΙ ΝΟΜ ΚΑΝΟΝ APTU ΕΞΑΙΡΕΣ ΑΡΘΡ ΠΡΩΤ 3 9 11 ΠΑΡΑΡΤΗΜ ΕΝΙΑΙ ΝΟΜ ΚΑΝΟΝ,73,4,20,10,0.1369863014,RespA,1,0,1,8
837,0,0,0,1,40,NoIdea,0,0,20080100036.pdf,0,2,5,1,0,1,0,0,Non-Org,0,0,0,0,1,0,0,"ζ) των Ενιαίων Νομικών Κανόνων ATMF, με εξαίρεση 
τα άρθρα πρώτο, 3 και 9 αυτών.",80,Non-RespA,Ζ ΕΝΙΑΙ ΝΟΜ ΚΑΝΟΝ ATMF ΕΞΑΙΡΕΣ ΑΡΘΡ ΠΡΩΤ 3 9 ΑΥΤΩΝ.,51,4,20,5,0.09803921569,RespA,1,0,1,4
838,0,0,0,0,41,NoIdea,0,0,20080100036.pdf,0,3,10,2,0,2,0,0,Non-Org,0,0,0,0,0,0,0,"Αποφάσεις της Γενικής Συνέλευσης
1. Οι τροποποιήσεις της Σύμβασης που αποφασίστηκαν από τη Γενική Συνέλευση κοινοποιούνται από τον 
Γενικό Γραμματέα στα Κράτη μέλη.",164,RespA,ΑΠΟΦΑΣ ΓΕΝΙΚ ΣΥΝΕΛΕΥΣ 1. ΤΡΟΠΟΠΟΙΗΣ ΣΥΜΒΑΣ ΑΠΟΦΑΣΙΣΤ ΓΕΝΙΚ ΣΥΝΕΛΕΥΣ ΚΟΙΝΟΠΟ ΓΕΝΙΚ ΓΡΑΜΜΑΤ ΚΡΑΤ ΜΕΛΗ.,100,26,188,16,0.16,RespA,2,0,2,9
839,0,0,0,0,41,NoIdea,1,0,20080100036.pdf,0,4,10,8,0,8,0,3,Non-Org,15,0,0,0,0,1,0,"3. Οι τροποποιήσεις των Παραρτημάτων της Σύμβασης, που αποφασίστηκαν από τη Γενική Συνέλευση, τίθενται σε ισχύ δώδεκα μήνες μετά την έγκριση τους 
από το ένα δεύτερο των Κρατών που δεν έκαναν μία 
δήλωση σύμφωνα με τις διατάξεις του πρώτου εδαφίου 
της παρ. 1 του άρθρου 42 της κυρίως Σύμβασης, για όλα 
τα Κράτη μέλη με εξαίρεση εκείνα τα οποία, πριν τη 
θέση σε ισχύ των τροποποιήσεων, έκαναν μία δήλωση, 
σύμφωνα με την οποία δεν εγκρίνουν τις εν λόγω τροποποιήσεις και με εξαίρεση εκείνα τα οποία έκαναν μία 
δήλωση σύμφωνα με τις διατάξεις του πρώτου εδαφίου 
της παρ. 1 του άρθρου 42 της κυρίως Σύμβασης.",610,RespA,3. ΤΡΟΠΟΠΟΙΗΣ ΠΑΡΑΡΤΗΜ ΣΥΜΒΑΣ ΑΠΟΦΑΣΙΣΤ ΓΕΝΙΚ ΣΥΝΕΛΕΥΣ ΤΙΘΕΝΤΑ ΙΣΧ ΔΩΔΕΚ ΜΗΝ ΕΓΚΡΙΣ ΔΕΥΤ ΚΡΑΤ ΔΕΝ ΕΚΑΝ ΔΗΛΩΣ ΣΥΜΦΩΝ ΔΙΑΤΑΞ ΠΡΩΤ ΕΔΑΦ ΠΑΡ. 1 ΑΡΘΡ 42 ΣΥΜΒΑΣ ΚΡΑΤ ΜΕΛ ΕΞΑΙΡΕΣ ΘΕΣ ΙΣΧ ΤΡΟΠΟΠΟΙΗΣ ΕΚΑΝ ΔΗΛΩΣ ΣΥΜΦΩΝ ΔΕΝ ΕΓΚΡΙΝ ΤΡΟΠΟΠΟΙΗΣ ΕΞΑΙΡΕΣ ΕΚΑΝ ΔΗΛΩΣ ΣΥΜΦΩΝ ΔΙΑΤΑΞ ΠΡΩΤ ΕΔΑΦ ΠΑΡ. 1 ΑΡΘΡ 42 ΣΥΜΒΑΣΗΣ.,298,57,376,61,0.2046979866,RespA,5,0,5,8
840,0,0,0,0,41,NoIdea,1,0,20080100036.pdf,0,2,10,5,0,5,0,1,Non-Org,5,0,0,0,0,1,0,"4. Τα Κράτη μέλη απευθύνουν στον Γενικό Γραμματέα 
τις κοινοποιήσεις τους σχετικά με την έγκριση των τροποποιήσεων της Σύμβασης που αποφασίστηκαν από τη 
Γενική Συνέλευση καθώς και τις δηλώσεις τους σύμφωνα με τις οποίες δεν εγκρίνουν αυτές τις τροποποιήσεις.",259,RespA,4. ΚΡΑΤ ΜΕΛ ΑΠΕΥΘΥΝ ΓΕΝΙΚ ΓΡΑΜΜΑΤ ΚΟΙΝΟΠΟΙΗΣ ΣΧΕΤ ΕΓΚΡΙΣ ΤΡΟΠΟΠΟΙΗΣ ΣΥΜΒΑΣ ΑΠΟΦΑΣΙΣΤ ΓΕΝΙΚ ΣΥΝΕΛΕΥΣ ΔΗΛΩΣ ΣΥΜΦΩΝ ΔΕΝ ΕΓΚΡΙΝ ΤΡΟΠΟΠΟΙΗΣΕΙΣ.,138,58,392,38,0.2753623188,RespA,5,0,5,6
841,0,0,0,0,41,NoIdea,1,0,20080100036.pdf,0,2,10,9,0,9,0,2,Non-Org,13,0,0,0,0,1,0,"6. Η Γενική Συνέλευση μπορεί να προσδιορίσει, κατά 
τη στιγμή της υιοθέτησης μιας τροποποίησης ότι αυτή 
έχει ένα περιεχόμενο τέτοιο που κάθε Κράτος μέλος 
που θα έχει κάνει μία δήλωση που προβλέπεται στις 
παραπάνω παραγράφους 2 ή 3 και το οποίο δεν θα 
έχει εγκρίνει την τροποποίηση εντός της προθεσμίας 
των δεκαοκτώ μηνών από την ημερομηνία θέσης της σε 
ισχύ, θα πάψει να είναι Κράτος μέλος του Οργανισμού 
μετά την εκπνοή αυτής της προθεσμίας.",449,RespA,6. ΓΕΝΙΚ ΣΥΝΕΛΕΥΣ ΠΡΟΣΔΙΟΡΙΣ ΣΤΙΓΜ ΥΙΟΘΕΤΗΣ ΤΡΟΠΟΠΟΙΗΣ ΠΕΡΙΕΧΟΜΕΝ ΚΡΑΤ ΜΕΛ ΚΑΝ ΔΗΛΩΣ ΠΡΟΒΛΕΠ ΠΑΡΑΠΑΝ ΠΑΡΑΓΡΑΦ 2 3 ΔΕΝ ΕΓΚΡΙΝ ΤΡΟΠΟΠΟΙΗΣ ΠΡΟΘΕΣΜ ΔΕΚΑΟΚΤ ΜΗΝ ΗΜΕΡΟΜΗΝ ΘΕΣ ΙΣΧ ΠΑΨ ΚΡΑΤ ΜΕΛ ΟΡΓΑΝΙΣΜ ΕΚΠΝΟ ΠΡΟΘΕΣΜΙΑΣ.,212,54,426,74,0.3490566038,Org,8,0,8,5
842,0,0,0,0,41,NoIdea,1,0,20080100036.pdf,0,5,12,5,1,4,0,0,Org,0,0,0,0,0,1,0,"7. Όταν οι αποφάσεις της Γενικής Συνέλευσης αφορούν στα Παραρτήματα της Σύμβασης, η εφαρμογή του 
σχετικού Παραρτήματος αναστέλλεται στο σύνολο του, 
από τη θέση σε ισχύ των αποφάσεων, νια την κυκλοφορία με και μεταξύ των Κρατών μελών τα οποία, σύμφωνα 
με τις διατάξεις της παρ. 3 του παρόντος άρθρου, δεν 
έχουν εγκρίνει τις αποφάσεις εντός των καθορισμένων 
προθεσμιών. Ο Γενικός Γραμματέας κοινοποιεί στα Κράτη μέλη αυτή την αναστολή. Η αναστολή λήγει μετά την 
εκπνοή ενός μηνός υπολογιζόμενου από την ημερομηνία 
κατά την οποία ο Γενικός Γραμματέας κοινοποίησε στα 
άλλα Κράτη μέλη την άρση της αντίθεσης.",611,Non-RespA,7. ΑΠΟΦΑΣ ΓΕΝΙΚ ΣΥΝΕΛΕΥΣ ΑΦΟΡ ΠΑΡΑΡΤΗΜ ΣΥΜΒΑΣ ΕΦΑΡΜΟΓ ΣΧΕΤ ΠΑΡΑΡΤΗΜ ΑΝΑΣΤΕΛΛ ΣΥΝΟΛ ΘΕΣ ΙΣΧ ΑΠΟΦΑΣ ΝΙ ΚΥΚΛΟΦΟΡ ΚΡΑΤ ΜΕΛ ΣΥΜΦΩΝ ΔΙΑΤΑΞ ΠΑΡ. 3 ΠΑΡΟΝΤ ΑΡΘΡ ΔΕΝ ΕΓΚΡΙΝ ΑΠΟΦΑΣ ΚΑΘΟΡΙΣΜΕΝ ΠΡΟΘΕΣΜΙΩΝ. ΓΕΝΙΚ ΓΡΑΜΜΑΤ ΚΟΙΝΟΠΟΙ ΚΡΑΤ ΜΕΛ ΑΝΑΣΤΟΛΗ. ΑΝΑΣΤΟΛ ΛΗΓ ΕΚΠΝΟ ΜΗΝ ΥΠΟΛΟΓΙΖΟΜΕΝ ΗΜΕΡΟΜΗΝ ΓΕΝΙΚ ΓΡΑΜΜΑΤ ΚΟΙΝΟΠΟΙ ΚΡΑΤ ΜΕΛ ΑΡΣ ΑΝΤΙΘΕΣΗΣ.,325,36,240,40,0.1230769231,Org,5,1,4,14
843,0,0,0,0,42,NoIdea,0,0,20080100036.pdf,0,3,10,2,0,2,0,2,Non-Org,14,0,0,0,0,0,0,"Αποφάσεις των Επιτροπών
1. Οι τροποποιήσεις της Σύμβασης, που αποφασίστηκαν από τις Επιτροπές, κοινοποιούνται από τον Γενικό 
Γραμματέα στα Κράτη μέλη.",151,Non-RespA,ΑΠΟΦΑΣ ΕΠΙΤΡΟΠ 1. ΤΡΟΠΟΠΟΙΗΣ ΣΥΜΒΑΣ ΑΠΟΦΑΣΙΣΤ ΕΠΙΤΡΟΠ ΚΟΙΝΟΠΟ ΓΕΝΙΚ ΓΡΑΜΜΑΤ ΚΡΑΤ ΜΕΛΗ.,86,26,188,16,0.1860465116,Org,2,0,2,7
844,0,0,0,0,42,NoIdea,1,0,20080100036.pdf,0,22,8,3,0,3,0,0,Org,0,0,0,0,0,1,0,"6. Για τον καθορισμό του αριθμού αντιρρήσεων που προβλέπονται στις παραγράφους 2 και 4 του παρόντος άρθρου, 
δεν λαμβάνονται υπ’ όψιν τα Κράτη μέλη τα οποία:",157,Non-RespA,6. ΚΑΘΟΡΙΣΜ ΑΡΙΘΜ ΑΝΤΙΡΡΗΣ ΠΡΟΒΛΕΠ ΠΑΡΑΓΡΑΦ 2 4 ΠΑΡΟΝΤ ΑΡΘΡ ΔΕΝ ΛΑΜΒΑΝ ΟΨΙΝ ΚΡΑΤ ΜΕΛ,84,17,122,21,0.25,Org,3,0,3,1
845,0,0,0,1,42,NoIdea,0,0,20080100036.pdf,0,7,0,0,0,0,0,1,Non-Org,7,0,0,0,1,0,0,"β) δεν είναι μέλη της εν λόγω Επιτροπής (παρ. 1 δεύτερο εδάφιο),",64,Non-RespA,Β ΔΕΝ ΜΕΛ ΕΠΙΤΡΟΠ ΠΑΡ. 1 ΔΕΥΤ ΕΔΑΦ,34,0,0,0,0,Irrelevant,0,0,0,1
846,0,0,0,1,42,NoIdea,0,0,20080100036.pdf,0,0,0,0,0,0,0,1,Non-Org,5,0,0,0,1,0,0,γ) έκαναν μία δήλωση σύμφωνα με τις διατάξεις της παρ.,54,Non-RespA,Γ ΕΚΑΝ ΔΗΛΩΣ ΣΥΜΦΩΝ ΔΙΑΤΑΞ ΠΑΡ.,31,0,0,0,0,Irrelevant,0,0,0,0
847,0,0,0,0,43,NoIdea,0,0,20080100036.pdf,0,2,8,2,0,2,0,0,Non-Org,0,0,0,0,0,0,0,"Θεματοφύλακας
1. Ο Γενικός Γραμματέας είναι ο Θεματοφύλακας της 
παρούσας Σύμβασης. Τα καθήκοντα του ως Θεματοφύλακας είναι εκείνα που αναφέρονται στο Τμήμα VII της 
Σύμβασης της Βιέννης της 23ης Μαΐου 1969 σχετικά με 
το Δίκαιο των Συνθηκών.",242,Non-RespA,ΘΕΜΑΤΟΦΥΛΑΚ 1. ΓΕΝΙΚ ΓΡΑΜΜΑΤ ΘΕΜΑΤΟΦΥΛΑΚ ΠΑΡΟΥΣ ΣΥΜΒΑΣΗΣ. ΚΑΘΗΚΟΝΤ ΘΕΜΑΤΟΦΥΛΑΚ ΑΝΑΦΕΡ ΤΜΗΜ VII ΣΥΜΒΑΣ ΒΙΕΝΝ 23ΗΣ ΜΑΪ́ΟΥ 1969 ΣΧΕΤ ΔΙΚΑΙ ΣΥΝΘΗΚΩΝ.,146,23,148,14,0.09589041096,Irrelevant,2,0,2,14
848,0,0,0,0,44,NoIdea,0,0,20080100036.pdf,0,3,11,3,0,3,0,0,Non-Org,0,0,0,0,0,0,0,"Προσχώρηση στη Σύμβαση
1. Η προσχώρηση στη Σύμβαση είναι ανοιχτή σε κάθε 
Κράτος στην επικράτεια του οποίου πραγματοποιείται 
εκμετάλλευση σιδηροδρομικής υποδομής.",163,Non-RespA,ΠΡΟΣΧΩΡΗΣ ΣΥΜΒΑΣ 1. ΠΡΟΣΧΩΡΗΣ ΣΥΜΒΑΣ ΑΝΟΙΧΤ ΚΡΑΤ ΕΠΙΚΡΑΤΕΙ ΠΡΑΓΜΑΤΟΠΟΙΕΙΤΑ ΕΚΜΕΤΑΛΛΕΥΣ ΣΙΔΗΡΟΔΡΟΜ ΥΠΟΔΟΜΗΣ.,107,20,130,23,0.214953271,Org,2,0,2,4
849,0,0,0,0,44,NoIdea,1,0,20080100036.pdf,0,28,10,1,0,1,0,0,Org,0,0,0,0,0,1,0,"3. Η αίτηση γίνεται αυτοδικαίως δεκτή τρεις μήνες 
μετά την κοινοποίηση που αναφέρεται στην παράγραφο 
2 του παρόντος όρθρου, εκτός εάν διατυπωθεί αντίρρηση ενώπιον του θεματοφύλακα από πέντε Κράτη μέλη.",203,Non-RespA,3. ΑΙΤΗΣ ΓΙΝ ΑΥΤΟΔΙΚΑΙΩΣ ΔΕΚΤ ΤΡ ΜΗΝ ΚΟΙΝΟΠΟΙΗΣ ΑΝΑΦΕΡ ΠΑΡΑΓΡΑΦ 2 ΠΑΡΟΝΤ ΟΡΘΡ ΔΙΑΤΥΠΩΘ ΑΝΤΙΡΡΗΣ ΕΝΩΠ ΘΕΜΑΤΟΦΥΛΑΚ ΠΕΝΤ ΚΡΑΤ ΜΕΛΗ.,128,3,30,10,0.078125,Org,1,0,1,1
850,0,0,0,0,44,NoIdea,1,0,20080100036.pdf,0,11,8,5,0,5,0,0,Org,0,0,0,0,0,1,0,"5. Με την επιφύλαξη των διατάξεων του άρθρου 42 της 
κυρίως Σύμβασης COTIF 1999, κάθε προσχώρηση στη 
Σύμβαση μπορεί να αφορά μόνον στη Σύμβαση όπως 
αυτή ισχύει τη στιγμή υλοποίησης της προσχώρησης.",199,Non-RespA,5. ΕΠΙΦΥΛΑΞ ΔΙΑΤΑΞ ΑΡΘΡ 42 ΣΥΜΒΑΣ COTIF 1999 ΠΡΟΣΧΩΡΗΣ ΣΥΜΒΑΣ ΑΦΟΡ ΜΟΝΟΝ ΣΥΜΒΑΣ ΙΣΧΥ ΣΤΙΓΜ ΥΛΟΠΟΙΗΣ ΠΡΟΣΧΩΡΗΣΗΣ.,112,55,404,34,0.3035714286,Org,3,0,3,4
851,0,0,0,0,45,NoIdea,0,0,20080100036.pdf,0,2,11,7,0,7,0,2,Non-Org,16,0,0,0,0,0,0,"Προσχώρηση Περιφερειακών Οργανισμών
Οικονομικής Ολοκλήρωσης
1. Η προσχώρηση στη Σύμβαση είναι ανοιχτή στους 
Περιφερειακούς Οργανισμούς Οικονομικής Ολοκλήρωσης οι οποίοι έχουν αρμοδιότητα να υιοθετούν τη νομοθεσία τους, η οποία είναι υποχρεωτική για τα μέλη τους, 
στα θέματα που καλύπτονται από αυτή τη Σύμβαση και 
της οποίας είναι μέλη ένα ή περισσότερα Κράτη μέλη.",368,Non-RespA,ΠΡΟΣΧΩΡΗΣ ΠΕΡΙΦΕΡΕΙΑΚ ΟΡΓΑΝΙΣΜ ΟΙΚΟΝΟΜ ΟΛΟΚΛΗΡΩΣ 1. ΠΡΟΣΧΩΡΗΣ ΣΥΜΒΑΣ ΑΝΟΙΧΤ ΠΕΡΙΦΕΡΕΙΑΚ ΟΡΓΑΝΙΣΜ ΟΙΚΟΝΟΜ ΟΛΟΚΛΗΡΩΣ ΑΡΜΟΔΙΟΤΗΤ ΥΙΟΘΕΤ ΝΟΜΟΘΕΣ ΥΠΟΧΡΕΩΤ ΜΕΛ ΘΕΜ ΚΑΛΥΠΤ ΣΥΜΒΑΣ ΜΕΛ ΠΕΡΙΣΣ ΚΡΑΤ ΜΕΛΗ.,193,75,616,57,0.2953367876,Org,4,0,4,12
852,0,0,0,0,45,NoIdea,0,0,20080100036.pdf,0,14,11,2,0,2,0,1,Non-Org,8,0,0,0,0,0,0,"Οι όροι αυτής της προσχώρησης καθορίζονται σε μία 
συμφωνία που συνάπτεται ανάμεσα στον Οργανισμό 
(OTΙF) και τον Περιφερειακό Οργανισμό.",137,Non-RespA,ΟΙ ΟΡ ΠΡΟΣΧΩΡΗΣ ΚΑΘΟΡΙΖ ΣΥΜΦΩΝ ΣΥΝΑΠΤ ΟΡΓΑΝΙΣΜ OTΙF ΠΕΡΙΦΕΡΕΙΑΚ ΟΡΓΑΝΙΣΜΟ.,74,34,347,19,0.2567567568,Org,2,0,2,4
853,0,0,0,0,45,NoIdea,1,0,20080100036.pdf,0,26,14,12,1,11,0,4,Non-Org,29,0,0,0,0,1,0,"3. Για την άσκηση του δικαιώματος ψήφου και του 
δικαιώματος αντίρρησης που προβλέπεται από τις διατάξεις των παραγράφων 2 και 4 του άρθρου 35 της 
κυρίως Σύμβασης COTIF 1999, ο Περιφερειακός Οργανισμός διαθέτει έναν αριθμό ψήφων ίσο με εκείνον των 
μελών του τα οποία είναι επίσης και Κράτη μέλη του 
Οργανισμού (OTIF). Αυτά τα τελευταία δεν μπορούν 
να ασκήσουν τα δικαιώματα τους, κυρίως το δικαίωμα 
της ψήφου, παρά στο μέτρο που είναι αποδεκτό στην 
παραπάνω παράγραφο 2. Ο Περιφερειακός Οργανισμός 
δεν διαθέτει δικαίωμα ψήφου σε ό,τι αφορά τον Τίτλο 
IV της κυρίως Σύμβασης.",581,RespA,3. ΑΣΚΗΣ ΔΙΚΑΙΩΜ ΨΗΦ ΔΙΚΑΙΩΜ ΑΝΤΙΡΡΗΣ ΠΡΟΒΛΕΠ ΔΙΑΤΑΞ ΠΑΡΑΓΡΑΦ 2 4 ΑΡΘΡ 35 ΣΥΜΒΑΣ COTIF 1999 ΠΕΡΙΦΕΡΕΙΑΚ ΟΡΓΑΝΙΣΜ ΔΙΑΘΕΤ ΑΡΙΘΜ ΨΗΦ ΙΣ ΜΕΛ ΚΡΑΤ ΜΕΛ ΟΡΓΑΝΙΣΜ OTIF . ΤΕΛΕΥΤΑΙ ΔΕΝ ΑΣΚ ΔΙΚΑΙΩΜ ΔΙΚΑΙΩΜ ΨΗΦ ΜΕΤΡ ΑΠΟΔΕΚΤ ΠΑΡΑΠΑΝ ΠΑΡΑΓΡΑΦ 2. ΠΕΡΙΦΕΡΕΙΑΚ ΟΡΓΑΝΙΣΜ ΔΕΝ ΔΙΑΘΕΤ ΔΙΚΑΙΩΜ ΨΗΦ ΑΦΟΡ ΤΙΤΛ IV ΣΥΜΒΑΣΗΣ.,298,93,667,93,0.3120805369,RespA,8,1,7,14
854,0,0,0,0,45,NoIdea,1,0,20080100036.pdf,0,14,6,2,0,2,0,0,Org,0,0,0,0,0,1,0,"4. Για να ανασταλεί η ιδιότητα μέλους, οι διατάξεις 
του άρθρου 41 της κυρίως Σύμβασης εφαρμόζονται 
κατ’αναλογία (mutatis mutandis).",133,RespA,4. ΑΝΑΣΤΑΛ ΙΔΙΟΤΗΤ ΜΕΛ ΔΙΑΤΑΞ ΑΡΘΡ 41 ΣΥΜΒΑΣ ΕΦΑΡΜΟΖ ΑΝΑΛΟΓ MUTATIS MUTANDIS .,78,25,150,12,0.1538461538,RespA,2,0,2,1
855,0,0,0,0,46,NoIdea,0,0,20080100036.pdf,0,3,11,2,0,2,0,0,Non-Org,0,0,0,0,0,0,0,"Συνδεδεμένα μέλη
1. Κάθε Κράτος στην επικράτεια του οποίου πραγματοποιείται εκμετάλλευση σιδηροδρομικής υποδομής 
δύναται να γίνει συνδεδεμένο μέλος του Οργανισμού.",164,RespA,ΣΥΝΔΕΔΕΜΕΝ ΜΕΛ 1. ΚΡΑΤ ΕΠΙΚΡΑΤΕΙ ΠΡΑΓΜΑΤΟΠΟΙΕΙΤΑ ΕΚΜΕΤΑΛΛΕΥΣ ΣΙΔΗΡΟΔΡΟΜ ΥΠΟΔΟΜ ΔΥΝ ΓΙΝ ΣΥΝΔΕΔΕΜΕΝ ΜΕΛ ΟΡΓΑΝΙΣΜΟΥ.,113,18,118,17,0.1504424779,RespA,2,0,2,3
856,0,0,0,0,46,NoIdea,0,0,20080100036.pdf,0,13,6,2,0,2,0,0,Non-Org,0,0,0,0,0,0,0,"Οι διατάξεις των παραγράφων 2 έως 5 του άρθρου 
37 της κυρίως Σύμβασης εφαρμόζονται κατ’ αναλογία 
(mutatis mutandis).",118,RespA,ΟΙ ΔΙΑΤΑΞ ΠΑΡΑΓΡΑΦ 2 5 ΑΡΘΡ 37 ΣΥΜΒΑΣ ΕΦΑΡΜΟΖ ΑΝΑΛΟΓ MUTATIS MUTANDIS .,71,25,150,12,0.1690140845,RespA,2,0,2,1
857,0,0,0,0,46,NoIdea,1,0,20080100036.pdf,0,14,6,2,0,2,0,0,Org,0,0,0,0,0,1,0,"3. Για να ανασταλεί η ιδιότητα μέλους, οι διατάξεις 
του άρθρου 41 της κυρίως Σύμβασης εφαρμόζονται κατ’ 
αναλογία (mutatis mutandis).",134,RespA,3. ΑΝΑΣΤΑΛ ΙΔΙΟΤΗΤ ΜΕΛ ΔΙΑΤΑΞ ΑΡΘΡ 41 ΣΥΜΒΑΣ ΕΦΑΡΜΟΖ ΑΝΑΛΟΓ MUTATIS MUTANDIS .,78,25,150,12,0.1538461538,RespA,2,0,2,1
858,0,0,0,0,47,NoIdea,0,0,20080100036.pdf,0,5,8,3,0,3,0,1,Non-Org,8,0,0,0,0,0,0,"Αναστολή της ιδιότητας μέλους
1. Ένα Κράτος μέλος δύναται να ζητήσει, χωρίς να 
καταγγείλει τη Σύμβαση, μία αναστολή της ιδιότητας 
μέλους του Οργανισμού, όταν δεν πραγματοποιείται 
πλέον καμία διεθνής σιδηροδρομική κυκλοφορία στην 
επικράτεια του για λόγους που δεν καταλογίζονται 
σ»αυτό το Κράτος μέλος.",306,RespA,ΑΝΑΣΤΟΛ ΙΔΙΟΤΗΤ ΜΕΛ 1. ΚΡΑΤ ΜΕΛ ΔΥΝ ΖΗΤ ΚΑΤΑΓΓΕΙΛ ΣΥΜΒΑΣ ΑΝΑΣΤΟΛ ΙΔΙΟΤΗΤ ΜΕΛ ΟΡΓΑΝΙΣΜ ΔΕΝ ΠΡΑΓΜΑΤΟΠΟΙΕΙΤΑ ΔΙΕΘΝ ΣΙΔΗΡΟΔΡΟΜ ΚΥΚΛΟΦΟΡ ΕΠΙΚΡΑΤΕΙ ΛΟΓ ΔΕΝ ΚΑΤΑΛΟΓΙΖ Σ ΚΡΑΤ ΜΕΛΟΣ.,173,30,204,22,0.1271676301,RespA,3,0,3,5
859,0,0,0,0,47,NoIdea,1,0,20080100036.pdf,0,21,10,3,0,3,0,1,Non-Org,7,0,0,0,0,1,0,"3. Η αναστολή της ιδιότητας μέλους τίθεται σε ισχύ 
την πρώτη ημέρα του μήνα που ακολουθεί την κοινοποίηση της απόφασης της Διοικητικής Επιτροπής από τον 
Γενικό Γραμματέα στα Κράτη μέλη. Η αναστολή της ιδιότητας μέλους παύει να ισχύει με την κοινοποίηση από 
το Κράτος μέλος της επαναλειτουργίας της διεθνούς 
σιδηροδρομικής κυκλοφορίας στην επικράτεια του. Ο 
Γενικός Γραμματέας το κοινοποιεί, χωρίς καθυστέρηση, 
στα άλλα Κράτη μέλη.",436,Non-RespA,3. ΑΝΑΣΤΟΛ ΙΔΙΟΤΗΤ ΜΕΛ ΤΙΘ ΙΣΧ ΠΡΩΤ ΗΜΕΡ ΜΗΝ ΑΚΟΛΟΥΘ ΚΟΙΝΟΠΟΙΗΣ ΑΠΟΦΑΣ ΔΙΟΙΚΗΤ ΕΠΙΤΡΟΠ ΓΕΝΙΚ ΓΡΑΜΜΑΤ ΚΡΑΤ ΜΕΛΗ. ΑΝΑΣΤΟΛ ΙΔΙΟΤΗΤ ΜΕΛ ΠΑΥ ΙΣΧΥ ΚΟΙΝΟΠΟΙΗΣ ΚΡΑΤ ΜΕΛ ΕΠΑΝΑΛΕΙΤΟΥΡΓ ΔΙΕΘΝ ΣΙΔΗΡΟΔΡΟΜ ΚΥΚΛΟΦΟΡ ΕΠΙΚΡΑΤΕΙ ΤΟΥ. ΓΕΝΙΚ ΓΡΑΜΜΑΤ ΚΟΙΝΟΠΟΙ ΚΑΘΥΣΤΕΡΗΣ ΚΡΑΤ ΜΕΛΗ.,260,6,54,28,0.1076923077,Irrelevant,2,0,2,11
860,0,0,0,0,47,NoIdea,1,0,20080100036.pdf,0,0,0,0,0,0,0,0,Org,0,0,0,0,0,1,0,4. Η αναστολή της ιδιότητας μέλους έχει ως συνέπεια:,52,Non-RespA,4. ΑΝΑΣΤΟΛ ΙΔΙΟΤΗΤ ΜΕΛ ΣΥΝΕΠΕΙ,30,0,0,0,0,Irrelevant,0,0,0,0
861,0,0,0,1,47,NoIdea,0,0,20080100036.pdf,0,9,8,1,0,1,0,1,Non-Org,8,0,0,0,1,0,0,"β) να ανασταλεί το δικαίωμα ψήφου στα όργανα του 
Οργανισμού,",61,Non-RespA,Β ΑΝΑΣΤΑΛ ΔΙΚΑΙΩΜ ΨΗΦ ΟΡΓΑΝ ΟΡΓΑΝΙΣΜ,36,9,72,8,0.2222222222,RespA,1,0,1,1
862,0,0,0,1,47,NoIdea,0,0,20080100036.pdf,0,29,6,2,0,2,0,0,Non-Org,0,0,0,0,1,0,0,"γ) να ανασταλεί το δικαίωμα υποβολής αντιρρήσεων 
δυνάμει των διατάξεων των παραγράφων 2 και 3 του 
άρθρου 34 και των παραγράφων 2 και 4 του άρθρου 35 
της κυρίως Σύμβασης.",172,RespA,Γ ΑΝΑΣΤΑΛ ΔΙΚΑΙΩΜ ΥΠΟΒΟΛ ΑΝΤΙΡΡΗΣ ΔΥΝΑΜ ΔΙΑΤΑΞ ΠΑΡΑΓΡΑΦ 2 3 ΑΡΘΡ 34 ΠΑΡΑΓΡΑΦ 2 4 ΑΡΘΡ 35 ΣΥΜΒΑΣΗΣ.,98,22,124,11,0.112244898,RespA,2,0,2,1
