,AlphaBulletCapDot,AlphaBulletCapPar,AlphaBulletDot,AlphaBulletPar,ArticleNo,Class,DigitBulletDot,DigitBulletPar,Filename,FirstPatternOffset,FirstWordInCapitalOffset,LongestMatchingPattern,MatchedPatternsCount,MatchingBigrams,MatchingUnigrams,OrgMatchingBigrams,OrgMatchingUnigrams,OrgPrediction,OrgTotalMatchingCharacters,PrevAlphaBulletCapDot,PrevAlphaBulletCapPar,PrevAlphaBulletDot,PrevAlphaBulletPar,PrevDigitBulletDot,PrevDigitBulletPar,RawParagraph,RawParagraphLength,RespAPrediction,StemmedParagraph,StemmedParagraphLength,SumMatchingEntries,SumMatchingEntriesLength,TotalMatchingCharacters,TotalMatchingRatio,TotalPrediction,UnqMatchedPatternsCount,UnqMatchingBigrams,UnqMatchingUnigrams,WordsInCapital
604,0,0,0,0,1,NoIdea,0,0,20080100036.pdf,0,4,17,6,3,3,0,0,Non-Org,0,0,0,0,0,0,0,"Νέο περιεχόμενο της Σύμβασης
Η «Σύμβαση COTIF 1980» τροποποιείται σύμφωνα με τα 
κείμενα που ακολουθούν και αποτελούν αναπόσπαστο 
τμήμα του παρόντος Πρωτοκόλλου.",162,RespA,ΝΕ ΠΕΡΙΕΧΟΜΕΝ ΣΥΜΒΑΣ ΣΥΜΒΑΣ COTIF 1980 ΤΡΟΠΟΠΟΙΕΙΤΑ ΣΥΜΦΩΝ ΚΕΙΜΕΝ ΑΚΟΛΟΥΘ ΑΠΟΤΕΛ ΑΝΑΠΟΣΠΑΣΤ ΤΜΗΜ ΠΑΡΟΝΤ ΠΡΩΤΟΚΟΛΛΟΥ.,116,34,310,67,0.5775862069,RespA,5,3,2,5
605,,0,0,0,2,NoIdea,0,0,20080100036.pdf,0,2,14,7,1,6,0,0,Non-Org,0,0,0,0,0,0,0,"Προσωρινός Θεματοφύλακας
1. Τα καθήκοντα της Κυβέρνησης Θεματοφύλακα, που 
προβλέπονται στις διατάξεις των άρθρων 22 έως 26 της 
Σύμβασης COTIF 1980, τα αναλαμβάνει ο OTIF, ως προσωρινός Θεματοφύλακας, από την έναρξη υπογραφής 
του παρόντος Πρωτοκόλλου και μέχρι την ημερομηνία 
θέσης του σε ισχύ.",297,RespA,ΠΡΟΣΩΡΙΝ ΘΕΜΑΤΟΦΥΛΑΚ 1. ΚΑΘΗΚΟΝΤ ΚΥΒΕΡΝΗΣ ΘΕΜΑΤΟΦΥΛΑΚ ΠΡΟΒΛΕΠ ΔΙΑΤΑΞ ΑΡΘΡ 22 26 ΣΥΜΒΑΣ COTIF 1980 ΑΝΑΛΑΜΒΑΝ OTIF ΠΡΟΣΩΡΙΝ ΘΕΜΑΤΟΦΥΛΑΚ ΕΝΑΡΞ ΥΠΟΓΡΑΦ ΠΑΡΟΝΤ ΠΡΩΤΟΚΟΛΛ ΗΜΕΡΟΜΗΝ ΘΕΣ ΙΣΧΥ.,183,61,469,61,0.3333333333,RespA,7,1,6,9
606,0,0,0,0,3,NoIdea,0,0,20080100036.pdf,0,2,9,2,0,2,0,0,Non-Org,0,0,0,0,0,0,0,"Προσχώρηση
1. Το παρόν Πρωτόκολλο παραμένει ανοιχτό προς υπογραφή από τα Κράτη Μέλη μέχρι τις 31 Δεκεμβρίου 1999.",113,RespA,ΠΡΟΣΧΩΡΗΣ 1. ΠΑΡΟΝ ΠΡΩΤΟΚΟΛΛ ΠΑΡΑΜΕΝ ΑΝΟΙΧΤ ΥΠΟΓΡΑΦ ΚΡΑΤ ΜΕΛ 31 ΔΕΚΕΜΒΡ 1999.,77,30,242,16,0.2077922078,RespA,2,0,2,5
607,0,0,0,0,3,NoIdea,0,0,20080100036.pdf,0,7,7,2,0,2,0,0,Non-Org,0,0,0,0,0,0,0,"Αυτή η υπογραφή λαμβάνει χώρα στη Βέρνη ενώπιον 
του προσωρινού Θεματοφύλακα.",77,RespA,ΑΥΤ ΥΠΟΓΡΑΦ ΛΑΜΒΑΝ ΧΩΡ ΒΕΡΝ ΕΝΩΠ ΠΡΟΣΩΡΙΝ ΘΕΜΑΤΟΦΥΛΑΚΑ.,55,18,122,13,0.2363636364,RespA,2,0,2,2
608,0,0,0,0,3,NoIdea,1,0,20080100036.pdf,0,2,11,4,0,4,0,0,Org,0,0,0,0,0,1,0,"3. Τα Κράτη μέλη που δεν υπέγραψαν το παρόν Πρωτόκολλο εντός της προβλεπόμενης προθεσμίας στην 
παρ. 1 του παρόντος άρθρου, καθώς και τα Κράτη των 
οποίων η αίτηση προσχώρησης στη «Σύμβαση COTIF 
1980» έγινε πλήρως αποδεκτή σύμφωνα με τις διατάξεις 
της παρ. 2 του άρθρου 23 αυτής, δύνανται, πριν από τη 
θέση σε ισχύ του παρόντος Πρωτοκόλλου, να προσχωρήσουν σ’αυτό καταθέτοντας ένα έγγραφο προσχώρησης ενώπιον του προσωρινού Θεματοφύλακα.",440,Non-RespA,3. ΚΡΑΤ ΜΕΛ ΔΕΝ ΥΠΕΓΡΑΨ ΠΑΡΟΝ ΠΡΩΤΟΚΟΛΛ ΠΡΟΒΛΕΠΟΜΕΝ ΠΡΟΘΕΣΜ ΠΑΡ. 1 ΠΑΡΟΝΤ ΑΡΘΡ ΚΡΑΤ ΑΙΤΗΣ ΠΡΟΣΧΩΡΗΣ ΣΥΜΒΑΣ COTIF 1980 ΕΓΙΝ ΠΛΗΡΩΣ ΑΠΟΔΕΚΤ ΣΥΜΦΩΝ ΔΙΑΤΑΞ ΠΑΡ. 2 ΑΡΘΡ 23 ΔΥΝΑΝΤΑ ΘΕΣ ΙΣΧ ΠΑΡΟΝΤ ΠΡΩΤΟΚΟΛΛ ΠΡΟΣΧΩΡ Σ ΚΑΤΑΘΕΤ ΕΓΓΡΑΦ ΠΡΟΣΧΩΡΗΣ ΕΝΩΠ ΠΡΟΣΩΡΙΝ ΘΕΜΑΤΟΦΥΛΑΚΑ.,262,39,307,35,0.1335877863,Org,3,0,3,7
609,0,0,0,0,3,NoIdea,1,0,20080100036.pdf,0,4,17,10,2,8,0,0,Org,0,0,0,0,0,1,0,"4. Η προσχώρηση ενός Κράτους στη «Σύμβαση COTIF 
1980» σύμφωνα με τις διατάξεις του άρθρου 23 αυτής, 
του οποίου η αίτηση έγινε μετά την έναρξη υπογραφής 
του παρόντος Πρωτοκόλλου αλλά πριν από τη θέση του 
σε ισχύ, ισχύει τόσο για τη Σύμβαση COTIF 1960 όσο και 
για τη Σύμβαση της οποίας το κείμενο ακολουθεί στο 
Παράρτημα που αποτελεί αναπόσπαστο τμήμα του παρόντος Πρωτοκόλλου και που στο εξής θα αποκαλείται 
«Σύμβαση COTIF 1999».",435,Non-RespA,4. ΠΡΟΣΧΩΡΗΣ ΚΡΑΤ ΣΥΜΒΑΣ COTIF 1980 ΣΥΜΦΩΝ ΔΙΑΤΑΞ ΑΡΘΡ 23 ΑΙΤΗΣ ΕΓΙΝ ΕΝΑΡΞ ΥΠΟΓΡΑΦ ΠΑΡΟΝΤ ΠΡΩΤΟΚΟΛΛ ΘΕΣ ΙΣΧ ΙΣΧΥ ΣΥΜΒΑΣ COTIF 1960 ΣΥΜΒΑΣ ΚΕΙΜΕΝ ΑΚΟΛΟΥΘ ΠΑΡΑΡΤΗΜ ΑΠΟΤΕΛ ΑΝΑΠΟΣΠΑΣΤ ΤΜΗΜ ΠΑΡΟΝΤ ΠΡΩΤΟΚΟΛΛ ΑΠΟΚΑΛΕΙΤΑ ΣΥΜΒΑΣ COTIF 1999 .,232,71,528,87,0.375,Org,6,2,4,11
610,0,0,0,0,4,NoIdea,0,0,20080100036.pdf,0,4,9,4,0,4,0,0,Non-Org,0,0,0,0,0,0,0,"Θέση σε ισχύ
1. Το παρόν Πρωτόκολλο τίθεται σε ισχύ την πρώτη 
ημέρα του τρίτου μήνα που ακολουθεί αυτόν στη διάρκεια του οποίου ο προσωρινός Θεματοφύλακας θα 
έχει κοινοποιήσει στα Κράτη μέλη την κατάθεση του 
εγγράφου με το οποίο πληρούνται οι όροι της παρ. 2 
του άρθρου 20 της «Σύμβασης COTIF 1980».",303,Non-RespA,ΘΕΣ ΙΣΧ 1. ΠΑΡΟΝ ΠΡΩΤΟΚΟΛΛ ΤΙΘ ΙΣΧ ΠΡΩΤ ΗΜΕΡ ΤΡΙΤ ΜΗΝ ΑΚΟΛΟΥΘ ΔΙΑΡΚΕΙ ΠΡΟΣΩΡΙΝ ΘΕΜΑΤΟΦΥΛΑΚ ΚΟΙΝΟΠΟΙ ΚΡΑΤ ΜΕΛ ΚΑΤΑΘΕΣ ΕΓΓΡΑΦ ΠΛΗΡ ΟΡ ΠΑΡ. 2 ΑΡΘΡ 20 ΣΥΜΒΑΣ COTIF 1980 .,166,41,289,26,0.156626506,Org,4,0,4,6
611,0,0,0,0,4,NoIdea,0,0,20080100036.pdf,0,2,6,1,0,1,0,0,Non-Org,0,0,0,0,0,0,0,"Ως Κράτη μέλη υπό την έννοια της παρ. 2 του άρθρου 
20 της «Σύμβασης COTIF 1980», θεωρούνται τα Κράτη 
τα οποία, κατά τη στιγμή της απόφασης της 5ης Γενικής 
Συνέλευσης, ήταν Κράτη Μέλη και τα οποία είναι ακόμη 
μέλη κατά τη στιγμή που πληρούνται οι προϋποθέσεις 
για τη θέση σε ισχύ του παρόντος Πρωτοκόλλου.",309,Non-RespA,ΩΣ ΚΡΑΤ ΜΕΛ ΕΝΝΟΙ ΠΑΡ. 2 ΑΡΘΡ 20 ΣΥΜΒΑΣ COTIF 1980 ΘΕΩΡ ΚΡΑΤ ΣΤΙΓΜ ΑΠΟΦΑΣ 5ΗΣ ΓΕΝΙΚ ΣΥΝΕΛΕΥΣ ΚΡΑΤ ΜΕΛ ΜΕΛ ΣΤΙΓΜ ΠΛΗΡ ΠΡΟΥΠΟΘΕΣ ΘΕΣ ΙΣΧ ΠΑΡΟΝΤ ΠΡΩΤΟΚΟΛΛΟΥ.,154,18,108,6,0.03896103896,Org,1,0,1,9
612,0,0,0,0,5,NoIdea,0,0,20080100036.pdf,0,4,17,8,3,5,0,2,Non-Org,10,0,0,0,0,0,0,"Δηλώσεις και επιφυλάξεις
Οι δηλώσεις και επιφυλάξεις, που προβλέπονται στις 
διατάξεις της παρ. 1 του άρθρου 42 της «Σύμβασης 
464 
ΕΦΗΜΕΡΙΣ ΤΗΣ ΚΥΒΕΡΝΗΣΕΩΣ (ΤΕΥΧΟΣ ΠΡΩΤΟ) 
COTIF 1999», της οποίας το κείμενο ακολουθεί στο Παράρτημα που αποτελεί αναπόσπαστο τμήμα του παρόντος Πρωτοκόλλου, μπορούν να εκφραστούν ή να 
διατυπωθούν ανά πάσα στιγμή, ακόμη και πριν από τη 
θέση σε ισχύ του παρόντος Πρωτοκόλλου.",407,Non-RespA,ΔΗΛΩΣ ΕΠΙΦΥΛΑΞ ΔΗΛΩΣ ΕΠΙΦΥΛΑΞ ΠΡΟΒΛΕΠ ΔΙΑΤΑΞ ΠΑΡ. 1 ΑΡΘΡ 42 ΣΥΜΒΑΣ 464 ΕΦΗΜΕΡΙΣ ΚΥΒΕΡΝΗΣ ΤΕΥΧ ΠΡΩΤ COTIF 1999 ΚΕΙΜΕΝ ΑΚΟΛΟΥΘ ΠΑΡΑΡΤΗΜ ΑΠΟΤΕΛ ΑΝΑΠΟΣΠΑΣΤ ΤΜΗΜ ΠΑΡΟΝΤ ΠΡΩΤΟΚΟΛΛ ΕΚΦΡΑΣΤ ΔΙΑΤΥΠΩΘ ΠΑΣ ΣΤΙΓΜ ΘΕΣ ΙΣΧ ΠΑΡΟΝΤ ΠΡΩΤΟΚΟΛΛΟΥ.,228,62,482,83,0.3640350877,Org,7,3,4,11
613,0,0,0,0,5,NoIdea,0,0,20080100036.pdf,0,13,0,0,0,0,0,0,Non-Org,0,0,0,0,0,0,0,"Αυτές αρχίζουν να ισχύουν από τη στιγμή θέσης σε 
ισχύ του παρόντος Πρωτοκόλλου.",80,Non-RespA,ΑΥΤ ΑΡΧΙΖ ΙΣΧΥ ΣΤΙΓΜ ΘΕΣ ΙΣΧ ΠΑΡΟΝΤ ΠΡΩΤΟΚΟΛΛΟΥ.,48,0,0,0,0,Org,0,0,0,1
614,0,0,0,0,6,NoIdea,0,0,20080100036.pdf,0,3,9,1,0,1,0,0,Non-Org,0,0,0,0,0,0,0,"Μεταβατικές διατάξεις
1. Το αργότερο 6 μήνες μετά από τη θέση σε ισχύ του 
παρόντος Πρωτοκόλλου, ο Γενικός Γραμματέας του 
OTIF συγκαλεί τη Γενική Συνέλευση προκειμένου:",169,Non-RespA,ΜΕΤΑΒΑΤ ΔΙΑΤΑΞ 1. 6 ΜΗΝ ΘΕΣ ΙΣΧ ΠΑΡΟΝΤ ΠΡΩΤΟΚΟΛΛ ΓΕΝΙΚ ΓΡΑΜΜΑΤ OTIF ΣΥΓΚΑΛ ΓΕΝΙΚ ΣΥΝΕΛΕΥΣ,89,16,144,9,0.1011235955,Org,1,0,1,7
615,0,0,0,1,6,NoIdea,0,0,20080100036.pdf,0,18,8,5,0,5,0,1,Non-Org,8,0,0,0,1,0,0,"β) να καθορίσει, για περίοδο 6 ετών, το μέγιστο ποσό 
στο οποίο μπορούν να ανέρχονται οι δαπάνες του Οργανισμού κατά τη διάρκεια κάθε λογιστικής περιόδου 
(σύμφωνα με τις διατάξεις της περίπτωσης ε) της παρ.",207,RespA,Β ΚΑΘΟΡΙΣ ΠΕΡΙΟΔ 6 ΕΤ ΜΕΓΙΣΤ ΠΟΣ ΑΝΕΡΧ ΔΑΠΑΝ ΟΡΓΑΝΙΣΜ ΔΙΑΡΚΕΙ ΛΟΓΙΣΤ ΠΕΡΙΟΔ ΣΥΜΦΩΝ ΔΙΑΤΑΞ ΠΕΡΙΠΤΩΣ Ε ΠΑΡ.,105,34,206,31,0.2952380952,RespA,4,0,4,1
616,0,0,0,0,6,NoIdea,1,0,20080100036.pdf,0,8,15,10,2,8,0,1,Non-Org,7,0,0,0,0,1,0,"3. Μετά τη θέση σε ισχύ του παρόντος Πρωτοκόλλου, 
η θητεία της Διοικητικής Επιτροπής, που έχει καθοριστεί σύμφωνα με τις διατάξεις της περίπτωσης β) της 
παρ. 2 του άρθρου 6 της «Σύμβασης COTIF 1980», λήγει 
κατά την ημερομηνία που καθορίζεται από τη Γενική 
Συνέλευση. Η ημερομηνία πρέπει να συμπίπτει με την 
ημερομηνία έναρξης της θητείας των μελών και των 
αναπληρωματικών μελών της Διοικητικής Εππροπής 
που ορίζονται από τη Γενική Συνέλευση (σύμφωνα με 
τις διατάξεις της περίπτωσης β) της παρ. 2 του άρθρου 
14 της «Σύμβασης COTIF 1999» της οποίας το κείμενο 
ακολουθεί στο Παράρτημα πουαποτελεί αναπόσπαστο 
τμήμα του παρόντος Πρωτοκόλλου).",649,RespA,3. ΘΕΣ ΙΣΧ ΠΑΡΟΝΤ ΠΡΩΤΟΚΟΛΛ ΘΗΤΕΙ ΔΙΟΙΚΗΤ ΕΠΙΤΡΟΠ ΚΑΘΟΡΙΣΤ ΣΥΜΦΩΝ ΔΙΑΤΑΞ ΠΕΡΙΠΤΩΣ Β ΠΑΡ. 2 ΑΡΘΡ 6 ΣΥΜΒΑΣ COTIF 1980 ΛΗΓ ΗΜΕΡΟΜΗΝ ΚΑΘΟΡΙΖ ΓΕΝΙΚ ΣΥΝΕΛΕΥΣΗ. ΗΜΕΡΟΜΗΝ ΣΥΜΠΙΠΤ ΗΜΕΡΟΜΗΝ ΕΝΑΡΞ ΘΗΤΕΙ ΜΕΛ ΑΝΑΠΛΗΡΩΜΑΤ ΜΕΛ ΔΙΟΙΚΗΤ ΕΠΠΡΟΠ ΟΡΙΖ ΓΕΝΙΚ ΣΥΝΕΛΕΥΣ ΣΥΜΦΩΝ ΔΙΑΤΑΞ ΠΕΡΙΠΤΩΣ Β ΠΑΡ. 2 ΑΡΘΡ 14 ΣΥΜΒΑΣ COTIF 1999 ΚΕΙΜΕΝ ΑΚΟΛΟΥΘ ΠΑΡΑΡΤΗΜ ΠΟΥΑΠΟΤΕΛ ΑΝΑΠΟΣΠΑΣΤ ΤΜΗΜ ΠΑΡΟΝΤ ΠΡΩΤΟΚΟΛΛ .,373,63,475,86,0.2305630027,RespA,6,2,4,16
617,0,0,0,0,6,NoIdea,1,0,20080100036.pdf,0,6,9,6,0,6,0,1,Non-Org,5,0,0,0,0,1,0,"4. Η θητεία του εν ενεργεία Γενικού Γραμματέα του 
Κεντρικού Γραφείου κατά τη στιγμή της θέσης σε ισχύ 
του παρόντος Πρωτοκόλλου λήγει με την εκπνοή της 
περιόδου για την οποία αυτός διορίστηκε σύμφωνα με 
τις διατάξεις της περίπτωσης δ) της παρ. 2, του άρθρου 
7 της «Σύμβασης COTIF 1980». Από τη στιγμή της θέσης 
σε ισχύ του παρόντος Πρωτοκόλλου, αυτός ασκεί τα 
καθήκοντα του Γενικού Γραμματέα.",398,RespA,4. ΘΗΤΕΙ ΕΝΕΡΓΕΙ ΓΕΝΙΚ ΓΡΑΜΜΑΤ ΚΕΝΤΡ ΓΡΑΦΕΙ ΣΤΙΓΜ ΘΕΣ ΙΣΧ ΠΑΡΟΝΤ ΠΡΩΤΟΚΟΛΛ ΛΗΓ ΕΚΠΝΟ ΠΕΡΙΟΔ ΔΙΟΡΙΣΤ ΣΥΜΦΩΝ ΔΙΑΤΑΞ ΠΕΡΙΠΤΩΣ Δ ΠΑΡ. 2 ΑΡΘΡ 7 ΣΥΜΒΑΣ COTIF 1980 . ΣΤΙΓΜ ΘΕΣ ΙΣΧ ΠΑΡΟΝΤ ΠΡΩΤΟΚΟΛΛ ΑΣΚ ΚΑΘΗΚΟΝΤ ΓΕΝΙΚ ΓΡΑΜΜΑΤΕΑ.,219,55,388,44,0.200913242,RespA,5,0,5,11
618,0,0,0,0,6,NoIdea,1,0,20080100036.pdf,0,10,11,3,1,2,0,0,Org,0,0,0,0,0,1,0,"5. Ακόμη και μετά τη θέση σε ισχύ του παρόντος Πρωτοκόλλου, οι σχετικές διατάξεις των άρθρων 6, 7 και 11 
της «Σύμβασης COTIF 1980» παραμένουν σε εφαρμογή 
σε ό,τι αφορά:",170,RespA,5. ΘΕΣ ΙΣΧ ΠΑΡΟΝΤ ΠΡΩΤΟΚΟΛΛ ΣΧΕΤ ΔΙΑΤΑΞ ΑΡΘΡ 6 7 11 ΣΥΜΒΑΣ COTIF 1980 ΠΑΡΑΜΕΝ ΕΦΑΡΜΟΓ ΑΦΟΡ,90,37,285,26,0.2888888889,RespA,3,1,2,3
619,0,0,0,1,6,NoIdea,0,0,20080100036.pdf,0,7,8,3,0,3,0,1,Non-Org,8,0,0,0,1,0,0,"β) τον καθορισμό των οριστικών συνεισφορών των 
Κρατών μελών στις δαπάνες του Οργανισμού,",89,RespA,Β ΚΑΘΟΡΙΣΜ ΟΡΙΣΤ ΣΥΝΕΙΣΦΟΡ ΚΡΑΤ ΜΕΛ ΔΑΠΑΝ ΟΡΓΑΝΙΣΜ,50,32,208,21,0.42,RespA,3,0,3,2
620,0,0,0,1,6,NoIdea,0,0,20080100036.pdf,0,0,0,0,0,0,0,0,Non-Org,0,0,0,0,1,0,0,"γ) την καταβολή των συνεισφορών,",32,RespA,Γ ΚΑΤΑΒΟΛ ΣΥΝΕΙΣΦΟΡ,19,0,0,0,0,RespA,0,0,0,0
621,0,0,0,1,6,NoIdea,0,0,20080100036.pdf,0,15,10,6,0,6,0,1,Non-Org,8,0,0,0,1,0,0,"δ) το μέγιστο ποσό, το οποίο καθορίστηκε πριν από τη 
θέση σε ισχύ του παρόντος Πρωτοκόλλου και στο οποίο 
δύνανται να ανέρχονται οι δαπάνες του Οργανισμού 
κατά τη διάρκεια μίας πενταετούς περιόδου,
Οι περιπτώσεις α) έως γ) αναφέρονται στο έτος κατά 
τη διάρκεια του οποίου το παρόν Πρωτόκολλο τίθεται 
σε ισχύ καθώς και στο προηγούμενο αυτού έτος.",349,RespA,Δ ΜΕΓΙΣΤ ΠΟΣ ΚΑΘΟΡΙΣΤ ΘΕΣ ΙΣΧ ΠΑΡΟΝΤ ΠΡΩΤΟΚΟΛΛ ΔΥΝΑΝΤΑ ΑΝΕΡΧ ΔΑΠΑΝ ΟΡΓΑΝΙΣΜ ΔΙΑΡΚΕΙ ΠΕΝΤΑΕΤ ΠΕΡΙΟΔ ΠΕΡΙΠΤΩΣ Α Γ ΑΝΑΦΕΡ ΕΤ ΔΙΑΡΚΕΙ ΠΑΡΟΝ ΠΡΩΤΟΚΟΛΛ ΤΙΘ ΙΣΧ ΠΡΟΗΓΟΥΜΕΝ ΕΤΟΣ.,170,50,358,47,0.2764705882,RespA,5,0,5,4
622,0,0,0,0,6,NoIdea,1,0,20080100036.pdf,0,4,17,8,2,6,0,0,Org,0,0,0,0,0,1,0,"7. Κατόπιν αιτήσεως του Κράτους μέλους του οποίου 
η συνεισφορά, υπολογιζόμενη δυνάμει των διατάξεων 
του άρθρου 26 της «Σύμβασης COTIF 1999» της οποίας 
το κείμενο ακολουθεί και αποτελεί αναπόσπαστο τμήμα 
του παρόντος Πρωτοκόλλου, είναι υψηλότερη από αυτή 
που οφειλόταν για το έτος 1999, η Γενική Συνέλευση 
μπορεί να καθορίσει τη συνεισφορά αυτού του Κράτους 
μέλους για Τα επόμενα τρία έτη από το έτος της θέσης σε ισχύ του παρόντος Πρωτοκόλλου, λαμβάνοντας
υπ’ όψιν τις ακόλουθες αρχές:",492,Non-RespA,7. ΑΙΤΗΣ ΚΡΑΤ ΜΕΛ ΣΥΝΕΙΣΦΟΡ ΥΠΟΛΟΓΙΖΟΜΕΝ ΔΥΝΑΜ ΔΙΑΤΑΞ ΑΡΘΡ 26 ΣΥΜΒΑΣ COTIF 1999 ΚΕΙΜΕΝ ΑΚΟΛΟΥΘ ΑΠΟΤΕΛ ΑΝΑΠΟΣΠΑΣΤ ΤΜΗΜ ΠΑΡΟΝΤ ΠΡΩΤΟΚΟΛΛ ΥΨΗΛ ΟΦΕΙΛ ΕΤ 1999 ΓΕΝΙΚ ΣΥΝΕΛΕΥΣ ΚΑΘΟΡΙΣ ΣΥΝΕΙΣΦΟΡ ΚΡΑΤ ΜΕΛ ΕΠΟΜΕΝ ΤΡ ΕΤ ΕΤ ΘΕΣ ΙΣΧ ΠΑΡΟΝΤ ΠΡΩΤΟΚΟΛΛ ΛΑΜΒΑΝ ΟΨΙΝ ΑΚΟΛΟΥΘ ΑΡΧ,260,69,494,73,0.2807692308,Org,7,2,5,9
623,0,0,0,1,6,NoIdea,0,0,20080100036.pdf,0,0,5,1,0,1,0,0,Non-Org,0,0,0,0,1,0,0,"β) η συνεισφορά προσαρμόζεται προοδευτικά το πολύ 
σε τρία στάδια για να φθάσει στο ποσό της οριστικής 
συνεισφοράς που υπολογίζεται δυνάμει των διατάξεων 
του προαναφερόμενου άρθρου 26.",186,RespA,Β ΣΥΝΕΙΣΦΟΡ ΠΡΟΣΑΡΜΟΖ ΠΡΟΟΔΕΥΤ ΤΡ ΣΤΑΔΙ ΦΘΑΣ ΠΟΣ ΟΡΙΣΤ ΣΥΝΕΙΣΦΟΡ ΥΠΟΛΟΓΙΖ ΔΥΝΑΜ ΔΙΑΤΑΞ ΠΡΟΑΝΑΦΕΡΟΜΕΝ ΑΡΘΡ 26.,109,8,40,5,0.04587155963,RespA,1,0,1,0
624,0,0,0,0,6,NoIdea,1,0,20080100036.pdf,0,6,9,3,0,3,0,0,Org,0,0,0,0,0,1,0,"9. Οι αναγκαστικού δικαίου διατάξεις των Ενιαίων Νομικών Κανόνων CUV και των Ενιαίων Νομικών Κανόνων 
CUI εφαρμόζονται ένα έτος μετά τη θέση σε ισχύ του 
παρόντος Πρωτοκόλλου, για τα συμβόλαια που έχουν 
συναφθεί πριν από τη θέση του σε ισχύ.",242,Non-RespA,9. ΑΝΑΓΚΑΣΤ ΔΙΚΑΙ ΔΙΑΤΑΞ ΕΝΙΑΙ ΝΟΜ ΚΑΝΟΝ CUV ΕΝΙΑΙ ΝΟΜ ΚΑΝΟΝ CUI ΕΦΑΡΜΟΖ ΕΤ ΘΕΣ ΙΣΧ ΠΑΡΟΝΤ ΠΡΩΤΟΚΟΛΛ ΣΥΜΒΟΛΑΙ ΣΥΝΑΦΘ ΘΕΣ ΙΣΧΥ.,126,20,164,19,0.1507936508,Org,2,0,2,9
625,0,0,0,0,7,NoIdea,0,0,20080100036.pdf,0,3,9,5,0,5,0,0,Non-Org,0,0,0,0,0,0,0,"Κείμενα του Πρωτοκόλλου
1. Το παρόν Πρωτόκολλο συνήφθη και υπεγράφη στη 
γαλλική, γερμανική και αγγλική γλώσσα. Σε περίπτωση 
διάστασης, μόνο το γαλλικό κείμενο είναι αυθεντικό.",177,Non-RespA,ΚΕΙΜΕΝ ΠΡΩΤΟΚΟΛΛ 1. ΠΑΡΟΝ ΠΡΩΤΟΚΟΛΛ ΣΥΝΗΦΘ ΥΠΕΓΡΑΦ ΓΑΛΛ ΓΕΡΜΑΝ ΑΓΓΛ ΓΛΩΣΣΑ. ΠΕΡΙΠΤΩΣ ΔΙΑΣΤΑΣ ΓΑΛΛ ΚΕΙΜΕΝ ΑΥΘΕΝΤΙΚΟ.,115,37,272,37,0.3217391304,Org,3,0,3,4
626,0,0,0,0,7,NoIdea,0,0,20080100036.pdf,0,12,10,1,0,1,0,0,Non-Org,0,0,0,0,0,0,0,"Προς πιστοποίηση των ανωτέρω οι πληρεξούσιοι 
υπογεγραμμένοι, δεόντως εξουσιοδοτημένοι από τις 
Κυβερνήσεις τους υπέγραψαν το παρόν Πρωτόκολλο.",143,RespA,ΠΡΟΣ ΠΙΣΤΟΠΟΙΗΣ ΠΛΗΡΕΞΟΥΣ ΥΠΟΓΕΓΡΑΜΜΕΝ ΔΕΟΝΤΩΣ ΕΞΟΥΣΙΟΔΟΤΗΜΕΝ ΚΥΒΕΡΝΗΣ ΥΠΕΓΡΑΨ ΠΑΡΟΝ ΠΡΩΤΟΚΟΛΛΟ.,96,7,70,10,0.1041666667,RespA,1,0,1,2
627,0,0,0,0,7,NoIdea,0,0,20080100036.pdf,0,3,8,2,0,2,0,0,Non-Org,0,0,0,0,0,0,0,"Συνετάχθη στο Vilnius, την 3” Ιουνίου 1999, σε ένα 
μόνο πρωτότυπο αντίτυπο σε κάθε μία από τις γλώσσες γαλλική, γερμανική και αγγλική. Τα αντίτυπα αυτά 
παραμένουν κατατεθειμένα στα αρχεία του OTIF. Ακριβή 
επικυρωμένα αντίγραφα θα παραδοθούν σε κάθε ένα 
από τα Κράτη μέλη.",275,RespA,ΣΥΝΕΤΑΧΘ VILNIUS 3 ΙΟΥΝ 1999 ΠΡΩΤΟΤΥΠ ΑΝΤΙΤΥΠ ΓΛΩΣΣ ΓΑΛΛ ΓΕΡΜΑΝ ΑΓΓΛΙΚΗ. ΑΝΤΙΤΥΠ ΠΑΡΑΜΕΝ ΚΑΤΑΤΕΘΕΙΜΕΝ ΑΡΧΕΙ OTIF. ΑΚΡΙΒ ΕΠΙΚΥΡΩΜΕΝ ΑΝΤΙΓΡΑΦ ΠΑΡΑΔΟΘ ΚΡΑΤ ΜΕΛΗ.,158,53,304,13,0.08227848101,RespA,2,0,2,6
628,0,0,0,0,7,NoIdea,0,0,20080100036.pdf,0,3,8,1,0,1,0,0,Non-Org,0,0,0,0,0,0,0,Για τη Δημοκρατία της Αλβανίας:,31,Non-RespA,ΓΙΑ ΔΗΜΟΚΡΑΤ ΑΛΒΑΝ,18,2,16,8,0.4444444444,RespA,1,0,1,2
629,0,0,0,0,7,NoIdea,0,0,20080100036.pdf,0,3,8,2,0,2,0,0,Non-Org,0,0,0,0,0,0,0,Για την Αλγερινή Δημοκρατική και Λαϊκή Δημοκρατία:,50,Non-RespA,ΓΙΑ ΑΛΓΕΡΙΝ ΔΗΜΟΚΡΑΤ ΛΑΙΚ ΔΗΜΟΚΡΑΤ,34,2,16,16,0.4705882353,RespA,1,0,1,4
630,0,0,0,0,7,NoIdea,0,0,20080100036.pdf,0,3,8,1,0,1,0,0,Non-Org,0,0,0,0,0,0,0,Για την Ομοσπονδιακή Δημοκρατία της Γερμανίας:,46,Non-RespA,ΓΙΑ ΟΜΟΣΠΟΝΔΙΑΚ ΔΗΜΟΚΡΑΤ ΓΕΡΜΑΝ,31,2,16,8,0.2580645161,RespA,1,0,1,3
631,0,0,0,0,7,NoIdea,0,0,20080100036.pdf,0,3,8,1,0,1,0,0,Non-Org,0,0,0,0,0,0,0,Για τη Δημοκρατία της Αυστρίας:,31,Non-RespA,ΓΙΑ ΔΗΜΟΚΡΑΤ ΑΥΣΤΡ,18,2,16,8,0.4444444444,RespA,1,0,1,2
632,0,0,0,0,7,NoIdea,0,0,20080100036.pdf,0,3,0,0,0,0,0,0,Non-Org,0,0,0,0,0,0,0,"Για το Βασίλειο του Βελγίου
Για τη Βοσνία Ερζεγοβίνη:",53,Non-RespA,ΓΙΑ ΒΑΣΙΛΕΙ ΒΕΛΓ ΒΟΣΝ ΕΡΖΕΓΟΒΙΝ,31,0,0,0,0,RespA,0,0,0,5
633,0,0,0,0,7,NoIdea,0,0,20080100036.pdf,0,3,8,1,0,1,0,0,Non-Org,0,0,0,0,0,0,0,Για τη Δημοκρατία της Βουλγαρίας:,33,Non-RespA,ΓΙΑ ΔΗΜΟΚΡΑΤ ΒΟΥΛΓΑΡ,20,2,16,8,0.4,RespA,1,0,1,2
634,0,0,0,0,7,NoIdea,0,0,20080100036.pdf,0,3,8,1,0,1,0,0,Non-Org,0,0,0,0,0,0,0,Για τη Δημοκρατία της Κροατίας:,31,Non-RespA,ΓΙΑ ΔΗΜΟΚΡΑΤ ΚΡΟΑΤ,18,2,16,8,0.4444444444,RespA,1,0,1,2
635,0,0,0,0,7,NoIdea,0,0,20080100036.pdf,0,3,0,0,0,0,0,0,Non-Org,0,0,0,0,0,0,0,Για το Βασίλειο της Δανίας:,27,Non-RespA,ΓΙΑ ΒΑΣΙΛΕΙ ΔΑΝΙ,16,0,0,0,0,RespA,0,0,0,2
636,0,0,0,0,7,NoIdea,0,0,20080100036.pdf,0,3,0,0,0,0,0,0,Non-Org,0,0,0,0,0,0,0,Για το Βασίλειο της Ισπανίας:,29,Non-RespA,ΓΙΑ ΒΑΣΙΛΕΙ ΙΣΠΑΝ,17,0,0,0,0,RespA,0,0,0,2
637,0,0,0,0,7,NoIdea,0,0,20080100036.pdf,0,3,8,1,0,1,0,0,Non-Org,0,0,0,0,0,0,0,Για τη Δημοκρατία της Φινλανδίας:,33,Non-RespA,ΓΙΑ ΔΗΜΟΚΡΑΤ ΦΙΝΛΑΝΔ,20,2,16,8,0.4,RespA,1,0,1,2
638,0,0,0,0,7,NoIdea,0,0,20080100036.pdf,0,3,8,1,0,1,0,0,Non-Org,0,0,0,0,0,0,0,"Για τη Γαλλική Δημοκρατία
Για το Ηνωμένο Βασίλειο της Μεγάλης Βρετανίας και 
της Βόρειας Ιρλανδίας:",99,Non-RespA,ΓΙΑ ΓΑΛΛ ΔΗΜΟΚΡΑΤ ΗΝΩΜΕΝ ΒΑΣΙΛΕΙ ΜΕΓΑΛ ΒΡΕΤΑΝ ΒΟΡΕΙ ΙΡΛΑΝΔ,58,2,16,8,0.1379310345,RespA,1,0,1,9
639,0,0,0,0,7,NoIdea,0,0,20080100036.pdf,0,3,8,2,0,2,0,1,Non-Org,5,0,0,0,0,0,0,"Για την Ελληνική Δημοκρατία
Για τη Δημοκρατία της Ουγγαρίας:",60,Non-RespA,ΓΙΑ ΕΛΛΗΝ ΔΗΜΟΚΡΑΤ ΔΗΜΟΚΡΑΤ ΟΥΓΓΑΡ,34,2,16,16,0.4705882353,RespA,1,0,1,5
640,0,0,0,0,7,NoIdea,0,0,20080100036.pdf,0,3,8,1,0,1,0,0,Non-Org,0,0,0,0,0,0,0,Πα τη Δημοκρατία του Ιράκ:,26,Non-RespA,ΠΑ ΔΗΜΟΚΡΑΤ ΙΡΑΚ,16,2,16,8,0.5,RespA,1,0,1,2
641,0,0,0,0,7,NoIdea,0,0,20080100036.pdf,0,3,8,1,0,1,0,0,Non-Org,0,0,0,0,0,0,0,Για την Ισλαμική Δημοκρατία του Ιράν:,37,Non-RespA,ΓΙΑ ΙΣΛΑΜ ΔΗΜΟΚΡΑΤ ΙΡ,21,2,16,8,0.380952381,RespA,1,0,1,3
642,0,0,0,0,7,NoIdea,0,0,20080100036.pdf,0,3,0,0,0,0,0,0,Non-Org,0,0,0,0,0,0,0,Για την Ιρλανδία:,17,Non-RespA,ΓΙΑ ΙΡΛΑΝΔ,10,0,0,0,0,RespA,0,0,0,1
643,0,0,0,0,7,NoIdea,0,0,20080100036.pdf,0,3,8,1,0,1,0,0,Non-Org,0,0,0,0,0,0,0,Για την Ιταλική Δημοκρατία:,27,Non-RespA,ΓΙΑ ΙΤΑΛ ΔΗΜΟΚΡΑΤ,17,2,16,8,0.4705882353,RespA,1,0,1,2
644,0,0,0,0,7,NoIdea,0,0,20080100036.pdf,0,3,8,2,0,2,0,0,Non-Org,0,0,0,0,0,0,0,"Για τη Λιβανέζικη Δημοκρατία
Για το Πριγκιπάτο του Λιχτενστάιν
Για τη Δημοκρατία της Λιθουανίας:",96,Non-RespA,ΓΙΑ ΛΙΒΑΝΕΖ ΔΗΜΟΚΡΑΤ ΠΡΙΓΚΙΠΑΤ ΛΙΧΤΕΝΣΤΑΙΝ ΔΗΜΟΚΡΑΤ ΛΙΘΟΥΑΝ,59,2,16,16,0.2711864407,RespA,1,0,1,8
645,0,0,0,0,7,NoIdea,0,0,20080100036.pdf,0,3,0,0,0,0,0,0,Non-Org,0,0,0,0,0,0,0,Για το Μεγάλο Δουκάτο του Λουξεμβούργου:,40,Non-RespA,ΓΙΑ ΜΕΓΑΛ ΔΟΥΚΑΤ ΛΟΥΞΕΜΒΟΥΡΓ,28,0,0,0,0,RespA,0,0,0,3
